passage,question_number,question,mc_answer1,mc_answer2,mc_answer3,mc_answer4,correct_answer_num,translated_passage,translated_question,translated_mc_answer1,translated_mc_answer2,translated_mc_answer3,translated_mc_answer4
"Presbyterian history is part of the history of Christianity, but the beginning of Presbyterianism as a distinct movement occurred during the 16th-century Protestant Reformation. As the Catholic Church resisted the reformers, several different theological movements splintered from the Church and bore different denominations. Presbyterianism was especially influenced by the French theologian John Calvin, who is credited with the development of Reformed theology, and the work of John Knox, a Scotsman who studied with Calvin in Geneva, Switzerland and brought his teachings back to Scotland. The Presbyterian church traces its ancestry back primarily to England and Scotland. In August 1560 the Parliament of Scotland adopted the Scots Confession as the creed of the Scottish Kingdom. In December 1560, the First Book of Discipline was published, outlining important doctrinal issues but also establishing regulations for church government, including the creation of ten ecclesiastical districts with appointed superintendents which later became known as presbyteries.",385,Who is credited with the development of Reformed theology?,John Ca,the 16th-century,ten,the Scots Confession,1,"Presbyterian ታሪኽ እዩ ክፋል ካብ እቲ ታሪኽ ካብ ,Christianity ግን እቲ መጀመርታ ካብ Presbyterianism ከም ሓደ ዝጠፈአ ምንቅስቓስ ዝተፈጠረ አብ እዋን እቲ -16th-century Protestant .Reformation ከም እቲ Catholic ቤተ ክርስትያን resisted እቲ ,reformers ቡዙሓት ፍሉይ theological movements splintered ካብ እቲ ቤተ ክርስትያን እና ደባሪ ፍሉይ .denominations Presbyterianism ኔሩ ብፍላይ influenced ብ እቲ French theologian John ,Calvin መን እዩ credited ምስ እቲ ዕብየት ካብ Reformed ,theology እና እቲ ስራሕ ካብ John ,Knox ሓደ Scotsman መን studied ምስ Calvin አብ ውሽጢ ,Geneva Switzerland እና ምምፃእ ናቱ teachings ዝባን ናብ .Scotland እቲ Presbyterian ቤተ ክርስትያን traces ናቱ ancestry ዝባን primarily ናብ England እና .Scotland አብ ውሽጢ ነሓሰ 1560 እቲ Parliament ካብ Scotland adopted እቲ Scots Confession ከም እቲ creed ካብ እቲ Scottish .Kingdom አብ ውሽጢ ታሕሳስ ,1560 እቲ መጀመርታ መፅሓፍ ካብ ስርዓት ኔሩ ,published outlining ጠቃሚ doctrinal ፀገማት ግን እውን establishing regulations ን ቤተ ክርስትያን ,መንግስቲ ይሓውስ እቲ creation ካብ ዓሰርተ ecclesiastical districts ምስ appointed superintendents አየናይ ዳሕራይ ኮይኑ ፍሉጥ ከም .presbyteries",መን እዩ credited ምስ እቲ ዕብየት ካብ Reformed ?theology,John Ca,እቲ -16th-century,ዓሰርተ,እቲ Scots Confession
"The Vietnam War is often regarded as a low point for the U.S. Army due to the use of drafted personnel, the unpopularity of the war with the American public, and frustrating restrictions placed on the military by American political leaders. While American forces had been stationed in the Republic of Vietnam since 1959, in intelligence & advising/training roles, they did not deploy in large numbers until 1965, after the Gulf of Tonkin Incident. American forces effectively established and maintained control of the ""traditional"" battlefield, however they struggled to counter the guerrilla hit and run tactics of the communist Viet Cong and the North Vietnamese Army. On a tactical level, American soldiers (and the U.S. military as a whole) did not lose a sizable battle.",386,What war is often regarded as a low point for the US Army?,American,The Vietnam War,U.S.,intelligence & advising,2,"እቲ Vietnam ውግእ እዩ ኩል ግዘ regarded ከም ሓደ ውሑድ ነጥቢ ን እቲ ..U.S ሰራዊት መወዳእታ ናብ እቲ ጥቅሚ ካብ drafted ,personnel እቲ unpopularity ካብ እቲ ውግእ ምስ እቲ American ,ህዝባዊ እና frustrating restrictions placed አብ ልዕሊ እቲ ወተሃደራዊ ኣገልግሎት ብ American political .leaders እስካብ American forces ዝነበረ ዝነበረ stationed አብ ውሽጢ እቲ Republic ካብ Vietnam ካብ ,1959 አብ ውሽጢ ምስትውዓል & /advising/training ,roles ንሶም ግቡር ዘይኮነ ኣውዓሎ አብ ውሽጢ ገዚፍ numbers ክሳብ ,1965 ድሕሪ እቲ Gulf ካብ Tonkin .ፍጻመ American forces effectively ዝተመስረተ እና maintained ምቁጽጻር ካብ እቲ """"ባህላዊ ,battlefield ዋላኳ ተኾነ ንሶም struggled ናብ ቆጻሪ እቲ guerrilla በሎ እና ጉየ tactics ካብ እቲ communist Viet Cong እና እቲ ሰሜን Vietnamese .ሰራዊት አብ ልዕሊ ሓደ tactical ,ብርኪ American soldiers (እና እቲ ..U.S ወተሃደራዊ ኣገልግሎት ከም ሓደ )ሙሉእ ግቡር ዘይኮነ ምስኣን ሓደ sizable .ውግእ",እንታይ ውግእ እዩ ኩል ግዘ regarded ከም ሓደ ውሑድ ነጥቢ ን እቲ ንሕና ?ሰራዊት,American,እቲ Vietnam ውግእ,..U.S,ምስትውዓል & advising
"In 2007, two FAA whistleblowers, inspectors Charalambe ""Bobby"" Boutris and Douglas E. Peters, alleged that Boutris said he attempted to ground Southwest after finding cracks in the fuselage, but was prevented by supervisors he said were friendly with the airline. This was validated by a report by the Department of Transportation which found FAA managers had allowed Southwest Airlines to fly 46 airplanes in 2006 and 2007 that were overdue for safety inspections, ignoring concerns raised by inspectors. Audits of other airlines resulted in two airlines grounding hundreds of planes, causing thousands of flight cancellations. The House Transportation and Infrastructure Committee held hearings in April 2008. Jim Oberstar, former chairman of the committee said its investigation uncovered a pattern of regulatory abuse and widespread regulatory lapses, allowing 117 aircraft to be operated commercially although not in compliance with FAA safety rules. Oberstar said there was a ""culture of coziness"" between senior FAA officials and the airlines and ""a systematic breakdown"" in the FAA's culture that resulted in ""malfeasance, bordering on corruption."" In 2008 the FAA proposed to fine Southwest $10.2 million for failing to inspect older planes for cracks, and in 2009 Southwest and the FAA agreed that Southwest would pay a $7.5 million penalty and would adopt new safety procedures, with the fine doubling if Southwest failed to follow through.",387,What was the name of the whistleblower that accused Boutris of trying to ground Southwest?,Charalambe,FAA,April 2008,hundreds,1,"አብ ውሽጢ ,2007 ክልተ FAA ,whistleblowers inspectors Charalambe """"Bobby Boutris እና Douglas .E ,Peters alleged እቲ Boutris ኢሉ ንሱ attempted ናብ ምድሪ Southwest ድሕሪ finding cracks አብ ውሽጢ እቲ ,fuselage ግን ኔሩ prevented ብ supervisors ንሱ ኢሉ ኔሮም ምቕሉል ምስ እቲ .airline እዚ ኔሩ validated ብ ሓደ ኣፍልጥ ብ እቲ ክፍሊ ካብ መጓዓዝያ አየናይ ተረኺቡ FAA managers ዝነበረ ተፈቂዱሉ Southwest Airlines ናብ ንፈር 46 airplanes አብ ውሽጢ 2006 እና 2007 እቲ ኔሮም overdue ን ድሕንነት ,inspections ignoring concerns ተሰአ ብ .inspectors Audits ካብ ካልእ airlines resulted አብ ውሽጢ ክልተ airlines grounding hundreds ካብ ,planes causing thousands ካብ በረራ .cancellations እቲ ገዛ መጓዓዝያ እና Infrastructure Committee ተገይሩ hearings አብ ውሽጢ ጉንበት .2008 Jim ,Oberstar ናይ ቀደም chairman ካብ እቲ committee ኢሉ ናቱ investigation uncovered ሓደ ንድፊ ካብ regulatory ፀረፈ እና widespread regulatory ,lapses allowing 117 aircraft ናብ ኩን operated commercially ዋላ እኳ ዘይኮነ አብ ውሽጢ ምእዙዝነት ምስ FAA ድሕንነት .ስርዓታት Oberstar ኢሉ ኣብቲ ኔሩ ሓደ ""ባህሊ ካብ ""coziness አብ መንጎ ላዕለዋይ FAA officials እና እቲ airlines እና ""ሓደ systematic ""breakdown አብ ውሽጢ እቲ 'FAA's ባህሊ እቲ resulted አብ ውሽጢ "",malfeasance bordering አብ ልዕሊ .""corruption አብ ውሽጢ 2008 እቲ FAA proposed ናብ ደሓን Southwest $.10.2 ሚልዮን ን failing ናብ inspect older planes ን ,cracks እና አብ ውሽጢ 2009 Southwest እና እቲ FAA agreed እቲ Southwest ይኸውን ክፈል ሓደ $.7.5 ሚልዮን penalty እና ይኸውን ተቐባልነት ሓድሽ ድሕንነት ,procedures ምስ እቲ ደሓን doubling እንተ Southwest ወዲቑ ናብ ተኸተል .ብውሽጢ",እንታይ ኔሩ እቲ ሽም ካብ እቲ whistleblower እቲ ተኸሰሰ Boutris ካብ trying ናብ ምድሪ ?Southwest,Charalambe,FAA,ጉንበት 2008,hundreds
"Depleted uranium is also used as a shielding material in some containers used to store and transport radioactive materials. While the metal itself is radioactive, its high density makes it more effective than lead in halting radiation from strong sources such as radium. Other uses of depleted uranium include counterweights for aircraft control surfaces, as ballast for missile re-entry vehicles and as a shielding material. Due to its high density, this material is found in inertial guidance systems and in gyroscopic compasses. Depleted uranium is preferred over similarly dense metals due to its ability to be easily machined and cast as well as its relatively low cost. The main risk of exposure to depleted uranium is chemical poisoning by uranium oxide rather than radioactivity (uranium being only a weak alpha emitter).",388,What metal is used in containers to store and transport radioactive materials?,—,—,depleted uranium,—,3,"Depleted uranium እዩ እውን ዘገልገለ ከም ሓደ shielding ናውቲ አብ ውሽጢ ንእሽተይ containers ዘገልገለ ናብ መኽዝን እና መጓዓዝያ radioactive .materials እስካብ እቲ ሓጺን itself እዩ ,radioactive ናቱ ላዕሊ ፃዕቒ makes እቲ ነገር ቡዙሕ ውፅኢታዊ ካብ ምራሕ አብ ውሽጢ halting radiation ካብ ጠንካራ sources ከምዚ ከም .radium ካልእ uses ካብ depleted uranium ይሓውስ counterweights ን aircraft ምቁጽጻር ,surfaces ከም ballast ን missile -re-entry vehicles እና ከም ሓደ shielding .ናውቲ መወዳእታ ናብ ናቱ ላዕሊ ,ፃዕቒ እዚ ናውቲ እዩ ተረኺቡ አብ ውሽጢ inertial ሓጋዚ systems እና አብ ውሽጢ gyroscopic .compasses Depleted uranium እዩ preferred ልዕሊ similarly dense metals መወዳእታ ናብ ናቱ ተኽእሎ ናብ ኩን ብቐሊሉ machined እና ምስሊ ከም ደሓን ከም ናቱ relatively ውሑድ .ዋጋ እቲ ዋና ሓደጋ ካብ ተቃላዕነት ናብ depleted uranium እዩ chemical poisoning ብ uranium oxide ይመርፅ ካብ radioactivity (uranium ፍጥረት ጥራሕ ሓደ ድኹም alpha ).emitter",እንታይ ሓጺን እዩ ዘገልገለ አብ ውሽጢ containers ናብ መኽዝን እና መጓዓዝያ radioactive ?materials,—,—,depleted uranium,—
"The Chicago Cubs are an American professional baseball team located on the North Side of Chicago, Illinois. The Cubs compete in Major League Baseball (MLB) as a members of the National League (NL) Central division; the team plays its home baseball games at Wrigley Field. The Cubs are also one of two active major league teams based in Chicago; the other is the Chicago White Sox, who are a member of the American League (AL) Central division. The team is currently owned by Thomas S. Ricketts, son of TD Ameritrade founder Joe Ricketts.",389,"What professional baseball team is located in Chicago, IL?",Cubs,one,TD Ameritrade,Thomas S. Ricketts,1,"እቲ Chicago Cubs እዮም ሓደ American በዓል ልምዲ baseball ጉጅለ located አብ ልዕሊ እቲ ሰሜን ጎኒ ካብ ,Chicago .Illinois እቲ Cubs ሙሉእ አብ ውሽጢ ዋና League Baseball ()MLB ከም ሓደ members ካብ እቲ ሃገራዊ League ()NL Central ;division እቲ ጉጅለ plays ናቱ ገዛ baseball games ኣብ Wrigley .ሜዳ እቲ Cubs እዮም እውን ሓደ ካብ ክልተ ንቑሕ ዋና league teams መሰረት ዝገበረ አብ ውሽጢ ;Chicago እቲ ካልእ እዩ እቲ Chicago ፃዕዳ ,Sox መን እዮም ሓደ member ካብ እቲ American League ()AL Central .division እቲ ጉጅለ እዩ አብዚ ሕዚ owned ብ Thomas .S ,Ricketts son ካብ TD Ameritrade founder Joe .Ricketts","እንታይ በዓል ልምዲ baseball ጉጅለ እዩ located አብ ውሽጢ ,Chicago ?IL",Cubs,ሓደ,TD Ameritrade,Thomas .S Ricketts
"Even though there is a broad scientific agreement that essentialist and typological conceptualizations of race are untenable, scientists around the world continue to conceptualize race in widely differing ways, some of which have essentialist implications. While some researchers sometimes use the concept of race to make distinctions among fuzzy sets of traits, others in the scientific community suggest that the idea of race often is used in a naive or simplistic way,[page needed] and argue that, among humans, race has no taxonomic significance by pointing out that all living humans belong to the same species, Homo sapiens, and subspecies, Homo sapiens sapiens.",390,What kind of agreement does there have on the essentialist and typological concepts of race?,—,a broad scientific agreement,—,—,2,"ሙሉእ እኳ ኣብቲ እዩ ሓደ ሰፊሕ scientific ውዕሊ እቲ essentialist እና typological conceptualizations ካብ ዘርኢ እዮም ,untenable ሳይንቲስት አብ ከባቢ እቲ ዓለም ቀፃሊ ናብ conceptualize ዘርኢ አብ ውሽጢ widely differing ,ways ንእሽተይ ካብ አየናይ ኣለኒ essentialist .implications እስካብ ንእሽተይ researchers ሓደ ሓደ ግዘ ጥቅሚ እቲ ጭብጢ ካብ ዘርኢ ናብ ስራሕ distinctions ካብዞም fuzzy sets ካብ ,ባህርያት others አብ ውሽጢ እቲ scientific ማሕበረሰብ ሓሳብ ምቕራብ እቲ እቲ ሓሳብ ካብ ዘርኢ ኩል ግዘ እዩ ዘገልገለ አብ ውሽጢ ሓደ ገርሂ ወይ simplistic ,[way,[page ]needed እና ምክታዕ ,እቲ ካብዞም ,humans ዘርኢ ኣለዎ አይኮንን taxonomic significance ብ pointing ደገ እቲ ኩሎም ምንባር humans ናሃቱ ናብ እቲ ማዕረ ,ዓሌታት Homo ,sapiens እና ,subspecies Homo sapiens .sapiens",እንታይ ርህሩህ ካብ ውዕሊ ምግባር ኣብቲ ኣለኒ አብ ልዕሊ እቲ essentialist እና typological concepts ካብ ?ዘርኢ,—,ሓደ ሰፊሕ scientific ውዕሊ,—,—
"The university's Medical Center and University Hospital are located in Kansas City, Kansas. The Edwards Campus is in Overland Park, Kansas, in the Kansas City metropolitan area. There are also educational and research sites in Parsons and Topeka, and branches of the University of Kansas School of Medicine in Wichita and Salina. The university is one of the 62 members of the Association of American Universities.",391,Where is the University of Kansas Medical Center located?,the Association of American Universities,62,one,Kansas City,4,"እቲ 'university's ሕክምና ማእኸል እና ዩኒቨርሲቲ ሆስፒታል እዮም located አብ ውሽጢ Kansas ,ከተማ .Kansas እቲ Edwards Campus እዩ አብ ውሽጢ Overland ,መናፈሻ ,Kansas አብ ውሽጢ እቲ Kansas ከተማ metropolitan .ስፍሓት ኣብቲ እዮም እውን educational እና ፅንዓት sites አብ ውሽጢ Parsons እና ,Topeka እና branches ካብ እቲ ዩኒቨርሲቲ ካብ Kansas ቤት ትምህርቲ ካብ መድሓኒት አብ ውሽጢ Wichita እና .Salina እቲ ዩኒቨርሲቲ እዩ ሓደ ካብ እቲ 62 members ካብ እቲ ማሕበር ካብ American .Universities",አበይ እዩ እቲ ዩኒቨርሲቲ ካብ Kansas ሕክምና ማእኸል ?located,እቲ ማሕበር ካብ American Universities,62,ሓደ,Kansas ከተማ
"Relations between Grand Lodges are determined by the concept of Recognition. Each Grand Lodge maintains a list of other Grand Lodges that it recognises. When two Grand Lodges recognise and are in Masonic communication with each other, they are said to be in amity, and the brethren of each may visit each other's Lodges and interact Masonically. When two Grand Lodges are not in amity, inter-visitation is not allowed. There are many reasons why one Grand Lodge will withhold or withdraw recognition from another, but the two most common are Exclusive Jurisdiction and Regularity.",392,What do Masonic relations between?,one,Grand Lodges,Exclusive Jurisdiction,two,2,"Relations አብ መንጎ Grand Lodges እዮም ብጉስ ብ እቲ ጭብጢ ካብ .ተፈላጥነት ሕድሕድ Grand Lodge maintains ሓደ ዝርዝር ካብ ካልእ Grand Lodges እቲ እቲ ነገር .recognises መዓዝ ክልተ Grand Lodges recognise እና እዮም አብ ውሽጢ Masonic ሓሳብ ንሓሳብ ምልውዋጥ ምስ ሕድሕድ ,ካልእ ንሶም እዮም ኢሉ ናብ ኩን አብ ውሽጢ ,amity እና እቲ brethren ካብ ሕድሕድ ተዝኸዉን ጎብንይ ሕድሕድ 'other's Lodges እና ተፅዕኖ ምሕዳር .Masonically መዓዝ ክልተ Grand Lodges እዮም ዘይኮነ አብ ውሽጢ ,amity -inter-visitation እዩ ዘይኮነ .ተፈቂዱሉ ኣብቲ እዮም ቡዙሕ reasons ንምንታይ ሓደ Grand Lodge ንመፃእ withhold ወይ ምቁራፅ ተፈላጥነት ካብ ,ካልእ ግን እቲ ክልተ ብጥዕሚ ልሙድ እዮም ንበይኑ Jurisdiction እና .Regularity",እንታይ ግበር Masonic relations ?አብ መንጎ,ሓደ,Grand Lodges,ንበይኑ Jurisdiction,ክልተ
"After independence, the Chief Commissioner's Province of H.P. came into being on 15 April 1948 as a result of integration of 28 petty princely states (including feudal princes and zaildars) in the promontories of the western Himalaya, known in full as the Simla Hills States and four Punjab southern hill states by issue of the Himachal Pradesh (Administration) Order, 1948 under Sections 3 and 4 of the Extra-Provincial Jurisdiction Act, 1947 (later renamed as the Foreign Jurisdiction Act, 1947 vide A.O. of 1950). The State of Bilaspur was merged in the Himachal Pradesh on 1 April 1954 by the Himachal Pradesh and Bilaspur (New State) Act, 1954. Himachal became a part C state on 26 January 1950 with the implementation of the Constitution of India and the Lt. Governor was appointed. Legislative Assembly was elected in 1952. Himachal Pradesh became a union territory on 1 November 1956. Following area of Punjab State namely Simla, Kangra, Kulu and Lahul and Spiti Districts, Nalagarh tehsil of Ambala District, Lohara, Amb and Una kanungo circles, some area of Santokhgarh kanungo circle and some other specified area of Una tehsil of Hoshiarpur District besides some parts of Dhar Kalan Kanungo circle of Pathankot tehsil of Gurdaspur District; were merged with Himachal Pradesh on 1 November 1966 on enactment of Punjab Reorganisation Act, 1966 by the Parliament. On 18 December 1970, the State of Himachal Pradesh Act was passed by Parliament and the new state came into being on 25 January 1971. Thus Himachal emerged as the 18th state of the Indian Union.",393,When did the Chief Commissioner's Province of Himachal Pradesh come into being?,four,Punjab,15 April 1948,Kangra,3,"ድሕሪ ,independence እቲ ሓለቓ 'Commissioner's ገጸር ካብ ..H.P መጺኡ ናብ ውሽጢ ፍጥረት አብ ልዕሊ 15 ጉንበት 1948 ከም ሓደ ውፅኢት ካብ integration ካብ 28 petty princely states (ይሓውስ feudal princes እና )zaildars አብ ውሽጢ እቲ promontories ካብ እቲ western ,Himalaya ፍሉጥ አብ ውሽጢ ሙሉእ ከም እቲ Simla Hills States እና ዓርባዕተ Punjab southern ኮረብታ states ብ ፀገም ካብ እቲ Himachal Pradesh ()Administration ,ስርዓት 1948 ትሕቲ Sections 3 እና 4 ካብ እቲ -Extra-Provincial Jurisdiction ,ፍፃመ 1947 (ዳሕራይ renamed ከም እቲ ናይ ወፃእ Jurisdiction ,ፍፃመ 1947 vide ..A.O ካብ ).1950 እቲ ግዝኣት ካብ Bilaspur ኔሩ merged አብ ውሽጢ እቲ Himachal Pradesh አብ ልዕሊ 1 ጉንበት 1954 ብ እቲ Himachal Pradesh እና Bilaspur (ሓድሽ )ግዝኣት ,ፍፃመ .1954 Himachal ኮይኑ ሓደ ክፋል C ግዝኣት አብ ልዕሊ 26 ጥሪ 1950 ምስ እቲ implementation ካብ እቲ Constitution ካብ ህንዲ እና እቲ .Lt Governor ኔሩ .appointed Legislative ኣኼባ ኔሩ elected አብ ውሽጢ .1952 Himachal Pradesh ኮይኑ ሓደ union ግዝኣት አብ ልዕሊ 1 ሕዳር .1956 ምኽታል ስፍሓት ካብ Punjab ግዝኣት namely ,Simla ,Kangra Kulu እና Lahul እና Spiti ,Districts Nalagarh tehsil ካብ Ambala ,ኣውራጃ ,Lohara Amb እና Una kanungo ,circles ንእሽተይ ስፍሓት ካብ Santokhgarh kanungo ክቢ እና ንእሽተይ ካልእ specified ስፍሓት ካብ Una tehsil ካብ Hoshiarpur ኣውራጃ ጎና ጎኒ ንእሽተይ parts ካብ Dhar Kalan Kanungo ክቢ ካብ Pathankot tehsil ካብ Gurdaspur ;ኣውራጃ ኔሮም merged ምስ Himachal Pradesh አብ ልዕሊ 1 ሕዳር 1966 አብ ልዕሊ enactment ካብ Punjab Reorganisation ,ፍፃመ 1966 ብ እቲ .Parliament አብ ልዕሊ 18 ታሕሳስ ,1970 እቲ ግዝኣት ካብ Himachal Pradesh ፍፃመ ኔሩ ሓሊፉ ብ Parliament እና እቲ ሓድሽ ግዝኣት መጺኡ ናብ ውሽጢ ፍጥረት አብ ልዕሊ 25 ጥሪ .1971 ስለዝኾነ Himachal emerged ከም እቲ 18th ግዝኣት ካብ እቲ Indian .Union",መዓዝ ግቡር እቲ ሓለቓ 'Commissioner's ገጸር ካብ Himachal Pradesh ንዓ ናብ ውሽጢ ?ፍጥረት,ዓርባዕተ,Punjab,15 ጉንበት 1948,Kangra
"Scholars have debated the relationship and differences within āstika philosophies and with nāstika philosophies, starting with the writings of Indologists and Orientalists of the 18th and 19th centuries, which were themselves derived from limited availability of Indian literature and medieval doxographies. The various sibling traditions included in Hindu philosophies are diverse, and they are united by shared history and concepts, same textual resources, similar ontological and soteriological focus, and cosmology. While Buddhism and Jainism are considered distinct philosophies and religions, some heterodox traditions such as Cārvāka are often considered as distinct schools within Hindu philosophy.",394,In what two centuries have scholars debated the relationship of stika and nstika philosophies?,Hindu,Indian,Cārvāka,the 18th and 19th centuries,4,"Scholars ኣለኒ debated እቲ ርክብ እና differences አብ ውሽጢ āstika philosophies እና ምስ nāstika ,philosophies starting ምስ እቲ writings ካብ Indologists እና Orientalists ካብ እቲ 18th እና 19th ,centuries አየናይ ኔሮም ባዕሎም derived ካብ limited availability ካብ Indian ስነ ጽሑፍ እና medieval .doxographies እቲ ዝተፈላለዩ ኣሕዋት traditions included አብ ውሽጢ Hindu philosophies እዮም ,ዝተፈላለየ እና ንሶም እዮም united ብ shared ታሪኽ እና ,concepts ማዕረ textual ,ምንጭታት ተመሳሳሊ ontological እና soteriological ,ቀልቢ ምግባር እና .cosmology እስካብ Buddhism እና Jainism እዮም ገምገመ ዝጠፈአ philosophies እና ,religions ንእሽተይ heterodox traditions ከምዚ ከም Cārvāka እዮም ኩል ግዘ ገምገመ ከም ዝጠፈአ schools አብ ውሽጢ Hindu .ፍልስፍና",አብ ውሽጢ እንታይ ክልተ centuries ኣለኒ scholars debated እቲ ርክብ ካብ stika እና nstika ?philosophies,Hindu,Indian,Cārvāka,እቲ 18th እና 19th centuries
