passage,question_number,question,mc_answer1,mc_answer2,mc_answer3,mc_answer4,correct_answer_num,translated_passage,translated_question,translated_mc_answer1,translated_mc_answer2,translated_mc_answer3,translated_mc_answer4
"The styles that resulted fall within several categories. In the mainstream of Georgian style were both Palladian architecture— and its whimsical alternatives, Gothic and Chinoiserie, which were the English-speaking world's equivalent of European Rococo. From the mid-1760s a range of Neoclassical modes were fashionable, associated with the British architects Robert Adam, James Gibbs, Sir William Chambers, James Wyatt, George Dance the Younger, Henry Holland and Sir John Soane. John Nash was one of the most prolific architects of the late Georgian era known as The Regency style, he was responsible for designing large areas of London. Greek Revival architecture was added to the repertory, beginning around 1750, but increasing in popularity after 1800. Leading exponents were William Wilkins and Robert Smirke.",473,In what decade were several styles of architecture introduced to Georgian architecture?,Palladian,John Nash,Gothic,the mid-1760s,4,እቲ ውጽኢት ዘስዓበ ቅዲታት ኣብ ሓያሎ ምድባት ይወድቕ። ኣብቲ ቀንዲ መስመር ናይ ጆርጅያ ቅዲ ክልቲኦም ፓላድያዊ ስነ ህንጻ ​​ነበሩ- ከምኡ’ውን እቲ እንግሊዝኛ ዝዛረብ ዓለም መዓረ ኤውሮጳዊ ሮኮኮ ዝነበረ፡ ጎቲክን ቺኖይዘርን ዝበሃል ሸንኮለል ዝብል ኣማራጺታቱን ነበረ። ካብ መፋርቕ 1760ታት ጀሚሩ ዝተፈላለየ ኒዮክላሲካል ሞድታት ፋሽን እዩ ነይሩ፣ ምስ እንግሊዛውያን ኣርኪተክተራት ሮበርት ኣዳም፣ ጀምስ ጊብስ፣ ሰር ዊልያም ቻምበርስ፣ ጀምስ ዋያት፣ ጆርጅ ዳንስ ዘ ያንገር፣ ሄንሪ ሆላንድን ሰር ጆን ሶኣንን ዝተኣሳሰር እዩ። ጆን ናሽ ሓደ ካብቶም ኣዝዮም ፍርያም ዝኾኑ ኣርኪተክተራት ናይ ነፍስሄር ዘመን ጆርጅያ ብሪጀንሲ ስታይል ዝፍለጥ እዩ ነይሩ፣ ንሱ ድማ ሰፊሕ ከባቢታት ለንደን ናይ ምህዛን ሓላፍነት ነይርዎ። ናይ ግሪኽ ትንሳኤ ስነ ህንጻ ​​ኣብ ሬፐርቶሪ ተወሰኸ፣ ካብ ከባቢ 1750 ጀሚሩ፣ ግን ድሕሪ 1800 ተፈታውነቱ ይውስኽ።መሪሕቲ ኤክስፖነንት ዊልያም ዊልኪንስን ሮበርት ስሚርከን እዮም።,ኣብ ኣየናይ ዓሰርተ ዓመት ሓያሎ ቅዲታት ስነ-ህንጻ ምስ ስነ ህንጻ ​​ጆርጅያ ተኣታትዩ?,ፓላድያን,ጆን ናሽ,ጎቲክ,መፋርቕ 1760ታት .
"What is known in Iranian linguistic history as the ""Middle Iranian"" era is thought to begin around the 4th century BCE lasting through the 9th century. Linguistically the Middle Iranian languages are conventionally classified into two main groups, Western and Eastern.",474,How many main groups is the Middle Iranian language generally classified into?,two,Middle Iranian,Western,the 9th century,1,"እቲ ኣብ ታሪኽ ቋንቋ ኢራን ዝፍለጥ ዘመን ""ማእከላይ ኢራናዊ"" ዘመን ኣብ ከባቢ 4ይ ክፍለ ዘመን ክሳብ 9 ክፍለ ዘመን ዝጸንሕ ክጅምር ይግመት። ብቋንቋ ማእከላይ ቋንቋታት ኢራን ብተለምዶ ኣብ ክልተ ቀንዲ ጉጅለታት ምዕራባውን ምብራቓውን ይምደቡ።",እቲ ማእከላይ ኢራን ቋንቋ ብሓፈሻ ኣብ ክንደይ ቀንዲ ጉጅለታት እዩ ዝምደብ?,ክልተ,ማእከላይ ኢራናዊ,ምዕራባውያን,9ይ ክፍለ ዘመን
"What is known in Iranian linguistic history as the ""Middle Iranian"" era is thought to begin around the 4th century BCE lasting through the 9th century. Linguistically the Middle Iranian languages are conventionally classified into two main groups, Western and Eastern.",474,How many main groups is the Middle Iranian language generally classified into?,two,Middle Iranian,Western,the 9th century,1,"እቲ ኣብ ታሪኽ ቋንቋ ኢራን ዝፍለጥ ዘመን ""ማእከላይ ኢራናዊ"" ዘመን ኣብ ከባቢ 4ይ ክፍለ ዘመን ክሳብ 9 ክፍለ ዘመን ዝጸንሕ ክጅምር ይግመት። ብቋንቋ ማእከላይ ቋንቋታት ኢራን ብተለምዶ ኣብ ክልተ ቀንዲ ጉጅለታት ምዕራባውን ምብራቓውን ይምደቡ።",እቲ ማእከላይ ኢራን ቋንቋ ብሓፈሻ ኣብ ክንደይ ቀንዲ ጉጅለታት እዩ ዝምደብ?,ክልተ,ማእከላይ ኢራናዊ,ምዕራባውያን,9ይ ክፍለ ዘመን
"It is estimated that 5.5 million tonnes of uranium exists in ore reserves that are economically viable at US$59 per lb of uranium, while 35 million tonnes are classed as mineral resources (reasonable prospects for eventual economic extraction). Prices went from about $10/lb in May 2003 to $138/lb in July 2007. This has caused a big increase in spending on exploration, with US$200 million being spent worldwide in 2005, a 54% increase on the previous year. This trend continued through 2006, when expenditure on exploration rocketed to over $774 million, an increase of over 250% compared to 2004. The OECD Nuclear Energy Agency said exploration figures for 2007 would likely match those for 2006.",475,How much was spent worldwide on exploration in 2005?,The OECD Nuclear Energy Agency,US$200 million,59,54%,2,ኣብ ዕቑር ማዕድን 5.5 ሚልዮን ቶን ዩራንየም ከም ዘሎ ይግመት እዚ ​​ድማ ንሓደ ፓውንድ ዩራንየም ብቑጠባ 59 ዶላር ኣመሪካ ሩፒ ክግበር እንከሎ፡ 35 ሚልዮን ቶን ድማ ከም ማዕድናዊ ሃብቲ ዝምደብ (ንናይ መወዳእታ ቁጠባዊ ምውጻእ ምኽንያታዊ ተስፋ) ከም ዝምደብ ይግመት። ዋጋታት ካብ ኣስታት $10/lb ኣብ ግንቦት 2003 ናብ $138/lb ኣብ ሓምለ 2007 በጺሑ።እዚ ድማ ኣብ ዳህሳስ ዓቢ ወሰኽ ወጻኢታት ኣስዒቡ፡ ኣብ 2005 ኣብ መላእ ዓለም 200 ሚልዮን ዶላር ኣመሪካ ክውዕል ከሎ፡ እዚ ድማ ኣብ ዝሓለፈ ዓመት ብ54% ወሰኽ ኣርእዩ። እዚ ኣንፈት እዚ ክሳብ 2006 ቀጺሉ፡ ወጻኢታት ኣብ ዳህሳስ ሮኬት ናብ ልዕሊ 774 ሚልዮን ዶላር ምስ በጽሐ፡ ልዕሊ 250% ወሰኽ ምስ 2004 ክነጻጸር እንከሎ ልዕሊ 250% ወሰኽ ኣርእዩ።ኤጀንሲ ኒኩለር ኦኢሲዲ ን2007 ዝኸውን ናይ ዳህሳስ ኣሃዛት ምስቶም ን2006 ምስኡ ክሰማማዕ ከም ዝኽእል ገሊጹ።,ኣብ 2005 ዓ.ም ኣብ መላእ ዓለም ኣብ ዳህሳስ ክንደይ እዩ ኣሕሊፉ?,ትካል ኒዩክለር ጸዓት OECD,200 ሚልዮን ዶላር ኣሜሪካ,59 .,54%
"It is estimated that 5.5 million tonnes of uranium exists in ore reserves that are economically viable at US$59 per lb of uranium, while 35 million tonnes are classed as mineral resources (reasonable prospects for eventual economic extraction). Prices went from about $10/lb in May 2003 to $138/lb in July 2007. This has caused a big increase in spending on exploration, with US$200 million being spent worldwide in 2005, a 54% increase on the previous year. This trend continued through 2006, when expenditure on exploration rocketed to over $774 million, an increase of over 250% compared to 2004. The OECD Nuclear Energy Agency said exploration figures for 2007 would likely match those for 2006.",475,How much was spent worldwide on exploration in 2005?,The OECD Nuclear Energy Agency,US$200 million,59,54%,2,ኣብ ዕቑር ማዕድን 5.5 ሚልዮን ቶን ዩራንየም ከም ዘሎ ይግመት እዚ ​​ድማ ንሓደ ፓውንድ ዩራንየም ብቑጠባ 59 ዶላር ኣመሪካ ሩፒ ክግበር እንከሎ፡ 35 ሚልዮን ቶን ድማ ከም ማዕድናዊ ሃብቲ ዝምደብ (ንናይ መወዳእታ ቁጠባዊ ምውጻእ ምኽንያታዊ ተስፋ) ከም ዝምደብ ይግመት። ዋጋታት ካብ ኣስታት $10/lb ኣብ ግንቦት 2003 ናብ $138/lb ኣብ ሓምለ 2007 በጺሑ።እዚ ድማ ኣብ ዳህሳስ ዓቢ ወሰኽ ወጻኢታት ኣስዒቡ፡ ኣብ 2005 ኣብ መላእ ዓለም 200 ሚልዮን ዶላር ኣመሪካ ክውዕል ከሎ፡ እዚ ድማ ኣብ ዝሓለፈ ዓመት ብ54% ወሰኽ ኣርእዩ። እዚ ኣንፈት እዚ ክሳብ 2006 ቀጺሉ፡ ወጻኢታት ኣብ ዳህሳስ ሮኬት ናብ ልዕሊ 774 ሚልዮን ዶላር ምስ በጽሐ፡ ልዕሊ 250% ወሰኽ ምስ 2004 ክነጻጸር እንከሎ ልዕሊ 250% ወሰኽ ኣርእዩ።ኤጀንሲ ኒኩለር ኦኢሲዲ ን2007 ዝኸውን ናይ ዳህሳስ ኣሃዛት ምስቶም ን2006 ምስኡ ክሰማማዕ ከም ዝኽእል ገሊጹ።,ኣብ 2005 ዓ.ም ኣብ መላእ ዓለም ኣብ ዳህሳስ ክንደይ እዩ ኣሕሊፉ?,ትካል ኒዩክለር ጸዓት OECD,200 ሚልዮን ዶላር ኣሜሪካ,59 .,54%
"Athanasius's episcopate began on 9 May 328 as the Alexandrian Council elected Athanasius to succeed the aged Alexander. That council also denounced various heresies and schisms, many of which continued to preoccupy his 45-year-long episcopate (c. 8 June 328 – 2 May 373). Patriarch Athanasius spent over 17 years in five exiles ordered by four different Roman Emperors, not counting approximately six more incidents in which Athanasius fled Alexandria to escape people seeking to take his life. This gave rise to the expression ""Athanasius contra mundum"" or ""Athanasius against the world"". However, during his first years as bishop, Athanasius visited the churches of his territory, which at that time included all of Egypt and Libya. He established contacts with the hermits and monks of the desert, including Pachomius, which proved very valuable to him over the years. Shortly thereafter, Athanasius became occupied with the theological disputes against Arians within the Byzantine Empire that would occupy much of his life.",476,When did Athanasius's episcopate begin?,four,9 May 328,five,approximately six,2,"ቤት ምኽሪ ኣሌክሳንድሪያን ነቲ ብዕድመ ዝደፍአ ኣሌክሳንደር ንምትካእ ንኣስኒስዮስ ኣብ ዝመረጸሉ እዋን ብ9 ግንቦት 328 ዝጀመረ ናይ ኣታናስዮስ ኤፒስኮፓት እዩ ጀሚሩ። እቲ ቤት ምኽሪ ዝተፈላለዩ መናፍቕነትን ምፍልላይን እውን ኣዋሃሂዱ፣ ብዙሓት ካብዚኦም ን45 ዓመት ዝጸንሕ ኤፒስኮፓትኡ ምጽናዕ ቀጺሎም (C. 8 ሰነ 328 – 2 ግንቦት 373)። ፓትርያርክ ኣትናሳይዮስ ንልዕሊ 17 ዓመታት ኣብ ሓሙሽተ ስደተኛታት ብኣርባዕተ ዝተፈላለዩ ሃጸያት ሮማውያን ተኣዚዞም፣ ኣስታት ሽዱሽተ ተወሳኺ ፍጻመታት ከይቆጸረ ኣትናስዮስ ህይወቱ ክወስድ ዝደልዩ ሰባት ንምህዳም ካብ እስክንድርያ ሃዲሙ። እዚ ድማ ነቲ ""Athanasius contra mundum"" ወይ ""Athanasius ኣንጻር ዓለም"" ዝብል ኣበሃህላ ምኽንያት ኮይኑ። ይኹን እምበር፡ ኣብተን ጳጳስ ከም ጳጳስ ኣብ ዝነበረሉ እዋን፡ ኣትናቴዎስ ናብተን ኣብቲ እዋን እቲ ኽልልቲ ግዝኣተን በጽሐ፣ እዚ ኸኣ ኣብቲ እዋን እዚ ኽልል ንዅለን ግብጽን ሊብያን ዘጠቓለለ እዩ። ምስቶም ኣብ ዝሓለፈ ዓመታት ኣዝዩ ዋጋ ዝነበሮም ፓኮሚየስ ሓዊሱ ምስቶም ባሕለኛታትን መነኮሳትን ናይቲ በረኻ ርክብ ኣጣይሹ። ድሕሪኡ ነዊሕ ከይጸንሐ፡ ኣትናቲዮስ ኣብ ውሽጢ እቲ ንመብዛሕትኡ ህይወቱ ዝሕዝ ኣብ ውሽጢ ግዝኣት ቢዛንታይን ዝነበረ ስነ-መለኮታዊ ክርክር ኣንጻር ኣርዮናውያን ተታሒዙ።",ናይ ኣትናሴስዮስ ኤፒስኮፓት መዓስ እዩ ጀሚሩ?,ኣርባዕተ,9 ግንቦት 328,ሓሙሽተ,ኣስታት ሽዱሽተ
"Athanasius's episcopate began on 9 May 328 as the Alexandrian Council elected Athanasius to succeed the aged Alexander. That council also denounced various heresies and schisms, many of which continued to preoccupy his 45-year-long episcopate (c. 8 June 328 – 2 May 373). Patriarch Athanasius spent over 17 years in five exiles ordered by four different Roman Emperors, not counting approximately six more incidents in which Athanasius fled Alexandria to escape people seeking to take his life. This gave rise to the expression ""Athanasius contra mundum"" or ""Athanasius against the world"". However, during his first years as bishop, Athanasius visited the churches of his territory, which at that time included all of Egypt and Libya. He established contacts with the hermits and monks of the desert, including Pachomius, which proved very valuable to him over the years. Shortly thereafter, Athanasius became occupied with the theological disputes against Arians within the Byzantine Empire that would occupy much of his life.",476,When did Athanasius's episcopate begin?,four,9 May 328,five,approximately six,2,"ቤት ምኽሪ ኣሌክሳንድሪያን ነቲ ብዕድመ ዝደፍአ ኣሌክሳንደር ንምትካእ ንኣስኒስዮስ ኣብ ዝመረጸሉ እዋን ብ9 ግንቦት 328 ዝጀመረ ናይ ኣታናስዮስ ኤፒስኮፓት እዩ ጀሚሩ። እቲ ቤት ምኽሪ ዝተፈላለዩ መናፍቕነትን ምፍልላይን እውን ኣዋሃሂዱ፣ ብዙሓት ካብዚኦም ን45 ዓመት ዝጸንሕ ኤፒስኮፓትኡ ምጽናዕ ቀጺሎም (C. 8 ሰነ 328 – 2 ግንቦት 373)። ፓትርያርክ ኣትናሳይዮስ ንልዕሊ 17 ዓመታት ኣብ ሓሙሽተ ስደተኛታት ብኣርባዕተ ዝተፈላለዩ ሃጸያት ሮማውያን ተኣዚዞም፣ ኣስታት ሽዱሽተ ተወሳኺ ፍጻመታት ከይቆጸረ ኣትናስዮስ ህይወቱ ክወስድ ዝደልዩ ሰባት ንምህዳም ካብ እስክንድርያ ሃዲሙ። እዚ ድማ ነቲ ""Athanasius contra mundum"" ወይ ""Athanasius ኣንጻር ዓለም"" ዝብል ኣበሃህላ ምኽንያት ኮይኑ። ይኹን እምበር፡ ኣብተን ጳጳስ ከም ጳጳስ ኣብ ዝነበረሉ እዋን፡ ኣትናቴዎስ ናብተን ኣብቲ እዋን እቲ ኽልልቲ ግዝኣተን በጽሐ፣ እዚ ኸኣ ኣብቲ እዋን እዚ ኽልል ንዅለን ግብጽን ሊብያን ዘጠቓለለ እዩ። ምስቶም ኣብ ዝሓለፈ ዓመታት ኣዝዩ ዋጋ ዝነበሮም ፓኮሚየስ ሓዊሱ ምስቶም ባሕለኛታትን መነኮሳትን ናይቲ በረኻ ርክብ ኣጣይሹ። ድሕሪኡ ነዊሕ ከይጸንሐ፡ ኣትናቲዮስ ኣብ ውሽጢ እቲ ንመብዛሕትኡ ህይወቱ ዝሕዝ ኣብ ውሽጢ ግዝኣት ቢዛንታይን ዝነበረ ስነ-መለኮታዊ ክርክር ኣንጻር ኣርዮናውያን ተታሒዙ።",ናይ ኣትናሴስዮስ ኤፒስኮፓት መዓስ እዩ ጀሚሩ?,ኣርባዕተ,9 ግንቦት 328,ሓሙሽተ,ኣስታት ሽዱሽተ
"The IJM used the grant money to found ""Project Lantern"" and established an office in the Philippines city of Cebu. In 2010 the results of the project were published, in which the IJM stated that Project Lantern had led to ""an increase in law enforcement activity in sex trafficking cases, an increase in commitment to resolving sex trafficking cases among law enforcement officers trained through the project, and an increase in services – like shelter, counseling and career training – provided to trafficking survivors"". At the time that the results were released, the IJM was exploring opportunities to replicate the model in other regions.",477,When was Project Lantern established?,IJM,Philippines,Project Lantern,2010,4,"IJM ነቲ ናይ ዕድጊ ገንዘብ ተጠቒሙ ""ፕሮጀክት ፋኑስ"" ረኺቡ ኣብ ከተማ ሴቡ ፊሊፒንስ ቤት ጽሕፈት ኣቚሙ። ኣብ 2010 ውጽኢት ናይቲ ፕሮጀክት ተሓቲሙ፡ ኣብቲ IJM ፕሮጀክት ፋኑስ ""ኣብ ጉዳያት ጾታዊ ርክብ ጾታዊ ርክብ ዝምልከት ናይ ሕጊ ምኽባር ንጥፈታት ክውስኽ፡ ኣብ መንጎ እቲ ፕሮጀክት ዝሰልጠኑ ኣኽበርቲ ሕጊ ንምፍታሕ ተወፋይነት ዝውስኽ ተወፋይነት፡ ከምኡ'ውን ምውሳኽ ኣገልግሎት - ከም መዕቆቢ፡ ምኽሪን ሞያዊ ስልጠናን - ንዘጋጥሙ ሰባት ዝተዋህበ ናይ ንግዲ ስልጠና ዝተዋህበን"" ክብል ገሊጹ ነይሩ። ኣብቲ ውጽኢት ዝተዘርግሐሉ እዋን፡ IJM ኣብ ካልኦት ዞባታት ነቲ ሞዴል ንምድጋም ዕድላት ይምርምር ነይሩ።",ፕሮጀክት ፋኑስ መዓስ እዩ ተጣይሹ?,ijm .,ፊሊፒንስ,ፕሮጀክት ፋኑስ,2010
"The IJM used the grant money to found ""Project Lantern"" and established an office in the Philippines city of Cebu. In 2010 the results of the project were published, in which the IJM stated that Project Lantern had led to ""an increase in law enforcement activity in sex trafficking cases, an increase in commitment to resolving sex trafficking cases among law enforcement officers trained through the project, and an increase in services – like shelter, counseling and career training – provided to trafficking survivors"". At the time that the results were released, the IJM was exploring opportunities to replicate the model in other regions.",477,When was Project Lantern established?,IJM,Philippines,Project Lantern,2010,4,"IJM ነቲ ናይ ዕድጊ ገንዘብ ተጠቒሙ ""ፕሮጀክት ፋኑስ"" ረኺቡ ኣብ ከተማ ሴቡ ፊሊፒንስ ቤት ጽሕፈት ኣቚሙ። ኣብ 2010 ውጽኢት ናይቲ ፕሮጀክት ተሓቲሙ፡ ኣብቲ IJM ፕሮጀክት ፋኑስ ""ኣብ ጉዳያት ጾታዊ ርክብ ጾታዊ ርክብ ዝምልከት ናይ ሕጊ ምኽባር ንጥፈታት ክውስኽ፡ ኣብ መንጎ እቲ ፕሮጀክት ዝሰልጠኑ ኣኽበርቲ ሕጊ ንምፍታሕ ተወፋይነት ዝውስኽ ተወፋይነት፡ ከምኡ'ውን ምውሳኽ ኣገልግሎት - ከም መዕቆቢ፡ ምኽሪን ሞያዊ ስልጠናን - ንዘጋጥሙ ሰባት ዝተዋህበ ናይ ንግዲ ስልጠና ዝተዋህበን"" ክብል ገሊጹ ነይሩ። ኣብቲ ውጽኢት ዝተዘርግሐሉ እዋን፡ IJM ኣብ ካልኦት ዞባታት ነቲ ሞዴል ንምድጋም ዕድላት ይምርምር ነይሩ።",ፕሮጀክት ፋኑስ መዓስ እዩ ተጣይሹ?,ijm .,ፊሊፒንስ,ፕሮጀክት ፋኑስ,2010
"According to Strabo, the Greco-Bactrians seem to have had contacts with China through the silk road trade routes (Strabo, XI.XI.I). Indian sources also maintain religious contact between Buddhist monks and the Greeks, and some Greco-Bactrians did convert to Buddhism. Demetrius, son and successor of Euthydemus, invaded north-western India in 180 BC, after the destruction of the Mauryan empire there; the Mauryans were probably allies of the Bactrians (and Seleucids). The exact justification for the invasion remains unclear, but by about 175 BC, the Greeks ruled over parts of north-western India. This period also marks the beginning of the obfuscation of Greco-Bactrian history. Demetrius possibly died about 180 BC; numismatic evidence suggest the existence of several other kings shortly thereafter. It is probable that at this point that the Greco-Bactrian kingdom split into several semi-independent regions for some years, often warring amongst themselves. Heliocles was the last Greek to clearly rule Bactria, his power collapsing in the face of central Asian tribal invasions (Scythian and Yuezhi), by about 130 BCE. However, Greek urban civilisation seems to have continued in Bactria after the fall of the kingdom, having a hellenising effect on the tribes which had displaced Greek-rule. The Kushan empire which followed continued to use Greek on their coinage and Greeks continued being influential in the empire.",478,Who seemed to have had contacts with China?,Greco-Bactrians,Kushan,Yuezhi,about 130,1,"ብመሰረት ስትራቦ፡ ግሬኮ-ባክተርያውያን ብመንገዲ መስመራት ንግዲ ጽርግያ ስልክ ምስ ቻይና ርክብ ዝነበሮም ይመስሉ (Strabo, XI.XI.I)። ምንጭታት ህንዲ ኣብ መንጎ መነኮሳት ቡድሃውያንን ግሪኻውያንን ሃይማኖታዊ ርክብ እውን ይሕልዉ እዮም፣ ገለ ግሬኮ-ባክተርያውያን ድማ ብርግጽ ናብ ቡድሂዝም ተቐይሮም እዮም። ወድን ተካኢን ዩታይደሙስ ዝኾነ ደሜጥሮስ፡ ድሕሪ ዕንወት ግዝኣት ማውርያ፡ ኣብ 180 ቅ.ል.ክ.፡ ብ180 ቅ.ል.ክ.፡ ንሰሜን ምዕራብ ህንዲ ወሪሩ፤ እቶም ማውርያውያን ምናልባት መሓዙት ባክተርያውያን (ከምኡውን ሰለውሲድ) ክኾኑ ይኽእሉ እዮም። እቲ ልክዕ ምኽንያት ናይቲ ወራር ንጹር ኣይኮነን፡ ግን ብኣስታት 175 ቅ.ል.ክ.፡ ግሪኻውያን ኣብ ልዕሊ ገለ ክፋል ሰሜናዊ ምዕራብ ህንዲ ይገዝኡ ነበሩ። እዚ እዋን እዚ ንታሪኽ ግሬኮ-ባክተርያ ምድንጋር ዝጀመረሉ እዋን እውን ዘመልክት እዩ። ዲሜጥሮስ ምናልባት ኣስታት 180 ቅ.ል.ክ. ድሕሪ ቁሩብ ግዜ ካልኦት ሓያሎ ነገስታት ምህላዎም ዕንክሊል መርትዖታት ይሕብሩ። ኣብዚ እዋን’ዚ መንግስቲ ግሬኮ-ባክተርያ ንገለ ዓመታት ኣብ ሓያሎ ፍርቂ ነጻ ዝኾኑ ዞባታት ተኸፋፊሉ፡ መብዛሕትኡ ግዜ ኣብ መንጎኦም ዝዋጋእ ምዃኑ ተኽእሎ ኣሎ። ሄሊዮክለስ ንባክተርያ ብንጹር ዝገዝእ ናይ መወዳእታ ግሪኽ እዩ ነይሩ፣ ስልጣኑ ኣብ ቅድሚ ወራር ቀቢላታት ማእከላይ ኤስያ (Scythian and Yuezhi) ዝፈርስ ብኣስታት 130 ቅ.ክ. ይኹን እምበር፡ ስልጣነ ከተማ ግሪኽ፡ ድሕሪ ውድቀት መንግስቲ ኣብ ባክርያስ ዝቐጸለ ይመስል፡ ኣብቶም ግሪኻውያን-ሕግታት ዝተመዛበሉ ቀቢላታት ሄለኒሲንግ ጽልዋ ኣሕዲሩ። እቲ ስዒቡ ዝመጸ ግዝኣት ኩሻን ኣብ ሳንቲሞም ግሪኽ ምጥቃም ቀጸለ ግሪኻውያን ድማ ኣብቲ ግዝኣት ጽልዋ ከም ዝነበሮም ቀጸለ።",ምስ ቻይና ርክብ ዝገበረ ይመስል?,ግሬኮ-ባክተርያውያን,ኩሻን,Y UE ስርዓት .,ኣስታት 130
