passage,question_number,question,mc_answer1,mc_answer2,mc_answer3,mc_answer4,correct_answer_num,translated_passage,translated_question,translated_mc_answer1,translated_mc_answer2,translated_mc_answer3,translated_mc_answer4
"There are many styles of mandolin, but four are common, the Neapolitan or round-backed mandolin, the carved-top mandolin and the flat-backed mandolin. The round-back has a deep bottom, constructed of strips of wood, glued together into a bowl. The carved-top or arch-top mandolin has a much shallower, arched back, and an arched top—both carved out of wood. The flat-backed mandolin uses thin sheets of wood for the body, braced on the inside for strength in a similar manner to a guitar. Each style of instrument has its own sound quality and is associated with particular forms of music. Neapolitan mandolins feature prominently in European classical music and traditional music. Carved-top instruments are common in American folk music and bluegrass music. Flat-backed instruments are commonly used in Irish, British and Brazilian folk music. Some modern Brazilian instruments feature an extra fifth course tuned a fifth lower than the standard fourth course.",256,How many mandolin styles are there?,four,British,Neapolitan,Brazilian,1,"ኣብቲ እዮም ቡዙሕ styles ካብ ,mandolin ግን ዓርባዕተ እዮም ,ልሙድ እቲ Neapolitan ወይ -round-backed ,mandolin እቲ -carved-top mandolin እና እቲ -flat-backed .mandolin እቲ -round-back ኣለዎ ሓደ ጥሉቅ ,ታሕተዋይ constructed ካብ strips ካብ ,ዕንጨይቲ glued ብሓባር ናብ ውሽጢ ሓደ .ኣጋር እቲ -carved-top ወይ -arch-top mandolin ኣለዎ ሓደ ብዙሕ ,shallower arched ,ዝባን እና ሓደ arched top—both carved ደገ ካብ .ዕንጨይቲ እቲ -flat-backed mandolin uses ቀጢን sheets ካብ ዕንጨይቲ ን እቲ ,ሰውነት braced አብ ልዕሊ እቲ ኣብ ውሽጢ ን ጥንካረ አብ ውሽጢ ሓደ ተመሳሳሊ ጉዳይ ናብ ሓደ .guitar ሕድሕድ ኣገባብ ካብ መሳርሒ ኣለዎ ናቱ ወንን ድምጺ ፅፈት እና እዩ ተሓባበረ ምስ ብፍሉይ forms ካብ .ሙዚቃ Neapolitan mandolins መለለዩ prominently አብ ውሽጢ European classical ሙዚቃ እና ባህላዊ .ሙዚቃ -Carved-top instruments እዮም ልሙድ አብ ውሽጢ American folk ሙዚቃ እና bluegrass .ሙዚቃ -Flat-backed instruments እዮም commonly ዘገልገለ አብ ውሽጢ ,Irish British እና Brazilian folk .ሙዚቃ ንእሽተይ ዘበናዊ Brazilian instruments መለለዩ ሓደ ተወሳኺ fifth ዓይነት ትምህርቲ tuned ሓደ fifth ታሕተዋይ ካብ እቲ መለክዒ fourth .ዓይነት ትምህርቲ",ከመይ ቡዙሕ mandolin styles እዮም ?ኣብቲ,ዓርባዕተ,British,Neapolitan,Brazilian
"North Carolina consists of three main geographic sections: the Atlantic Coastal Plain, which occupies the eastern 45% of the state; the Piedmont region, which contains the middle 35%; and the Appalachian Mountains and foothills. The extreme eastern section of the state contains the Outer Banks, a string of sandy, narrow barrier islands between the Atlantic Ocean and two inland waterways or ""sounds"": Albemarle Sound in the north and Pamlico Sound in the south. They are the two largest landlocked sounds in the United States.",257,How many major geographical sections is North Carolina?,the Atlantic Coastal Plain,three,Albemarle Sound,Pamlico Sound,2,"ሰሜን Carolina consists ካብ ሰለስተ ዋና geographic :sections እቲ Atlantic Coastal ,ጎልጎል አየናይ occupies እቲ eastern %45 ካብ እቲ ;ግዝኣት እቲ Piedmont ,ክልል አየናይ የጠቓልል እቲ ማእኸል %;35 እና እቲ Appalachian Mountains እና .foothills እቲ ጫፍ eastern ክፍሊ ካብ እቲ ግዝኣት የጠቓልል እቲ Outer ,Banks ሓደ ገመድ ካብ ,sandy ፀቢብ መከላኸሊ islands አብ መንጎ እቲ Atlantic ባሕሪ እና ክልተ inland waterways ወይ """":sounds Albemarle ድምጺ አብ ውሽጢ እቲ ሰሜን እና Pamlico ድምጺ አብ ውሽጢ እቲ .ደቡብ ንሶም እዮም እቲ ክልተ largest landlocked sounds አብ ውሽጢ እቲ United .States",ከመይ ቡዙሕ ዋና geographical sections እዩ ሰሜን ?Carolina,እቲ Atlantic Coastal ጎልጎል,ሰለስተ,Albemarle ድምጺ,Pamlico ድምጺ
"Raleigh is home to North Carolina State University and is part of the Research Triangle area, together with Durham (home of Duke University) and Chapel Hill (home of the University of North Carolina at Chapel Hill). The ""Triangle"" nickname originated after the 1959 creation of the Research Triangle Park, located in Durham & Wake Counties partway between the three cities and their universities. The Research Triangle region encompasses the U.S. Census Bureau's Raleigh-Durham-Chapel Hill Combined Statistical Area (CSA), which had an estimated population of 2,037,430 in 2013. The Raleigh Metropolitan Statistical Area (MSA) had an estimated population of 1,214,516 in 2013.",258,What city is home to North Carolina State University?,"1,214,516",Raleigh,three,"2,037,430",2,"Raleigh እዩ ገዛ ናብ ሰሜን Carolina ግዝኣት ዩኒቨርሲቲ እና እዩ ክፋል ካብ እቲ ፅንዓት Triangle ,ስፍሓት ብሓባር ምስ Durham (ገዛ ካብ Duke )ዩኒቨርሲቲ እና Chapel ኮረብታ (ገዛ ካብ እቲ ዩኒቨርሲቲ ካብ ሰሜን Carolina ኣብ Chapel ).ኮረብታ እቲ """"Triangle nickname originated ድሕሪ እቲ 1959 creation ካብ እቲ ፅንዓት Triangle ,መናፈሻ located አብ ውሽጢ Durham & ምቕስቃስ Counties partway አብ መንጎ እቲ ሰለስተ cities እና ናቶም .universities እቲ ፅንዓት Triangle ክልል encompasses እቲ ..U.S Census 'Bureau's --Raleigh-Durham-Chapel ኮረብታ Combined Statistical ስፍሓት (),CSA አየናይ ዝነበረ ሓደ ይግመት በዝሒ ህዝቢ ካብ ,,2,037,430 አብ ውሽጢ .2013 እቲ Raleigh Metropolitan Statistical ስፍሓት ()MSA ዝነበረ ሓደ ይግመት በዝሒ ህዝቢ ካብ ,,1,214,516 አብ ውሽጢ .2013",እንታይ ከተማ እዩ ገዛ ናብ ሰሜን Carolina ግዝኣት ?ዩኒቨርሲቲ,",,1,214,516",Raleigh,ሰለስተ,",,2,037,430"
"Logging was Seattle's first major industry, but by the late 19th century the city had become a commercial and shipbuilding center as a gateway to Alaska during the Klondike Gold Rush. By 1910, Seattle was one of the 25 largest cities in the country. However, the Great Depression severely damaged the city's economy. Growth returned during and after World War II, due partially to the local Boeing company, which established Seattle as a center for aircraft manufacturing. The Seattle area developed as a technology center beginning in the 1980s, with companies like Microsoft becoming established in the region. In 1994 the Internet retail giant Amazon was founded in Seattle. The stream of new software, biotechnology, and Internet companies led to an economic revival, which increased the city's population by almost 50,000 between 1990 and 2000.",259,Which company began constructing airplanes in Seattle?,Boeing,25,"almost 50,000",between 1990 and 2000,1,"Logging ኔሩ 'Seattle's መጀመርታ ዋና ,ኢንዱስትሪ ግን ብ እቲ ረፋድ 19th ዘመን እቲ ከተማ ዝነበረ ምዃን ሓደ ንግዳዊ እና shipbuilding ማእኸል ከም ሓደ gateway ናብ Alaska አብ እዋን እቲ Klondike ወርቂ .ችኮላ ብ ,1910 Seattle ኔሩ ሓደ ካብ እቲ 25 largest cities አብ ውሽጢ እቲ .ሃገር ,ዋላኳ ተኾነ እቲ ምዑዝ ጭንቀት severely damaged እቲ 'city's .ቁጠባ ዕቤት returned አብ እዋን እና ድሕሪ ዓለም ውግእ ,II መወዳእታ partially ናብ እቲ ወሽጣዊ Boeing ,ድርጅት አየናይ ዝተመስረተ Seattle ከም ሓደ ማእኸል ን aircraft .manufacturing እቲ Seattle ስፍሓት ምዕቡል ከም ሓደ ቴክኖሎጂ ማእኸል መጀመርታ አብ ውሽጢ እቲ ,1980s ምስ companies ምፍታው Microsoft becoming ዝተመስረተ አብ ውሽጢ እቲ .ክልል አብ ውሽጢ 1994 እቲ Internet ቀጥታ መሸጣ ዓብዪ Amazon ኔሩ founded አብ ውሽጢ .Seattle እቲ መመሓላለፊ ካብ ሓድሽ ,ሶፍትዌር ,biotechnology እና Internet companies መረሐ ናብ ሓደ ቁጠባዊ ,revival አየናይ ወሰኽ እቲ 'city's በዝሒ ህዝቢ ብ ዳርጋ ,50,000 አብ መንጎ 1990 እና .2000",አየናይ ድርጅት ጀሚሩ constructing airplanes አብ ውሽጢ ?Seattle,Boeing,25,"ዳርጋ ,50,000",አብ መንጎ 1990 እና 2000
"The current Minority Leader Nancy Pelosi, of the United States House of Representatives serves as floor leader of the opposition party, and is the counterpart to the Majority Leader. Unlike the Majority Leader, the Minority Leader is on the ballot for Speaker of the House during the convening of the Congress. If the Minority Leader's party takes control of the House, and the party officers are all re-elected to their seats, the Minority Leader is usually the party's top choice for Speaker for the next Congress, while the Minority Whip is typically in line to become Majority Leader. The Minority Leader usually meets with the Majority Leader and the Speaker to discuss agreements on controversial issues.",260,Who is the counterpart to the Majority Leader in the House?,Congress,Nancy Pelosi,the United States,House,2,"እቲ እዋናዊ Minority መራሒ Nancy ,Pelosi ካብ እቲ United States ገዛ ካብ Representatives serves ከም መሬት መራሒ ካብ እቲ opposition ,ጓይላ እና እዩ እቲ counterpart ናብ እቲ መብዛሕትኡ .መራሒ Unlike እቲ መብዛሕትኡ ,መራሒ እቲ Minority መራሒ እዩ አብ ልዕሊ እቲ ballot ን Speaker ካብ እቲ ገዛ አብ እዋን እቲ convening ካብ እቲ .Congress እንተ እቲ Minority 'Leader's ጓይላ takes ምቁጽጻር ካብ እቲ ,ገዛ እና እቲ ጓይላ officers እዮም ኩሎም -re-elected ናብ ናቶም ,seats እቲ Minority መራሒ እዩ ብልሙድ እቲ 'party's ላዕለዋይ ምርጫ ን Speaker ን እቲ ቀፃሊ ,Congress እስካብ እቲ Minority Whip እዩ typically አብ ውሽጢ መስመር ናብ ምዃን መብዛሕትኡ .መራሒ እቲ Minority መራሒ ብልሙድ meets ምስ እቲ መብዛሕትኡ መራሒ እና እቲ Speaker ናብ ተመያየጡ agreements አብ ልዕሊ ዘከራኽር .ፀገማት",መን እዩ እቲ counterpart ናብ እቲ መብዛሕትኡ መራሒ አብ ውሽጢ እቲ ?ገዛ,Congress,Nancy Pelosi,እቲ United States,ገዛ
"The term high definition once described a series of television systems originating from August 1936; however, these systems were only high definition when compared to earlier systems that were based on mechanical systems with as few as 30 lines of resolution. The ongoing competition between companies and nations to create true ""HDTV"" spanned the entire 20th century, as each new system became more HD than the last.In the beginning of the 21st century, this race has continued with 4k, 5k and current 8K systems.",261,What time spanned the competition between companies and nations to create true HDTV?,the entire 20th century,5k,4k,as few as 30,1,"እቲ ቃል ላዕሊ ኣገላልፃ ሓንሳዕ described ሓደ ተኸታታሊ ካብ television systems originating ካብ ነሓሰ ;1936 ,ዋላኳ ተኾነ እዚ systems ኔሮም ጥራሕ ላዕሊ ኣገላልፃ መዓዝ compared ናብ ኣቕድም ኣቢሉ systems እቲ ኔሮም መሰረት ዝገበረ አብ ልዕሊ mechanical systems ምስ ከም ቁሩብ ከም 30 lines ካብ .መፍትሒ ምሃብ እቲ ongoing ውድድር አብ መንጎ companies እና nations ናብ ፍጠር ሓቂ """"HDTV spanned እቲ ጠቅላላ 20th ,ዘመን ከም ሕድሕድ ሓድሽ ስርዓት ኮይኑ ቡዙሕ HD ካብ እቲ .last.In እቲ መጀመርታ ካብ እቲ 21st ,ዘመን እዚ ዘርኢ ኣለዎ continued ምስ ,4k 5k እና እዋናዊ 8K .systems",እንታይ ግዜ spanned እቲ ውድድር አብ መንጎ companies እና nations ናብ ፍጠር ሓቂ ?HDTV,እቲ ጠቅላላ 20th ዘመን,5k,4k,ከም ቁሩብ ከም 30
"The relative pitches of individual notes in a scale may be determined by one of a number of tuning systems. In the west, the twelve-note chromatic scale is the most common method of organization, with equal temperament now the most widely used method of tuning that scale. In it, the pitch ratio between any two successive notes of the scale is exactly the twelfth root of two (or about 1.05946). In well-tempered systems (as used in the time of Johann Sebastian Bach, for example), different methods of musical tuning were used. Almost all of these systems have one interval in common, the octave, where the pitch of one note is double the frequency of another. For example, if the A above middle C is 440 Hz, the A an octave above that is 880 Hz (info).",262,What is the pitch ratio between any two successive notes of the scale exactly?,about 1.05946,880 Hz,Johann Sebastian Bach,twelfth,4,"እቲ ዘመድ pitches ካብ ውልቀ ሰብ notes አብ ውሽጢ ሓደ መለክዒ ተዝኸዉን ኩን ብጉስ ብ ሓደ ካብ ሓደ ቑጽሪ ካብ tuning .systems አብ ውሽጢ እቲ ,ምዕራብ እቲ -twelve-note chromatic መለክዒ እዩ እቲ ብጥዕሚ ልሙድ ሜላ ካብ ,ውድብ ምስ ማዕረ temperament ሕዚ እቲ ብጥዕሚ widely ዘገልገለ ሜላ ካብ tuning እቲ .መለክዒ አብ ውሽጢ ,እቲ ነገር እቲ ጫፍ መጠነ ዝምድና አብ መንጎ ዝኾነ ክልተ successive notes ካብ እቲ መለክዒ እዩ ብልክዕ እቲ twelfth ሱር ካብ ክልተ (ወይ ብዝዕባ .).1.05946 አብ ውሽጢ -well-tempered systems (ከም ዘገልገለ አብ ውሽጢ እቲ ግዜ ካብ Johann Sebastian ,Bach ን ),ኣብነት ፍሉይ methods ካብ musical tuning ኔሮም .ዘገልገለ ዳርጋ ኩሎም ካብ እዚ systems ኣለኒ ሓደ interval አብ ውሽጢ ,ልሙድ እቲ ,octave አበይ እቲ ጫፍ ካብ ሓደ መዝገብ እዩ ዕፅፊ እቲ ድግግም ካብ .ካልእ ን ,ኣብነት እንተ እቲ ሓደ ኣብ ልዕሊ ማእኸል C እዩ 440 ,Hz እቲ ሓደ ሓደ octave ኣብ ልዕሊ እቲ እዩ 880 Hz ().info",እንታይ እዩ እቲ ጫፍ መጠነ ዝምድና አብ መንጎ ዝኾነ ክልተ successive notes ካብ እቲ መለክዒ ?ብልክዕ,ብዝዕባ .1.05946,880 Hz,Johann Sebastian Bach,twelfth
"London i/ˈlʌndən/ is the capital and most populous city of England and the United Kingdom. Standing on the River Thames in the south eastern part of the island of Great Britain, London has been a major settlement for two millennia. It was founded by the Romans, who named it Londinium. London's ancient core, the City of London, largely retains its 1.12-square-mile (2.9 km2) medieval boundaries and in 2011 had a resident population of 7,375, making it the smallest city in England. Since at least the 19th century, the term London has also referred to the metropolis developed around this core. The bulk of this conurbation forms Greater London,[note 1] a region of England governed by the Mayor of London and the London Assembly.[note 2] The conurbation also covers two English counties: the small district of the City of London and the county of Greater London. The latter constitutes the vast majority of London, though historically it was split between Middlesex (a now abolished county), Essex, Surrey, Kent and Hertfordshire.",263,How long has the capital of England and the United Kingdom been a major settlement?,two millennia,Middlesex,Kent,Essex,1,"London //i/ˈlʌndən እዩ እቲ ሃብቲ እና ብጥዕሚ populous ከተማ ካብ England እና እቲ United .Kingdom Standing አብ ልዕሊ እቲ ሩባ Thames አብ ውሽጢ እቲ ደቡብ eastern ክፋል ካብ እቲ ደሴት ካብ ምዑዝ ,Britain London ኣለዎ ዝነበረ ሓደ ዋና settlement ን ክልተ .millennia እቲ ነገር ኔሩ founded ብ እቲ ,Romans መን named እቲ ነገር .Londinium 'London's ጥንታዊ ,ማእኸል እቲ ከተማ ካብ ,London largely retains ናቱ .--1.12-square-mile (.2.9 )km2 medieval ዶባት እና አብ ውሽጢ 2011 ዝነበረ ሓደ ነባሪ በዝሒ ህዝቢ ካብ ,,7,375 making እቲ ነገር እቲ smallest ከተማ አብ ውሽጢ .England ካብ ኣብ ዝነኣሰ እቲ 19th ,ዘመን እቲ ቃል London ኣለዎ እውን referred ናብ እቲ metropolis ምዕቡል አብ ከባቢ እዚ .ማእኸል እቲ ግዙፍ ካብ እዚ conurbation forms Greater ,[London,[note ]1 ሓደ ክልል ካብ England governed ብ እቲ Mayor ካብ London እና እቲ London .[Assembly.[note ]2 እቲ conurbation እውን covers ክልተ ኢንግሊሽ :counties እቲ ንኡስ ኣውራጃ ካብ እቲ ከተማ ካብ London እና እቲ county ካብ Greater .London እቲ ጸኒሑ constitutes እቲ ሰፊሕ መብዛሕትኡ ካብ ,London እኳ historically እቲ ነገር ኔሩ ምቀል አብ መንጎ Middlesex (ሓደ ሕዚ abolished ),county ,Essex ,Surrey Kent እና .Hertfordshire",ከመይ ነዊሕ ኣለዎ እቲ ሃብቲ ካብ England እና እቲ United Kingdom ዝነበረ ሓደ ዋና ?settlement,ክልተ millennia,Middlesex,Kent,Essex
"It was only in the 1980s that digital telephony transmission networks became possible, such as with ISDN networks, assuring a minimum bit rate (usually 128 kilobits/s) for compressed video and audio transmission. During this time, there was also research into other forms of digital video and audio communication. Many of these technologies, such as the Media space, are not as widely used today as videoconferencing but were still an important area of research. The first dedicated systems started to appear in the market as ISDN networks were expanding throughout the world. One of the first commercial videoconferencing systems sold to companies came from PictureTel Corp., which had an Initial Public Offering in November, 1984.",264,When did digital telephony transmission networks become possible?,128,ISDN,the 1980s,Initial Public Offering,3,"እቲ ነገር ኔሩ ጥራሕ አብ ውሽጢ እቲ 1980s እቲ digital telephony transmission networks ኮይኑ ,ዝከኣል ከምዚ ከም ምስ ISDN ,networks assuring ሓደ minimum ቅንጣብ መደብ (ብልሙድ 128 /)kilobits/s ን compressed ቪዲዮ እና audio .transmission አብ እዋን እዚ ,ግዜ ኣብቲ ኔሩ እውን ፅንዓት ናብ ውሽጢ ካልእ forms ካብ digital ቪዲዮ እና audio .ሓሳብ ንሓሳብ ምልውዋጥ ቡዙሕ ካብ እዚ ,technologies ከምዚ ከም እቲ Media ,ቦታ እዮም ዘይኮነ ከም widely ዘገልገለ ሎምዓንቲ ከም videoconferencing ግን ኔሮም እስካብ ሕዚ ሓደ ጠቃሚ ስፍሓት ካብ .ፅንዓት እቲ መጀመርታ ግዱስ systems ተጀሚሩ ናብ ምርካብ አብ ውሽጢ እቲ ዕዳጋ ከም ISDN networks ኔሮም expanding በቲ እቲ .ዓለም ሓደ ካብ እቲ መጀመርታ ንግዳዊ videoconferencing systems ሽዩጥ ናብ companies መጺኡ ካብ PictureTel .,Corp አየናይ ዝነበረ ሓደ መጀመሪ ህዝባዊ Offering አብ ውሽጢ ,ሕዳር .1984",መዓዝ ግቡር digital telephony transmission networks ምዃን ?ዝከኣል,128,ISDN,እቲ 1980s,መጀመሪ ህዝባዊ Offering
"Despite the large number of philosophical schools and subtle nuances between many, all philosophies are said to fall into one of two primary categories, which are defined in contrast to each other: Idealism, and materialism.[a] The basic proposition of these two categories pertains to the nature of reality, and the primary distinction between them is the way they answer two fundamental questions: ""what does reality consist of?"" and ""how does it originate?"" To idealists, spirit or mind or the objects of mind (ideas) are primary, and matter secondary. To materialists, matter is primary, and mind or spirit or ideas are secondary, the product of matter acting upon matter.",265,How many primary categories do all philosophies fall into?,one,two,craps.n.01,couple.n.04,2,"ብዘየገድስ እቲ ገዚፍ ቑጽሪ ካብ philosophical schools እና ሕቡእ nuances አብ መንጎ ,ቡዙሕ ኩሎም philosophies እዮም ኢሉ ናብ ምውዳቅ ናብ ውሽጢ ሓደ ካብ ክልተ ቀዳማይ ,categories አየናይ እዮም defined አብ ውሽጢ ኣወዳደረ ናብ ሕድሕድ :ካልእ ,Idealism እና .[]materialism.[a እቲ መሰረታዊ proposition ካብ እዚ ክልተ categories pertains ናብ እቲ ተፈጥሮ ካብ ,ክውንነት እና እቲ ቀዳማይ distinction አብ መንጎ ንሶም እዩ እቲ መንገዲ ንሶም መልሲ ክልተ መሰረታዊ :questions ""እንታይ ምግባር ክውንነት ዝሓዘ ?""ካብ እና ""ከመይ ምግባር እቲ ነገር ?""originate ናብ ,idealists መንፈስ ወይ ሓንጎል ወይ እቲ objects ካብ ሓንጎል ()ideas እዮም ,ቀዳማይ እና ነገር .secondary ናብ ,materialists ነገር እዩ ,ቀዳማይ እና ሓንጎል ወይ መንፈስ ወይ ideas እዮም ,secondary እቲ ፍርያት ካብ ነገር acting ኣብ ግዘ .ነገር",ከመይ ቡዙሕ ቀዳማይ categories ግበር ኩሎም philosophies ምውዳቅ ?ናብ ውሽጢ,ሓደ,ክልተ,..craps.n.01,..couple.n.04
"The company originated in 1911 as the Computing-Tabulating-Recording Company (CTR) through the consolidation of The Tabulating Machine Company, the International Time Recording Company, the Computing Scale Company and the Bundy Manufacturing Company. CTR was renamed ""International Business Machines"" in 1924, a name which Thomas J. Watson first used for a CTR Canadian subsidiary. The initialism IBM followed. Securities analysts nicknamed the company Big Blue for its size and common use of the color in products, packaging and its logo.",266,In what year did IBM create it's name?,Big Blue,International Business Machines,1911,the Computing Scale Company,3,"እቲ ድርጅት originated አብ ውሽጢ 1911 ከም እቲ --Computing-Tabulating-Recording ድርጅት ()CTR ብውሽጢ እቲ consolidation ካብ እቲ Tabulating ማሽን ,ድርጅት እቲ ዓለም ለኻዊ ግዜ Recording ,ድርጅት እቲ Computing መለክዒ ድርጅት እና እቲ Bundy Manufacturing .ድርጅት CTR ኔሩ renamed ""ዓለም ለኻዊ ስራሕቲ ንግዲ ""Machines አብ ውሽጢ ,1924 ሓደ ሽም አየናይ Thomas .J Watson መጀመርታ ዘገልገለ ን ሓደ CTR Canadian .subsidiary እቲ initialism IBM .followed Securities analysts nicknamed እቲ ድርጅት ዓብይ ሰማያዊ ን ናቱ ግዝፊ እና ልሙድ ጥቅሚ ካብ እቲ ሕብሪ አብ ውሽጢ ,products packaging እና ናቱ .logo",አብ ውሽጢ እንታይ ዓመት ግቡር IBM ፍጠር 'እዩ ?ሽም,ዓብይ ሰማያዊ,ዓለም ለኻዊ ስራሕቲ ንግዲ Machines,1911,እቲ Computing መለክዒ ድርጅት
"Plymouth's early history extends to the Bronze Age, when a first settlement emerged at Mount Batten. This settlement continued as a trading post for the Roman Empire, until it was surpassed by the more prosperous village of Sutton, now called Plymouth. In 1620, the Pilgrim Fathers departed Plymouth for the New World and established Plymouth Colony – the second English settlement in what is now the United States of America. During the English Civil War the town was held by the Parliamentarians and was besieged between 1642 and 1646.",267,What was the second English settlement in what is now the United States of America?,Plymouth Colony,Sutton,first,Mount Batten,1,"'Plymouth's ብግዘ ታሪኽ extends ናብ እቲ Bronze ,ዕድመ መዓዝ ሓደ መጀመርታ settlement emerged ኣብ Mount .Batten እዚ settlement continued ከም ሓደ trading ለጥፍ ን እቲ Roman ,Empire ክሳብ እቲ ነገር ኔሩ surpassed ብ እቲ ቡዙሕ ብልፁግ ገጠር ካብ ,Sutton ሕዚ ዝተፀወዐ .Plymouth አብ ውሽጢ ,1620 እቲ Pilgrim Fathers departed Plymouth ን እቲ ሓድሽ ዓለም እና ዝተመስረተ Plymouth Colony – እቲ ካልኣይ ኢንግሊሽ settlement አብ ውሽጢ እንታይ እዩ ሕዚ እቲ United States ካብ .America አብ እዋን እቲ ኢንግሊሽ Civil ውግእ እቲ ንእሽተይ ከተማ ኔሩ ተገይሩ ብ እቲ Parliamentarians እና ኔሩ besieged አብ መንጎ 1642 እና .1646",እንታይ ኔሩ እቲ ካልኣይ ኢንግሊሽ settlement አብ ውሽጢ እንታይ እዩ ሕዚ እቲ United States ካብ ?America,Plymouth Colony,Sutton,መጀመርታ,Mount Batten
