passage,question_number,question,mc_answer1,mc_answer2,mc_answer3,mc_answer4,correct_answer_num,translated_passage,translated_question,translated_mc_answer1,translated_mc_answer2,translated_mc_answer3,translated_mc_answer4
"By far the largest military action in which the United States engaged during this era was the War of 1812. With Britain locked in a major war with Napoleon's France, its policy was to block American shipments to France. The United States sought to remain neutral while pursuing overseas trade. Britain cut the trade and impressed seamen on American ships into the Royal Navy, despite intense protests. Britain supported an Indian insurrection in the American Midwest, with the goal of creating an Indian state there that would block American expansion. The United States finally declared war on the United Kingdom in 1812, the first time the U.S. had officially declared war. Not hopeful of defeating the Royal Navy, the U.S. attacked the British Empire by invading British Canada, hoping to use captured territory as a bargaining chip. The invasion of Canada was a debacle, though concurrent wars with Native Americans on the western front (Tecumseh's War and the Creek War) were more successful. After defeating Napoleon in 1814, Britain sent large veteran armies to invade New York, raid Washington and capture the key control of the Mississippi River at New Orleans. The New York invasion was a fiasco after the much larger British army retreated to Canada. The raiders succeeded in the burning of Washington on 25 August 1814, but were repulsed in their Chesapeake Bay Campaign at the Battle of Baltimore and the British commander killed. The major invasion in Louisiana was stopped by a one-sided military battle that killed the top three British generals and thousands of soldiers. The winners were the commanding general of the Battle of New Orleans, Major General Andrew Jackson, who became president and the Americans who basked in a victory over a much more powerful nation. The peace treaty proved successful, and the U.S. and Britain never again went to war. The losers were the Indians, who never gained the independent territory in the Midwest promised by Britain.",253,What was the largest military action the U.S. engaged in during this time?,New York,one,the War of 1812,Indian,3,ብሩሑቕ እቲ ዝዓበየ ወተሃደራዊ ስጉምቲ ኣመሪካ ኣብዚ ዘመን ዝተዋፈረትሉ ናይ 1812 ኲናት እዩ ነይሩ።ብሪጣንያ ምስ ናፖልዮን ፈረንሳ ኣብ ዓቢ ኲናት ተዓጽያ ስለ ዝነበረት፡ ፖሊሲኣ ንኣመሪካዊ ጽዕነት ናብ ፈረንሳ ምዕጋት እዩ ነይሩ። ኣመሪካ ኣብ ወጻኢ ሃገር ንግዲ እናተኸታተለት ገለልተኛ ኮይና ክትቅጽል ደለየት። ብሪጣንያ ነቲ ንግዲ ቆሪጻ፡ ዋላ’ኳ ጽዑቕ ተቓውሞ እንተገበረ፡ ኣብ መራኽብ ኣመሪካ ናብ ንጉሳዊ ሓይሊ ባሕሪ ዝነበራ ባሕረኛታት ኣድኒሳቶ። ብሪጣንያ ኣብ ማእከላይ ምዕራብ ኣመሪካ ንዝነበረ ህንዳዊ ናዕቢ ደጊፋቶ፣ ኣብኡ ድማ ኣብኡ ናይ ህንዳዊት ግዝኣት ክትፈጥር ዕላማ ብምግባር ምስፍሕፋሕ ኣመሪካ ዝዓግት እዩ። ኣመሪካ ኣብ መወዳእታ ኣብ 1812 ኣብ ልዕሊ ዓባይ ብሪጣንያ ኲናት ኣዊጃ፡ ኣመሪካ ብወግዒ ኲናት ክትእውጅ ንመጀመርታ ግዜኣ። ኣመሪካ ንንጉሳዊ ሓይሊ ባሕሪ ክትስዕራ ተስፋ ዘይትገብር፡ ኣመሪካ ንዝተማረኸት ግዝኣት ከም ናይ ፈረሰኛታት ቺፕ ክትጥቀም ተስፋ ብምግባር፡ ንሃጸያዊ ግዝኣት እንግሊዝ ብወራሪት ብምፍጻም፡ ንሃጸያዊ ግዝኣት እንግሊዝ ኣጥቂዓታ። ወራር ካናዳ ምስ ደቀባት ኣመሪካውያን ኣብ ምዕራባዊ ግንባር (War Tecumseh’s War and the Creek War) ምስ ደቀባት ኣመሪካውያን ተጓናጺ ውግኣት እኳ እንተነበረ፡ ዝያዳ ዕዉታት እኳ እንተነበሩ። ኣብ 1814 ንናፖልዮን ድሕሪ ስዒራታ፡ ብሪጣንያ ንኒውዮርክ ወሪራ ንዋሽንግተን ወራርን ነቲ ኣብ ኒው ኦርሊንስ ዝርከብ ወሰን ሩባ ሚሲሲፒ ቁልፊ ምቁጽጻር ንምሓዝን ዓበይቲ ገዳይም ገዳይም ሰራዊት ሰሊማ ልኢኻ። እቲ ናይ ኒውዮርክ ወራር፡ እቲ ኣዝዩ ዝዓበየ ሰራዊት እንግሊዝ ናብ ካናዳ ድሕሪ ምምላሱ፡ ፍሽለት እዩ ነይሩ። ራይደርስ ብ25 ነሓሰ 1814 ኣብ ምንዳድ ዋሽንግተን ተዓዊቶም እኳ እንተነበሩ፡ ኣብቲ ኣብ ውግእ ባልቲሞር ዝነበረ ናይ ቸሳፒክ ቤይ ጎስጓስ ግን ተገላቢጦም፡ እቲ ብሪጣንያዊ ኣዛዚ ድማ ተቐቲሉ። እቲ ኣብ ሉዊዚያና ዝነበረ ዓቢ ወራር፡ ብሓደ ወገን ወተሃደራዊ ውግእ ደው ኢሉ፡ እዚ ድማ ነቶም ላዕለዎት ሰለስተ ጀነራላት እንግሊዝን ኣሽሓት ወተሃደራትን ዝቐተለ ወተሃደራዊ ውግእ ደው ኢሉ። እቶም ተዓወትቲ፡ ኣዛዚ ጀነራል ውግእ ኒው ኦርሊንስ፡ ሜጀር ጀነራል ኣንድሪው ጃክሰን፡ ፕረዚደንትን እቶም ኣብ ልዕሊ ሓደ ኣዝዩ ዝሓየለ ህዝቢ ብዓወት ዝነጥፉ ኣመሪካውያንን ዝኾኑ ኣመሪካውያንን እዮም። እቲ ውዕል ሰላም ዕዉት ኮይኑ ተረኺቡ፣ ኣመሪካን እንግሊዝን ድማ ድሕሪ ደጊም ናብ ኲናት ኣይከዱን። እቶም ዝኸሰሩ ህንዳውያን እዮም ነይሮም፣ ኣብቲ ብእንግሊዝ ዝተመባጽዓቶ ሚድዌስት ናጻ መሬት ረኺቦም ዘይፈልጡ።,ኣብዚ ግዜ እዚ ኣመሪካ ዝዋፈራሉ ዝዓበየ ወተሃደራዊ ስጉምቲ እንታይ እዩ ነይሩ?,ኒውዮርክ,ሓደ,ኲናት 1812 ዓ.ም.,ህንዳዊ
"In the human digestive system, food enters the mouth and mechanical digestion of the food starts by the action of mastication (chewing), a form of mechanical digestion, and the wetting contact of saliva. Saliva, a liquid secreted by the salivary glands, contains salivary amylase, an enzyme which starts the digestion of starch in the food; the saliva also contains mucus, which lubricates the food, and hydrogen carbonate, which provides the ideal conditions of pH (alkaline) for amylase to work. After undergoing mastication and starch digestion, the food will be in the form of a small, round slurry mass called a bolus. It will then travel down the esophagus and into the stomach by the action of peristalsis. Gastric juice in the stomach starts protein digestion. Gastric juice mainly contains hydrochloric acid and pepsin. As these two chemicals may damage the stomach wall, mucus is secreted by the stomach, providing a slimy layer that acts as a shield against the damaging effects of the chemicals. At the same time protein digestion is occurring, mechanical mixing occurs by peristalsis, which is waves of muscular contractions that move along the stomach wall. This allows the mass of food to further mix with the digestive enzymes.",254,What is a liquid that the human digestive system secretes?,Gastric,pepsin,two,Saliva,4,ኣብ ስርዓተ ምሕቃቕ መግቢ ሰብ፡ መግቢ ናብ ኣፍን መካኒካዊ ምሕቃቕ መግቢን ናይቲ መግቢ ይጅምር፡ ብተግባር ማስቲኬሽን (ምሕካኽ)፡ ሓደ መልክዕ መካኒካዊ ምሕቃቕ መግቢ፡ ከምኡ’ውን ምራቕ ዝረኸሰ ርክብ ይጅምር። ብጽክታት ምራቕ ዝፍኖ ፈሳሲ ዝኾነ ምራቕ፡ ምራቕ ኣሚላይለዝ ዝሓዘ ኮይኑ፡ ኣብቲ መግቢ ምሕቃቕ ስታርች ዝጅምር ኢንዛይም ዝሓዘ እዩ፤ እቲ ምራቕ ውን ነቲ መግቢ ዝምልከተሉ ምራኽ ዝሓዘ ኮይኑ፡ ንኣሚላዝ ንኽሰርሕ ምቹእ ኩነታት ፒኤች (ኣልካላይን) ዝህብ ሃይድሮጅን ካርቦኔት ኣለዎ። ድሕሪ ምሕቃቕ ማስቲኬሽንን ስታርች ምሕቃቕ መግቢን፡ እቲ መግቢ ብመልክዕ ንእሽቶን ክቡብን ስላሪ ጅምላ ቦሉስ ዝበሃል ክኸውን እዩ። ብድሕሪኡ ብመትሓዚ መዓንጣ ንታሕቲ ክጓዓዝን ብተግባር ፐሪስታልሲስ ናብ ከብዲ ክኣቱን እዩ። ኣብ ከብዲ ዝርከብ ጽማቝ ከስዐ ፕሮቲን ምሕቃቕ ይጅምር። ጽማቝ ከስዐ ብቐንዱ ሃይድሮክሎሪክ ኣሲድን ፔፕሲንን ዝሓዘ እዩ። እዞም ክልተ ኬሚካላት ንመንደቕ ከብዲ ክጎድኡ ስለ ዝኽእሉ፡ ምልኩዕ ብከብዲ ይፍኖ፡ እዚ ድማ ኣንጻር እቲ ኬሚካላት ዝጎድእ ሳዕቤናት ከም ዋልታ ዝሰርሕ ስሊሚ ንጣብ ይህብ። ኣብ ተመሳሳሊ ግዜ ፕሮቲን ምሕቃቕ ይፍጠር፡ መካኒካዊ ምትሕውዋስ ብፐሪስታልሲስ ይፍጸም፡ እዚ ድማ ኣብ መንደቕ ከብዲ ዝንቀሳቐሱ ማዕበላት ምውጥዋጥ ጭዋዳታት እዩ። እዚ ድማ ነቲ ጅምላ መግቢ ምስቲ ናይ ምሕቃቕ መግቢ ኢንዛይማት ዝያዳ ንኽሕወስ የኽእሎ።,ስርዓተ ምሕቃቕ መግቢ ሰብ ዝፍኖ ፈሳሲ እንታይ እዩ?,ከስዐ .,ፔፕሲን,ክልተ,ምራቕ
"Time is one of the seven fundamental physical quantities in both the International System of Units and International System of Quantities. Time is used to define other quantities—such as velocity—so defining time in terms of such quantities would result in circularity of definition. An operational definition of time, wherein one says that observing a certain number of repetitions of one or another standard cyclical event (such as the passage of a free-swinging pendulum) constitutes one standard unit such as the second, is highly useful in the conduct of both advanced experiments and everyday affairs of life. The operational definition leaves aside the question whether there is something called time, apart from the counting activity just mentioned, that flows and that can be measured. Investigations of a single continuum called spacetime bring questions about space into questions about time, questions that have their roots in the works of early students of natural philosophy.",255,What is one of the seven fundamental physical quantities in both the International System of Units and International System of Quantities?,Time,wee.n.01,mistime.v.01,life sentence.n.01,1,ግዜ ሓደ ካብቶም ሸውዓተ መሰረታዊ ኣካላዊ ብዝሒ ኣብ ክልቲኡ ዓለምለኻዊ ስርዓት ኣሃዱታትን ዓለምለኻዊ ስርዓት ብዝሒን እዩ። ግዜ ንኻልኦት ብዝሒታት ንምግላጽ ይጥቀመሉ- ከምዚ ዝኣመሰለ ፍጥነት- ስለዚ ብመንጽር ከምዚ ዝኣመሰለ ብዝሒ ግዜ ምግላጽ ውጽኢቱ ክቢነት ትርጉም ምሃለዎ። ሓደ ስርሒታዊ ትርጉም ናይ ግዜ፣ ሓደ ሓደ ሓደ ንሓደ ዝተወሰነ ቁጽሪ ምድግጋም ናይ ሓደ ወይ ካልእ መደበኛ ዑደታዊ ፍጻመ (ከም ምሕላፍ ናጻ ምውጥዋጥ ፔንዱለም) ከም ካልኣይ ዝኣመሰለ መደበኛ ኣሃዱ ከም ዝቖመ ዝዛረብ፡ ኣብ ኣካይዳ ክልቲኡ ምዕቡል ፈተነታትን መዓልታዊ ጉዳያት ህይወትን ኣዝዩ ጠቓሚ እዩ። እቲ ስርሒታዊ ትርጉም፡ ካብቲ ሕጂ ዝተጠቕሰ፡ ዝውሕዝን ክዕቀን ዝኽእልን፡ ካብቲ ናይ ምቑጻር ንጥፈት ወጻኢ፡ ግዜ ዝበሃል ነገር ኣሎ ድዩ ዝብል ሕቶ ንጎኒ ገዲፍካ ይገድፎ። መርመራታት ናይ ሓደ ቀጻልነት ህዋስታይም ዝበሃል፡ ብዛዕባ ግዜ ብዛዕባ ግዜ ዝምልከት ሕቶታት፡ ብዛዕባ ግዜ፡ ሱር ኣብ ስርሓት ናይቶም ቀዳሞት ተማሃሮ ተፈጥሮኣዊ ፍልስፍና ዘለዎም ሕቶታት የምጽእ እዩ።,ኣብ ክልቲኡ ዓለምለኻዊ ስርዓት ኣሃዱታትን ዓለምለኻዊ ስርዓት ብዝሒን ካብ ዘለዉ ሸውዓተ መሰረታዊ ኣካላዊ ብዝሒ ሓደ እንታይ እዩ?,ግዜ,WEE.N.01,ሚስታይም።,ናይ ህይወት ፍርዲ.N.01
"The earliest extant arguments that the world of experience is grounded in the mental derive from India and Greece. The Hindu idealists in India and the Greek Neoplatonists gave panentheistic arguments for an all-pervading consciousness as the ground or true nature of reality. In contrast, the Yogācāra school, which arose within Mahayana Buddhism in India in the 4th century CE, based its ""mind-only"" idealism to a greater extent on phenomenological analyses of personal experience. This turn toward the subjective anticipated empiricists such as George Berkeley, who revived idealism in 18th-century Europe by employing skeptical arguments against materialism.",256,Where do the oldest arguments that the world of experience is grounded in the mental come from?,George Berkeley,CE,the 4th century,India,4,"እቲ ቀዳማይ ዛጊት ዘሎ ስነ-ሞጎት ዓለም ተመኩሮ ኣብ ኣእምሮኣዊ ካብ ህንድን ግሪኽን ዝመጸ እዩ ዝብል ስነ-ሞጎት እዩ። ኣብ ህንዲን ናይ ግሪኽ ኒዮፕላቶኒስትን ዝነበሩ ሂንዱ idealists ከም መሬት ወይ ሓቀኛ ባህሪ ክውንነት ንኹሉ ዘሰጋግር ንቕሓት ፓነንቴይስታዊ ስነ-ሞጎት ሂቦም። ብኣንጻሩ፡ እቲ ኣብ ውሽጢ ማሃያና ቡድሂዝም ኣብ ህንዲ ኣብ 4ይ ክፍለ ዘመን ኣብ CE ዝነቐለ ቤት ትምህርቲ ዮጋካራ፡ ""ኣእምሮ ጥራይ"" ዝነበሮ ርእዮተ ዓለም ብዝዓበየ ደረጃ ኣብ ፊኖሜኖሎጂካዊ ትንታነታት ውልቃዊ ተመክሮ መሰረት ዝገበረ እዩ። እዚ ናብቶም ከም በዓል ጆርጅ በርክሊ ዝኣመሰሉ ስብጀክቲቭ ትጽቢት ዝግበረሎም ተሞክሮኣውያን፡ ኣብ መበል 18 ክፍለ ዘመን ኣብ ኤውሮጳ ንዝነበረ ርእዮተ ዓለም ኣንጻር ንዋታዊነት ብምቑጻር፡ ንርእዮተ ዓለም ዳግማይ ዘንገሰ።",ዓለም ተመኩሮ ኣብ ኣእምሮኣዊ ካበይ ከም ዝመጸት ዝኣረገ ስነ-ሞጎት ካበይ እዮም?,ጆርጅ በርክሊ,CE .,4ይ ክፍለ ዘመን,ህንዲ
"The hydraulic crane was invented by Sir William Armstrong in 1846, primarily for use at the Tyneside docks for loading cargo. These quickly supplanted the earlier steam driven elevators: exploiting Pascal's law, they provided a much greater force. A water pump supplied a variable level of water pressure to a plunger encased inside a vertical cylinder, allowing the level of the platform (carrying a heavy load) to be raised and lowered. Counterweights and balances were also used to increase the lifting power of the apparatus.",257,Who invented the hydraulic crane?,1846,Tyneside,William Armstrong,Pascal,3,እቲ ሃይድሮሊክ ክሬን ብ1846 ብሰር ዊልያም ኣርምስትሮንግ ዝተማህዘ ኮይኑ፡ ብቐንዱ ኣብ ታይንሳይድ ዶክስ ንመጽዓኒ ጽዕነት ንምጽዓን ዝሕግዝ እዩ። እዚኦም ነቶም ኣቐዲሞም ብሃፋ ዝምራሕ ሊፍትታት ቀልጢፎም ተተኽሉሎም: ንሕጊ ፓስካል መዝመዝቲ: ኣዝዩ ዝዓበየ ሓይሊ ኣቕረቡ። ሓደ ፓምፕ ማይ ኣብ ውሽጢ ቋሚ ሲሊንደር ዝተዓሸገ ፕላንጀር ተለዋዋጢ ደረጃ ጸቕጢ ማይ ኣቕሪቡ፣ እዚ ድማ ደረጃ ናይቲ መድረኽ (ከቢድ ጽዕነት ዝሕዝ) ንኽለዓልን ንኽንኪን ኣኽኢሉ። መቃብርን ሚዛንን እውን ተጠቒሙ ናይቲ ኣፓራቱዝ ሓይሊ ናይ ምልዓል ሓይሊ ንምዕባይ እዩ።,መን እዩ ነቲ ሃይድሮሊክ ክሬን ዝመሃዘ?,1846,ታይንሳይድ,ዊልያም ኣርምስትሮንግ,ፓስካል
"American Idol is an American singing competition series created by Simon Fuller and produced by 19 Entertainment, and is distributed by FremantleMedia North America. It began airing on Fox on June 11, 2002, as an addition to the Idols format based on the British series Pop Idol and has since become one of the most successful shows in the history of American television. The concept of the series is to find new solo recording artists, with the winner being determined by the viewers in America. Winners chosen by viewers through telephone, Internet, and SMS text voting were Kelly Clarkson, Ruben Studdard, Fantasia Barrino, Carrie Underwood, Taylor Hicks, Jordin Sparks, David Cook, Kris Allen, Lee DeWyze, Scotty McCreery, Phillip Phillips, Candice Glover, Caleb Johnson, and Nick Fradiani.",258,When did American Idol begin airing?,Idols,America,"June 11, 2002",Idol,3,ኣሜሪካን ኣይዶል ብሳይሞን ፉለር ዝተፈጥረን ብ19 መዘናግዒ ዝተዳለወን ተኸታታሊ ውድድር ደርፊ ኣሜሪካዊ ኮይኑ፡ ብፍሬማንትለሚድያ ሰሜን ኣሜሪካ ዝተዘርግሐ እዩ። ኣብ ፎክስ ብ11 ሰነ 2002 ኣብ ልዕሊ ፎክስ ክትቀርብ ጀሚራ፡ ከም ተወሳኺት ናይቲ ጣኦታት ፎርማት ኣብ The British Series Pop Idol ዝተመርኮሰት ኮይና፡ ካብ ሽዑ ጀሚራ ድማ ኣብ ታሪኽ ተለቪዥን ኣመሪካ ካብ ዘለዋ ዕዉታት ምርኢታት ሓንቲ ኮይና ኣላ። ኣምር ናይቲ ተኸታታሊ ፊልም ሓደስቲ ሶሎ ምቕዳሕ ስነጥበባውያን ምርካብ እዩ፣ እቲ ተዓዋቲ ድማ ብተዓዘብቲ ኣሜሪካ ዝውሰን እዩ። ብተሌፎን፣ ኢንተርነትን ብኤስኤምኤስን ዝተመርጹ ተዓወትቲ፡ ኬሊ ክላርክሰን፡ ሩበን ስቱዳርድ፡ ፋንታስያ ባሪኖ፡ ካሪ ኡንደርዉድ፡ ተይለር ሂክስ፡ ጆርዲን ስፓርክስ፡ ዴቪድ ኩክ፡ ክሪስ ኣለን፡ ሊ ዲዊዝ፡ ስኮቲ ማክክረሪ፡ ፊሊፕ ፊሊፕስ፡ ካሌብ ጆንሰንን ኒክ ፍራይድያኒን እዮም።,ኣሜሪካዊ ጣኦት መዓስ እዩ ናብ ኣየር ክመሓላለፍ ጀሚሩ?,ጣኦታት,ኣሜሪካ,11 ሰነ 2002 ዓ.ም.,ጣኦት .
"On 16 September 2001, at Camp David, President George W. Bush used the phrase war on terrorism in an unscripted and controversial comment when he said, ""This crusade – this war on terrorism – is going to take a while, ... "" Bush later apologized for this remark due to the negative connotations the term crusade has to people, e.g. of Muslim faith. The word crusade was not used again. On 20 September 2001, during a televised address to a joint session of congress, Bush stated that, ""(o)ur 'war on terror' begins with al-Qaeda, but it does not end there. It will not end until every terrorist group of global reach has been found, stopped, and defeated.""",259,"When did George W. Bush say ""This crusade – this war on terrorism is going to take a while""?",Muslim,congress,Camp David,16 September 2001,4,"ብዕለት 16 መስከረም 2001 ኣብ ካምፕ ዳዊት፡ ፕረዚደንት ጆርጅ ቡሽ፡ ""እዚ መስቀላዊ ውግእ - እዚ ኲናት ኣብ ልዕሊ ግብረሽበራ - ቁሩብ ግዜ ክወስድ'ዩ፡ ... "" ቡሽ ድሒሩ ብሰንኪ እቲ ቀታሊ ትርጉም ንህዝብታት ዝህቦ ቃል፡ ንህዝብታት ከም ዝሓትት፡ ኣብ ዘይተጻሕፈን ኣካታዕን ርእይቶ፡ ነቲ ናይ ሓረግ ኲናት ኣብ ዘይተጻሕፈን ኣካታዕን ርእይቶ ተጠቒሱ። ናይ ኣስላም እምነት። መስቀላዊ ውግእ ዝብል ቃል ዳግማይ ኣብ ጥቕሚ ኣይወዓለን። ብዕለት 20 መስከረም 2001 ኣብ ሓደ ናይ ሓባር ኣኼባ ኮንግረስ ኣብ ዝተኻየደ ቴሌቪዥን ኣብ ዝተዋህበ መደረ፡ ቡሽ ""(O)ur 'War on Terror' ብኣልቃዒዳ ከም ዝጅምር፡ ኣብኡ ግን ኣይውዳእን'ዩ። ኩሉ እቲ ዓለማዊ ደረጃ ዝበጽሖ ግብረሽበራዊ ጉጅለ ክሳብ ዘይተረኽበ፡ ደው ኢሉ፡ ዝስዓር ኣይውዳእን'ዩ።""","ጆርጅ ቡሽ መዓስ እዩ ""እዚ መስቀላዊ ውግእ - እዚ ኲናት ግብረሽበራ ቁሩብ ግዜ ክወስድ እዩ"" ኢሉ?",ኣስላም,ኮንግረስ,ካምፕ ዳዊት,16 መስከረም 2001 ዓ.ም.
"The university's Medical Center and University Hospital are located in Kansas City, Kansas. The Edwards Campus is in Overland Park, Kansas, in the Kansas City metropolitan area. There are also educational and research sites in Parsons and Topeka, and branches of the University of Kansas School of Medicine in Wichita and Salina. The university is one of the 62 members of the Association of American Universities.",260,How many members does the Association of American Universities have?,Topeka,Medical Center and University Hospital,the Association of American Universities,62,4,ናይቲ ዩኒቨርሲቲ ሕክምና ማእከልን ዩኒቨርሲቲ ሆስፒታልን ኣብ ካንሳስ ሲቲ ካንሳስ ይርከብ። እቲ ኤድዋርድስ ካምፓስ ኣብ ኦቨርላንድ ፓርክ ካንሳስ ኣብ ካንሳስ ሲቲ ሜትሮፖሊታን ከባቢ ይርከብ። ኣብ ፓርሶንን ቶፔካን፡ ከምኡ’ውን ጨናፍር ናይ ዩኒቨርሲቲ ካንሳስ ቤት ትምህርቲ ሕክምና ኣብ ዊቺታን ሳሊናን እውን ትምህርታውን መጽናዕታውን ቦታታት ኣለዉ። እቲ ዩኒቨርሲቲ ሓደ ካብቶም 62 ኣባላት ማሕበር ዩኒቨርሲቲታት ኣሜሪካ እዩ።,ማሕበር ዩኒቨርሲቲታት ኣሜሪካ ክንደይ ኣባላት ኣለዎ?,ስቶፕ,ማእከል ሕክምናን ሆስፒታል ዩኒቨርሲቲን,ማሕበር ዩኒቨርሲቲታት ኣሜሪካ,62 .
"Perhaps the first electric motors were simple electrostatic devices created by the Scottish monk Andrew Gordon in the 1740s. The theoretical principle behind production of mechanical force by the interactions of an electric current and a magnetic field, Ampère's force law, was discovered later by André-Marie Ampère in 1820. The conversion of electrical energy into mechanical energy by electromagnetic means was demonstrated by the British scientist Michael Faraday in 1821. A free-hanging wire was dipped into a pool of mercury, on which a permanent magnet (PM) was placed. When a current was passed through the wire, the wire rotated around the magnet, showing that the current gave rise to a close circular magnetic field around the wire. This motor is often demonstrated in physics experiments, brine substituting for toxic mercury. Though Barlow's wheel was an early refinement to this Faraday demonstration, these and similar homopolar motors were to remain unsuited to practical application until late in the century.",261,Who discovered Ampère's force law?,Faraday,British,André-Marie Ampère,Scottish,3,ምናልባት እቶም ናይ መጀመርታ ኤሌክትሪካዊ ሞተራት ኣብ 1740ታት ብስኮትላንዳዊ መነኮስ ኣንድሪው ጎርደን ዝተፈጥሩ ቀለልቲ ኤሌክትሮስታቲክ መሳርሒታት ክኾኑ ይኽእሉ እዮም። እቲ ክልሰ-ሓሳባዊ መትከል ድሕሪ ምፍራይ መካኒካዊ ሓይሊ ብመተሓላለፊ ናይ ሓደ ኤለክትሪካዊ ዋሕዚ ኤሌክትሪክን ማግኔታዊ ፊልድን፣ ናይ ኣምፐርስ ሓይሊ ሕጊ፣ ድሒሩ ብኣንድረ-ማሪ ኣምፐረ ኣብ 1820 ተረኺቡ።እቲ ናይ ኤሌክትሪክ ጸዓት ናብ መካኒካዊ ጸዓት ናብ መካኒካዊ ጸዓት ብኤሌክትሮማግኔታዊ መንገዲ ምቕያር ብ1821 ብናጻ-ዕንወት ዝመልኦ ሽቦ ኣብ ትሕቲ ቀዋሚ ኮይኑ ነበረ፣ እዚ ድማ ብማግረ ስግል ዝበለ ነበረ፣ እዚ ድማ ብግልጺ ተታሒዙ። ሓደ ዋሕዚ ኤሌክትሪክ በቲ ሽቦ ምስ ሓለፈ፡ እቲ ሽቦ ኣብ ዙርያ እቲ ማግኔት ይዘውር ነበረ፡ እዚ ድማ እቲ ዋሕዚ ኣብ ዙርያ እቲ ሽቦ ዝነበረ ናይ ቀረባ ክቢ ማግኔታዊ ፊልድ ከም ዝለዓዓል ዘርኢ ነበረ። እዚ ሞተር እዚ መብዛሕትኡ ግዜ ኣብ ፈተነታት ፊዚክስ ይርአ፣ ጨው ማይ ንመርዛም ሜርኩሪ ዝትክእ እዩ። መንኰርኰር ባርሎው ነዚ ናይ ፋራዳይ መርኣያ ብኣጋኡ ምጽራይ እኳ እንተነበረ፡ እዞምን ተመሳሰልቲ ሆሞፖላር ሞተራትን ግን ክሳብ መወዳእታ ክፍለ ዘመን ንተግባራዊ ኣተገባብራ ዘይምቹኣት ኮይኖም ክቕጽሉ ነይርዎም።,ሕጊ ሓይሊ ኣምፐረ መን እዩ ረኺብዎ?,ፋራዳይ,እንግሊዛዊ,ኣንድሬ-ማሪ ኣምፐረ,ስኮትላንዳዊ
