passage,question_number,question,mc_answer1,mc_answer2,mc_answer3,mc_answer4,correct_answer_num,translated_passage,translated_question,translated_mc_answer1,translated_mc_answer2,translated_mc_answer3,translated_mc_answer4
"In 1045, the Byzantine Empire conquered Bagratid Armenia. Soon, the other Armenian states fell under Byzantine control as well. The Byzantine rule was short lived, as in 1071 Seljuk Turks defeated the Byzantines and conquered Armenia at the Battle of Manzikert, establishing the Seljuk Empire. To escape death or servitude at the hands of those who had assassinated his relative, Gagik II, King of Ani, an Armenian named Roupen, went with some of his countrymen into the gorges of the Taurus Mountains and then into Tarsus of Cilicia. The Byzantine governor of the palace gave them shelter where the Armenian Kingdom of Cilicia was eventually established on 6 January 1198 under King Leo I, a descendant of Prince Roupen.",136,What empire conquered Bagratid Armenia in 1045?,the Taurus Mountains,Byzantine,1045,6 January 1198,2,ኣብ 1045፡ ግዝኣት ቢዛንታይን ንባግራቲድ ኣርመንያ ስዒሩ። ነዊሕ ከይጸንሐ እተን ካልኦት ኣርመንያውያን ግዝኣታት እውን ኣብ ትሕቲ ቁጽጽር ቢዛንታይን ወደቓ። እቲ ኣብ 1071 ሰልጁክ ቱርክስ ንባይዛንታይን ስዒሩ ንኣርመንያ ኣብ ውግእ ማንዚከርት ስዒሩ ንኢምፓየር ሰልጁክ ብምቛም፡ እቲ ናይ ቢዛንታይን ሕጊ ሓጺር እዩ ነይሩ። ካብ ሞት ወይ ባርነት ብኢዱ እቶም ንዘመኑ ዝሃደሙ ጋጊክ ዳግማዊ ንጉስ ኣኒ ዝበሃል ሮውፖን ዝበሃል ኣርመንያዊ ምስ ገለ ካብ ደቂ ሃገር ታውረስ ኣኽራን ታውረስ ቀጺሎም ናብ ታርሱስ ናይ ሲሊስያ ከደ። እቲ ናይ ቢዛንታይን ኣመሓዳሪ ቤተ መንግስቲ መዕቆቢ ሂብዎም ኣብኡ ድማ እታ ኣርመንያዊት ንግስነት ሲሊስያ ኣብ መወዳእታ ብ6 ጥሪ 1198 ኣብ ትሕቲ ንጉስ ልዮን ዝኾነት ዘርኢ ልኡል ሮውፖን ተመስረተት።,ኣብ 1045 ንባግራቲድ ኣርመንያ እንታይ ኢምፓየር እንታይ ስዒሩዋ?,ኣኽራናት ታውረስ,ቢዛንታይን,1045 .,6 ጥሪ 1198
"Since the 1980s it has become common for social and cultural anthropologists to set ethnographic research in the North Atlantic region, frequently examining the connections between locations rather than limiting research to a single locale. There has also been a related shift toward broadening the focus beyond the daily life of ordinary people; increasingly, research is set in settings such as scientific laboratories, social movements, governmental and nongovernmental organizations and businesses.",137,Which region has often been set up for ethnographic research?,—,North Atlantic,the 1980s,—,2,ካብ 1980ታት ጀሚሩ ማሕበራውን ባህላውን ስነ-ሰብ ተመራመርቲ ኣብ ዞባ ሰሜን ኣትላንቲክ ኤትኖግራፊካዊ ምርምር ንምቕማጥ ልሙድ ኮይኑ ኣሎ፣ እዚ ድማ ብተደጋጋሚ ኣብ መንጎ ቦታታት ዘሎ ምትእስሳር ኣብ ሓደ ከባቢ ኣብ ክንዲ ዝድርት ኣብ መንጎ ቦታታት ዘሎ ምትእስሳር ይምርምር። ካብ መዓልታዊ ህይወት ተራ ሰባት ንላዕሊ ትኹረት ናብ ምስፍሕፋሕ እውን ተዛማዲ ለውጢ ተራእዩ እዩ፤ ኣብ ከም ሳይንሳዊ ቤተ-ፈተነታት፡ ማሕበራዊ ምንቅስቓሳት፡ መንግስታውን ዘይመንግስታውን ውድባትን ትካላት ንግድን ዝኣመሰሉ ቦታታት መጽናዕቲ ይግበር።,ንመጽናዕቲ ኤትኖግራፊ መብዛሕትኡ ግዜ ኣየናይ ዞባ እዩ ተዳልዩ?,—,ሰሜን ኣትላንቲክ,1980ታት .,—
"The Human Development Index has been criticized on a number of grounds including alleged ideological biases towards egalitarianism and so-called ""Western models of development"", failure to include any ecological considerations, lack of consideration of technological development or contributions to the human civilization, focusing exclusively on national performance and ranking, lack of attention to development from a global perspective, measurement error of the underlying statistics, and on the UNDP's changes in formula which can lead to severe misclassification in the categorisation of 'low', 'medium', 'high' or 'very high' human development countries.",138,What has been criticized because of it's alleged bias towards egalitarianism?,—,—,UNDP,The Human Development Index,4,"The Human Development Index has been criticized on a number of grounds including alleged ideological biases towards egalitarianism and so-called ""Western models of development"", failure to include any ecological considerations, lack of consideration of technological development or contributions to the human civilization, focusing exclusively on national performance and ranking, lack of attention to development from a global perspective, measurement error of the underlying statistics, and on the UNDP's changes in formula which can lead to severe misclassification in the ምድብ ‘ትሑት’፡ ‘ማእከላይ’፡ ‘ልዑል’ ወይ ‘ኣዝዩ ልዑል’ ሰብኣዊ ምዕባለ ሃገራት።",ኣብ ልዕሊ ማዕርነታዊ ስርዓት ወገናውነት እዩ ተባሂሉ ዝንቀፍ ዝነበረ እንታይ እዩ?,—,—,UNDP,መዐቀኒ ምዕባለ ሰብ
"The 9th- and 10th-century mosaics of the Hagia Sophia in Constantinople are truly classical Byzantine artworks. The north and south tympana beneath the dome was decorated with figures of prophets, saints and patriarchs. Above the principal door from the narthex we can see an Emperor kneeling before Christ (late 9th or early 10th century). Above the door from the southwest vestibule to the narthex another mosaic shows the Theotokos with Justinian and Constantine. Justinian I is offering the model of the church to Mary while Constantine is holding a model of the city in his hand. Both emperors are beardless – this is an example for conscious archaization as contemporary Byzantine rulers were bearded. A mosaic panel on the gallery shows Christ with Constantine Monomachos and Empress Zoe (1042–1055). The emperor gives a bulging money sack to Christ as a donation for the church.",139,When were the Hagia Sophia mosaics created?,Constantine,Empress Zoe,9th- and 10th-century,mosaic,3,ኣብ 9ይን 10ን ክፍለ ዘመን ኣብ ቁስጥንጥንያ ዝርከብ ናይ ሃጅያ ሶፍያ ሞዛይክስ ናይ ብሓቂ ክላሲካል ቢዛንታይን ስነ-ጥበባዊ ስርሓት እዮም። ኣብ ትሕቲ እቲ ጎቦ ዝነበረ ሰሜንን ደቡብን ቲምፓና ብኣሃዛት ነብያትን ቅዱሳንን ፓትርያርክን ተሰሊሙ ነበረ። ኣብ ልዕሊ እቲ ዋና ማዕጾ ካብ ናርተክስ ሓደ ሃጸይ ኣብ ቅድሚ ክርስቶስ ተንበርኪኹ ክንርኢ ንኽእል ኢና (መወዳእታ 9ይ ወይ መጀመርታ 10 ክፍለ ዘመን)። ኣብ ልዕሊ እቲ ማዕጾ ካብ ደቡባዊ ምዕራብ ቬስቲቡል ናብ ናርተክስ ካልእ ሞዛይክ ንቴዮቶኮስ ምስ ጃስቲንያን ቆስጠንጢኖስን የርኢ። ጀስቲንያን ኣነ ንማርያም ንማርያም ሞዴል ንማርያም የቕርበሉ ኣለኹ ቆስጠንጢኖስ ኣብ ኢዱ ሞዴል ናይታ ከተማ ሒዙ ኣሎ። ክልቲኦም ሃጸያት ጭሕሚ ዘይብሎም እዮም - እዚ ኣብነት ንንቕሓት ኣርካይይዜሽን እዩ ምኽንያቱ ናይ ዘመና ናይ ቢዛንታይን ገዛእቲ ጭሕሚ ስለ ዝነበሮም እዩ። ኣብቲ ጋለሪ ዝርከብ ሞዛይክ ፓነል ክርስቶስ ምስ ቆስጠንጢኖስ ሞኖማቾስን ንግስቲ ዞይን (1042–1055) የርኢ። እቲ ሃጸይ ንክርስቶስ ከም ወፈያ ንቤተክርስትያን ከም ወፈያ ንክርስቶስ ዝንቀሳቐሰ ሳእኒ ይህቦ።,እታ ናይ ሃግያ ሶፍያ ሞዛይክ መዓስ እዮም ተፈጢሮም?,ቆስጠንጢኖስ .,ንግስቲ ዞይ,9ይን 10ን ክፍለ ዘመን,ሞዛይክ .
"Thus, the languages mentioned above (Germanic, Romance, Slavic, Greek) have old terms for ""green"" which are derived from words for fresh, sprouting vegetation. However, comparative linguistics makes clear that these terms were coined independently, over the past few millennia, and there is no identifiable single Proto-Indo-European or word for ""green"". For example, the Slavic zelenъ is cognate with Sanskrit hari ""yellow, ochre, golden"". The Turkic languages also have jašɨl ""green"" or ""yellowish green"", compared to a Mongolian word for ""meadow"".",140,"For what time are old terms for ""green"" derived from words for fresh, sprouting vegetation?",Sanskrit,Greek,the past few millennia,Romance,3,"በዚ ኸኣ እቶም ኣብ ላዕሊ ዝተጠቕሱ ቋንቋታት (ጀርመናዊ፡ ፍቕራዊ ርክብ፡ ስላቭ፡ ግሪኽ) ን""ሓምላይ"" ናይ ቀደም ቃላት ኣለዎም እዚ ድማ ካብ ቃላት ንፍሩይን ዝበቁልን ኣትክልቲ ዝመጽእ እዩ። ይኹን እምበር፡ ንጽጽራዊ ስነ-ቋንቋ፡ እዞም ቃላት እዚኣቶም ብናጻ፡ ኣብ ዝሓለፈ ሒደት ኣሽሓት ኣሽሓት ከም እተቐርጹ ብንጹር ይገልጽ፣ ከምኡውን ን""ሓምላይ"" ዚኸውን መለለዪ ንጽል ፕሮቶ-ኢንዶ-ኢንዶ-ኢንዶ-ኣውሮጳዊ ወይ ቃል የለን። ንኣብነት፡ እቲ ስላቪክ ዘለን ብሳንስክሪት ሃሪ ""ብጫ፡ ኦክረ፡ ወርቃዊ"" ዝለለየ እዩ። እቶም ቱርኪውያን ቋንቋታት እውን jašɨl ""green"" ወይ ""yellowish green"" ኣለዎም፣ እዚ ድማ ምስቲ ን""ሜዶው"" ዝብል ሞንጎላዊ ቃል ክነጻጸር ከሎ እዩ።","ን""ሓምላይ"" ካብ ቃላት ንፍሩይን ዝበቁልን ኣትክልቲ ካብ ዝረኸብዎ ናይ ቀደም ቃላት ክንደይ እዮም?",ሳንስክሪት,ግሪኽ,ኣብ ዝሓለፈ ሒደት ኣሽሓት ኣሽሓት,ሮማንስ
"Lancashire is smaller than its historical extent following a major reform of local government. In 1889, the administrative county of Lancashire was created, covering the historical county except for the county boroughs such as Blackburn, Burnley, Barrow-in-Furness, Preston, Wigan, Liverpool and Manchester. The area served by the Lord-Lieutenant (termed now a ceremonial county) covered the entirety of the administrative county and the county boroughs, and was expanded whenever boroughs annexed areas in neighbouring counties such as Wythenshawe in Manchester south of the River Mersey and historically in Cheshire, and southern Warrington. It did not cover the western part of Todmorden, where the ancient border between Lancashire and Yorkshire passes through the middle of the town.",141,When was Lancashire created?,Cheshire,the Lord-Lieutenant,1889,Lancashire and Yorkshire,3,ላንካሻየር ካብቲ ታሪኻዊ ስፍሓቱ ዝነኣሰ ኮይኑ፡ ድሕሪ ዓቢ ጽገና ከባብያዊ መንግስቲ። ኣብ 1889 ምምሕዳራዊ ኣውራጃ ላንካሻየር ተፈጢሩ፡ ብዘይካ ከም ብላክበርን፡ በርንሊ፡ ባሮው-ኢን-ፉርነስ፡ ፕረስተን፡ ዊጋን፡ ሊቨርፑልን ማንቸስተርን ዝኣመሰሉ ናይ ኣውራጃ ከባቢታት ንታሪኻዊ ኣውራጃ ዝሽፍን ነበረ። እቲ ብጐይታ-ሊዩተናንት ዝገልጾ ከባቢ (ሕጂ ስርዓታዊ ኣውራጃ ተባሂሉ ዝጽዋዕ) ንብምሉኡ እቲ ምምሕዳራዊ ኣውራጃን ኣውራጃዊ ከባቢታትን ዝሽፍን ነበረ፣ ኣብ ከም ዋይተንሻወ ኣብ ማንቸስተር ንደቡብ ካብ ሩባ መርሲን ብታሪኽ ኣብ ቸሻየርን ሳውዘርን ዋሪንግተንን ኣብ ከም ዋይተንሻወ ዝኣመሰሉ ከባቢታት ኣብ ዝኣተዉሉ ቦታታት ኣብ ዝኣተዉሉ እዋን ድማ ተሰፍሐ። ነቲ ኣብ መንጎ ላንካሻየርን ዮርክሻየርን ዝነበረ ጥንታዊ ዶብ ብማእከል እታ ከተማ ዝሓልፍ ዝነበረ ምዕራባዊ ክፋል ቶድሞርደን ኣይሸፈኖን።,ላንካሻየር መዓስ እዩ ተፈጢሩ?,ቸሻየር,እቲ ጎይታ-ሌተናላት .,1889,ላንካሻየርን ዮርክሻየርን
"The second approach to the problem took as its base the notion of class, and defines a set as a class which belongs to other classes, while a proper class is defined as a class which does not belong to other classes. Under the Zermelo–Fraenkel approach, the axioms impede the construction of a set of all sets which do not belong to themselves. In contrast, under the von Neumann approach, the class of all sets which do not belong to themselves can be constructed, but it is a proper class and not a set.",142,Which approach to the problem takes as its base the notion of class?,second,Zermelo,Neumann,time.n.04,1,እቲ ካልኣይ ኣገባብ ናይቲ ጸገም ከም መሰረቱ ናይ ደርቢ ኣምር ወሲዱ፣ ንሓደ ስብስብ ከም ሓደ ክፍሊ ናይ ካልኦት ክፍልታት ዝምልከቱ ይገልጾ፣ ግቡእ ክፍሊ ድማ ከም ሓደ ክፍሊ ዘይነበረ ክፍሊ ኮይኑ ይግለጽ። ኣብ ትሕቲ ኣቀራርባ ዘርሜሎ–ፍሬንከል፡ ኣክሲዮማት ንህንጸት ናይ ኩሎም ናይ ገዛእ ርእሶም ዘይኮኑ ስብስባት ንምህናጽ ይዕንቅፉ። ብኣንጻሩ ኣብ ትሕቲ ቮን ኖይማን ኣገባብ፡ ናይ ኩሎም ናይ ገዛእ ርእሶም ዘይኮኑ ስብስባት ደርቢ ክህነጽ ይኽእል እዩ፡ ግን ግቡእ ደርቢ እምበር ስብስብ ኣይኮነን።,እቲ ጸገም ኣየናይ ኣገባብ እዩ ከም መሰረቱ ንኣምር ደርባዊ ኣምር ዝወስድ?,ካልኣይ,ዘርመል,ኖይማን,ግዜ.N.04
"In 2002, Chinese geologist Chen Xuezhong published a Seismic Risk Analysis study in which he came to the conclusion that beginning with 2003, attention should be paid to the possibility of an earthquake with a magnitude of over 7.0 occurring in Sichuan region. He based his study on statistical correlation. That Sichuan is a seismically active area has been discussed for years prior to the quake, though few studies point to a specific date and time.",143,When was a Seismic Risk Analysis published?,Chen Xuezhong,over 7.0,Sichuan,2002,4,ኣብ 2002፡ ቻይናዊ ስነ-ምድራዊ ክኢላ ቸን ዙዝሆንግ፡ ካብ 2003 ጀሚሩ፡ ካብ 2003 ጀሚሩ፡ ኣብ ዞባ ሲቹዋን ልዕሊ 7.0 ክኽሰት ዝኽእል ምንቅጥቃጥ ምድሪ ክኸውን ከም ዝኽእል ኣቓልቦ ክግበረሉ ከም ዘለዎ ኣብ መደምደምታ በጺሑ፡ ኣብ መደምደምታ በጺሑ። መጽናዕቱ ኣብ ስታቲስቲካዊ ምትእስሳር መሰረት ገይሩ እዩ። ሲቹዋን ቅድሚ እቲ ምንቅጥቃጥ ምድሪ ንዓመታት ንዓመታት ከም ዝዝረበሉ እኳ እንተገለጸ፡ ንፍሉይ ዕለትን ሰዓትን ዝሕብሩ ውሑዳት መጽናዕትታት እኳ እንተኾኑ።,ትንተና ሓደጋ ስይስሚክ መዓስ እዩ ተሓቲሙ?,ቸን x ዩው .,ልዕሊ 7.0,ሲቹዋን,2002 ዓ.ም.
"In March 2006, it was revealed by the Archivist of the United States in a public hearing that a memorandum of understanding between NARA and various government agencies existed to ""reclassify"", i.e., withdraw from public access, certain documents in the name of national security, and to do so in a manner such that researchers would not be likely to discover the process (the U.S. reclassification program). An audit indicated that more than one third withdrawn since 1999 did not contain sensitive information. The program was originally scheduled to end in 2007.",144,Who revealed that NARA had a deal with several government agencies to withdraw from public access?,U.S.,March 2006,more than one third,Archivist,4,"ኣብ መጋቢት 2006 ኣብ መንጎ ናራን ዝተፈላለዩ መንግስታዊ ትካላትን ናይ ምርድዳእ መዘክር ""ዳግማይ ንምምላእ"" ከምዝነበረ ኣብ ሓደ ህዝባዊ መስማዕ ብኣካላዊ መስማዕ ተገሊፁ፣ i.e.፣ ካብ ህዝባዊ ተበፃሕነት፣ ዝተወሰኑ ሰነዳት ብስም ሃገራዊ ድሕነት ክስሕብ፣ ከምኡ እውን ተመራመርቲ ነቲ መስርሕ (The U.S. reclassification program) ክረኽብዎ ዘይክእሉ መንገዲ ክገብሩ ከምዘይክእሉ ተገሊፁ። ካብ 1999 ጀሚሩ ልዕሊ ሓደ ሳልሳይ ዝተሰሓበ ኦዲት ኣመልኪቱ ስሱዕ ሓበሬታ ከምዘይሓዘ እዩ። እቲ መደብ ፈለማ ኣብ 2007 ክውዳእ መደብ ተታሒዙሉ ነይሩ።",ናራ ምስ ሓያሎ መንግስታዊ ትካላት ካብ ህዝቢ ተበፃሕነት ዝወፅእ ውዕል ከምዝገበረ መን እዩ?,ንሕና።,መጋቢት 2006 ዓ.ም.,ልዕሊ ሓደ ሲሶ,ኣርካይቪስት
"In 1998 the Angiosperm Phylogeny Group published a phylogeny for flowering plants based on an analysis of DNA sequences from most families of flowering plants. As a result of this work, many questions, such as which families represent the earliest branches of angiosperms, have now been answered. Investigating how plant species are related to each other allows botanists to better understand the process of evolution in plants. Despite the study of model plants and increasing use of DNA evidence, there is ongoing work and discussion among taxonomists about how best to classify plants into various taxa. Technological developments such as computers and electron microscopes have greatly increased the level of detail studied and speed at which data can be analysed.",145,When did the Angiosperm Phylogeny Group publish a phylogeny for flowering plants?,1998,—,the Angiosperm Phylogeny Group,—,1,ኣብ 1998 እቲ ኣንጂዮስፐርም ፋይሎጀኒ ዝበሃል ጉጅለ፡ ካብ መብዛሕትኦም ስድራቤታት ዕምባባታት ተኽሊ፡ ኣብ ትንተና ናይ ዲኤንኤ መስርዕ ዝተመርኮሰ፡ ንዕምባባታት ዝኸውን ፋይሎጀኒ ኣሕቲሙ። ከም ውጽኢት ናይዚ ስራሕ እዚ፡ ብዙሓት ሕቶታት፡ ከምቲ ስድራቤታት ነቶም ቀዳሞት ጨናፍር ኣንጂዮስፐርም ዝውክሉ፡ ሕጂ መልሲ ረኺቦም ኣለዉ። ዓሌታት ተኽሊ ኣብ ነንሕድሕዶም ብኸመይ ከም ዝዛመዱ ምምርማር፡ ስነ-ዕጽዋት ንመስርሕ ፍልቀት ኣብ ተኽልታት ብዝበለጸ ንምርዳእ የኽእሎም። ዋላ እኳ ሞዴል ተኽልታት መፅናዕትን ኣጠቓቕማ መርትዖ ዲኤንኤ እናወሰኹን እንተመፁ እንተኾኑ ኣብ መንጎ ስርዓተ-ምምሕዳር ስርዓተ-ምምሕዳር ንተኽልታት ኣብ ዝተፈላለዩ ታክሳስ ከመይ ጌሮም ከም ዝምድቡ ቀጻሊ ስራሕን ዘተን ኣሎ። ከም ኮምፒዩተርን ኤሌክትሮን ማይክሮስኮፕን ዝኣመሰሉ ቴክኖሎጂካዊ ምዕባለታት ነቲ ዳታ ክትንትነሉ ዝኽእል ደረጃ ዝርዝር ዝተጽንዐን ፍጥነትን ኣዝዩ ኣዕብይዎ እዩ።,እቲ ኣንጂዮስፐርም ፋይሎጀኒ ዝበሃል ጉጅለ መዓስ እዩ ንዕምባባ ዝኸውን ተኽልታት ፋይሎጀኒ ኣሕቲሙ?,1998 ዓ.ም.,—,እቲ ኣንጂዮስፐርም ፋይሎጀኒ ዝበሃል ጉጅለ,—
"A bantam is a small variety of domestic chicken, either a miniature version of a member of a standard breed, or a ""true bantam"" with no larger counterpart. The name derives from the town of Bantam in Java where European sailors bought the local small chickens for their shipboard supplies. Bantams may be a quarter to a third of the size of standard birds and lay similarly small eggs. They are kept by small-holders and hobbyists for egg production, use as broody hens, ornamental purposes, and showing.",146,What is a small variety of domestic chicken called?,a quarter to a third,Bantam,European,Java,2,"ባንታም ንእሽቶ ዓይነት ናይ ገዛ ደርሆ ኮይኑ፡ ወይ ንእሽቶ ስሪት ናይ ሓደ ኣባል ናይ ሓደ መደበኛ ዓሌት፡ ወይ ድማ ዝዓቢ መዛኑ ዘይብሉ ""ሓቀኛ ባንታም""። እዚ ስም ካብታ ኣብ ጃቫ እትርከብ ከተማ ባንታም ዝመጸ ኮይኑ፡ ኤውሮጳውያን ባሕረኛታት ነተን ኣብቲ ከባቢ ዝርከባ ንኣሽቱ ደርሁ ንመጓዓዝያኦም ዝኸውን ንብረት ዝገዝእኦ ዝነበራ ንኣሽቱ ደርሁ ዝገዝኡላ ቦታ እዩ። ባንታም ካብ ርብዒ ክሳብ ሲሶ ናይ መደበኛ ኣዕዋፍ ክኸውን ይኽእልን ብተመሳሳሊ ንኣሽቱ እንቋቑሖታት ክድቅስን ይኽእል እዩ። ብኣናእሽቱ ወነንቲን መዘናግዒን ዝዕቀቡ ንመፍረ እንቋቑሖ፣ ከም ዕንጨይቲ ኣንጭዋታት ይጥቀሙ፣ ስልማት ዕላማን ምርኢትን ይዕቀቡ።",ንእሽቶ ዓይነት ናይ ገዛ ደርሆ እንታይ ይበሃል?,ርብዒ ናብ ሳልሳይ,ባንታም,ኤውሮጳዊ,ጃቫ .
"The Zhengde Emperor (r. 1505–1521), who enjoyed the company of lamas at court despite protests from the censorate, had heard tales of a ""living Buddha"" which he desired to host at the Ming capital; this was none other than the Rinpung-supported Mikyö Dorje, 8th Karmapa Lama then occupying Lhasa. Zhengde's top advisors made every attempt to dissuade him from inviting this lama to court, arguing that Tibetan Buddhism was wildly heterodox and unorthodox. Despite protests by the Grand Secretary Liang Chu, in 1515 the Zhengde Emperor sent his eunuch official Liu Yun of the Palace Chancellery on a mission to invite this Karmapa to Beijing. Liu commanded a fleet of hundreds of ships requisitioned along the Yangtze, consuming 2,835 g (100 oz) of silver a day in food expenses while stationed for a year in Chengdu of Sichuan. After procurring necessary gifts for the mission, he departed with a cavalry force of about 1,000 troops. When the request was delivered, the Karmapa lama refused to leave Tibet despite the Ming force brought to coerce him. The Karmapa launched a surprise ambush on Liu Yun's camp, seizing all the goods and valuables while killing or wounding half of Liu Yun's entire escort. After this fiasco, Liu fled for his life, but only returned to Chengdu several years later to find that the Zhengde Emperor had died.",147,When did the Zhengde Emperor enjoy his company of lamas?,half,"2,835",1505–1521,Rinpung,3,"እቲ ካብ ሳንሱራውያን ተቓውሞታት እኳ እንተተራእየ፡ ኣብ ቤት ፍርዲ ንካምቢል ላማስ ዘስተማቐረ ዠንግደ ሃጸይ (R. 1505–1521)፡ ኣብ ርእሰ-ማል ሚንግ ከአንግድ ዝደለየ ""መንጐል ቡዳ"" ዝብል ዛንታታት ሰሚዑ ነይሩ፤ እዚ ብዘይካ እቲ ብሪንፑንግ ዝተደገፈ ሚክዮ ዶርጀ፡ 8ይ ካርማፓ ላማ ድሕሪኡ ንላሳ ዝሓዘ ኣይነበረን። ላዕለዎት ኣማኸርቲ ዠንግደ ነዚ ላማ ናብ ቤት ፍርዲ ከይዓድም ንምትዕንቓፍ ዝግበር ፈተነ ኩሉ ፈተነ ገይሮምዎ፣ ቲቤት ቡድሂዝም ብዘይ ምቁራጽ ሄተሮዶክስን ዘይኦርቶዶክስን እዩ ኢሉ ተማጒቱ። ዋላ’ኳ ብዓቢ ጸሓፊ ሊያንግ ቹ ተቓውሞ እንተሃለወ፡ ብ1515 ግን ዠንግደ ሃጸይ ነዚ ካርማፓ ናብ ቤጂንግ ንምዕዳም ተልእኾኡ ስሙይ ወግዓዊ ሊዩ ዩን ናይ ቤተ መንግስቲ ቻንስለር ሰደደሉ። ሊዩ ኣብ ያንግዱ 2,835 ግ (100 ኦንስ) ብሩር ኣብ ቸንግዱ ካብ ሲቹዋን ኣብ ዝዓረደሉ እዋን ኣብ መዓልቲ 2,835 ግ (100 ኦንስ) ብሩር ወሲዱ፡ ብኣማኢት ዝቑጸራ መራኽብ መርከብ ኣዘዘ። ንተልእኾ ዝኸውን ኣድላዪ ህያባት ድሕሪ ምዕዳጉ፡ ኣስታት 1000 ወተሃደራት ዝሓዘ ሓይሊ ፈረሰኛታት ሒዙ ተበገሰ። እቲ ሕቶ ምስ ቀረበ፡ እቲ ካርማፓ ላማ፡ እቲ ሓይሊ ሚንግ ንኽገድፎ እኳ እንተመጸ፡ ካብ ቲቤት ምውጻእ ኣብዩ። እቲ ካርማፓ ኣብ መዓስከር ሊዩ ዩን ሰርፕራይዝ ድብዝዝ ኣውጺኡ፡ ንፍርቂ ምሉእ ዓጀብቲ ሊዩ ዩን እናቐተለ ወይ ቁስሊ እናቐተለ፡ ንኹሉ ኣቕሑን ክቡር ኣቕሑን እናሓዘ። ድሕሪ እዚ ፍያስኮ እዚ ሊዩ ንህይወቱ ሃዲሙ፡ ድሕሪ ሓያሎ ዓመታት ግን ናብ ቸንግዱ ተመሊሱ፡ እቲ ሃጸይ ዠንግደ ከም ዝሞተ ረኸበ።",ዠንግደ ሃጸይ መዓስ እዩ ንላማስ ዝበሃል ትካል ዘስተማቐሮ?,ፍርቂ,"2,835",1505–1521,ሪንፑንግ
