passage,question_number,question,mc_answer1,mc_answer2,mc_answer3,mc_answer4,correct_answer_num,translated_passage,translated_question,translated_mc_answer1,translated_mc_answer2,translated_mc_answer3,translated_mc_answer4
"Valencia enjoyed strong economic growth over the last decade, much of it spurred by tourism and the construction industry,[citation needed] with concurrent development and expansion of telecommunications and transport. The city's economy is service-oriented, as nearly 84% of the working population is employed in service sector occupations[citation needed]. However, the city still maintains an important industrial base, with 5.5% of the population employed in this sector. Agricultural activities are still carried on in the municipality, even though of relatively minor importance with only 1.9% of the working population and 3973 hectares planted mostly in orchards and citrus groves.",119,What percentage of Valencia's population is employed in service sector occupations?,nearly 84%,Valencia,3973,the last decade,1,"Valencia enjoyed ጠንካራ ቁጠባዊ ዕቤት ልዕሊ እቲ መጨረሻ ,ዓሰርተ ዓመት ብዙሕ ካብ እቲ ነገር spurred ብ tourism እና እቲ ናይ ህንፃ ስራሕ ,[industry,[citation ]needed ምስ concurrent ዕብየት እና expansion ካብ telecommunications እና .መጓዓዝያ እቲ 'city's ቁጠባ እዩ -,service-oriented ከም ከባቢ %84 ካብ እቲ ምስራሕ በዝሒ ህዝቢ እዩ employed አብ ውሽጢ ግልጋሎት sector [occupations[citation ].needed ,ዋላኳ ተኾነ እቲ ከተማ እስካብ ሕዚ maintains ሓደ ጠቃሚ industrial ,መሰረት ምስ .%5.5 ካብ እቲ በዝሒ ህዝቢ employed አብ ውሽጢ እዚ .sector Agricultural ስራሕቲ እዮም እስካብ ሕዚ carried አብ ልዕሊ አብ ውሽጢ እቲ ,municipality ሙሉእ እኳ ካብ relatively ንኡስ importance ምስ ጥራሕ .%1.9 ካብ እቲ ምስራሕ በዝሒ ህዝቢ እና 3973 hectares planted መብዛሕትኡ ግዜ አብ ውሽጢ orchards እና citrus .groves",እንታይ percentage ካብ 'Valencia's በዝሒ ህዝቢ እዩ employed አብ ውሽጢ ግልጋሎት sector ?occupations,ከባቢ %84,Valencia,3973,እቲ መጨረሻ ዓሰርተ ዓመት
"The word ""animal"" comes from the Latin animalis, meaning having breath, having soul or living being. In everyday non-scientific usage the word excludes humans – that is, ""animal"" is often used to refer only to non-human members of the kingdom Animalia; often, only closer relatives of humans such as mammals, or mammals and other vertebrates, are meant. The biological definition of the word refers to all members of the kingdom Animalia, encompassing creatures as diverse as sponges, jellyfish, insects, and humans.",120,What language is the word animal originally from?,Animalia,old latin.n.01,Latin,romance.n.03,3,"እቲ ቃል """"እንስሳ comes ካብ እቲ Latin ,animalis ትርጉም ምህላው ,ተንፈሰ ምህላው መንፈስ ወይ ምንባር .ፍጥረት አብ ውሽጢ everyday -non-scientific usage እቲ ቃል excludes humans – እቲ ,እዩ """"እንስሳ እዩ ኩል ግዘ ዘገልገለ ናብ ምራሕ ጥራሕ ናብ -non-human members ካብ እቲ kingdom ;Animalia ,ኩል ግዘ ጥራሕ closer ዘመዳት ካብ humans ከምዚ ከም ,mammals ወይ mammals እና ካልእ ,vertebrates እዮም .ናይ ብሓቂ እቲ biological ኣገላልፃ ካብ እቲ ቃል refers ናብ ኩሎም members ካብ እቲ kingdom ,Animalia encompassing creatures ከም ዝተፈላለየ ከም ,sponges ,jellyfish ,insects እና .humans",እንታይ ቋንቋ እዩ እቲ ቃል እንስሳ originally ?ካብ,Animalia,ዓብይ ..latin.n.01,Latin,..romance.n.03
"New York—often called New York City or the City of New York to distinguish it from the State of New York, of which it is a part—is the most populous city in the United States and the center of the New York metropolitan area, the premier gateway for legal immigration to the United States and one of the most populous urban agglomerations in the world. A global power city, New York exerts a significant impact upon commerce, finance, media, art, fashion, research, technology, education, and entertainment, its fast pace defining the term New York minute. Home to the headquarters of the United Nations, New York is an important center for international diplomacy and has been described as the cultural and financial capital of the world.",121,What is the most populous city in the US?,one,the United States,the United Nations,New York,4,"ሓድሽ York—often ዝተፀወዐ ሓድሽ York ከተማ ወይ እቲ ከተማ ካብ ሓድሽ York ናብ ፍለ እቲ ነገር ካብ እቲ ግዝኣት ካብ ሓድሽ ,York ካብ አየናይ እቲ ነገር እዩ ሓደ part—is እቲ ብጥዕሚ populous ከተማ አብ ውሽጢ እቲ United States እና እቲ ማእኸል ካብ እቲ ሓድሽ York metropolitan ,ስፍሓት እቲ premier gateway ን ሕጋዊ immigration ናብ እቲ United States እና ሓደ ካብ እቲ ብጥዕሚ populous ከተማ agglomerations አብ ውሽጢ እቲ .ዓለም ሓደ ዓለምለኻዊ ሓይሊ ,ከተማ ሓድሽ York exerts ሓደ ግዙፍ ፅልዋ ኣብ ግዘ ,commerce ,ምምሕዳር ገንዘብ ,media ,ጥበብ ,ፋሽን ,ፅንዓት ,ቴክኖሎጂ ,ትምህርቲ እና ,ምዝንጋዕ ናቱ ቅልጡፍ እንቅስቃሰ defining እቲ ቃል ሓድሽ York .ደቒቓ ገዛ ናብ እቲ headquarters ካብ እቲ United ,Nations ሓድሽ York እዩ ሓደ ጠቃሚ ማእኸል ን ዓለም ለኻዊ diplomacy እና ኣለዎ ዝነበረ described ከም እቲ cultural እና ፋይናንሳዊ ሃብቲ ካብ እቲ .ዓለም",እንታይ እዩ እቲ ብጥዕሚ populous ከተማ አብ ውሽጢ እቲ ?ንሕና,ሓደ,እቲ United States,እቲ United Nations,ሓድሽ York
"Most of the Low Countries had come under the rule of the House of Burgundy and subsequently the House of Habsburg. In 1549 Holy Roman Emperor Charles V issued the Pragmatic Sanction, which further unified the Seventeen Provinces under his rule. Charles was succeeded by his son, King Philip II of Spain. In 1568 the Netherlands, led by William I of Orange, revolted against Philip II because of high taxes, persecution of Protestants by the government, and Philip's efforts to modernize and centralize the devolved-medieval government structures of the provinces. This was the start of the Eighty Years' War.",122,In what year did most of the Low Countries come under the rule of the House of Burgundy?,Netherlands,House,the Pragmatic Sanction,1549,4,"ብጥዕሚ ካብ እቲ ውሑድ Countries ዝነበረ ንዓ ትሕቲ እቲ ስርዓት ካብ እቲ ገዛ ካብ Burgundy እና subsequently እቲ ገዛ ካብ .Habsburg አብ ውሽጢ 1549 Holy Roman Emperor Charles V issued እቲ Pragmatic ,Sanction አየናይ ርሑቅ unified እቲ ዓሰርተ ሸውዓተ Provinces ትሕቲ ናቱ .ስርዓት Charles ኔሩ succeeded ብ ናቱ ,son ንጉስ Philip II ካብ .Spain አብ ውሽጢ 1568 እቲ ,Netherlands መረሐ ብ William ኣነ ካብ ,ኣራንሺ revolted ተቃራኒ Philip II ምኽንያቱ ካብ ላዕሊ ,taxes persecution ካብ Protestants ብ እቲ ,መንግስቲ እና 'Philip's efforts ናብ modernize እና centralize እቲ -devolved-medieval መንግስቲ structures ካብ እቲ .provinces እዚ ኔሩ እቲ ጀምር ካብ እቲ ሰማንያ 'ዓመታት .ውግእ",አብ ውሽጢ እንታይ ዓመት ግቡር ብጥዕሚ ካብ እቲ ውሑድ Countries ንዓ ትሕቲ እቲ ስርዓት ካብ እቲ ገዛ ካብ ?Burgundy,Netherlands,ገዛ,እቲ Pragmatic Sanction,1549
"Scientists do not know the exact cause of sexual orientation, but they believe that it is caused by a complex interplay of genetic, hormonal, and environmental influences. They favor biologically-based theories, which point to genetic factors, the early uterine environment, both, or the inclusion of genetic and social factors. There is no substantive evidence which suggests parenting or early childhood experiences play a role when it comes to sexual orientation. Research over several decades has demonstrated that sexual orientation ranges along a continuum, from exclusive attraction to the opposite sex to exclusive attraction to the same sex.",123,What three things do scientists not know cause sexual orientation?,"genetic, hormonal, and environmental influences",—,—,several decades,1,"ሳይንቲስት ግበር ዘይኮነ ፍለጥ እቲ ብልክዕ ጠንቂ ካብ sexual ,ኣንፈት ግን ንሶም እመን እቲ እቲ ነገር እዩ caused ብ ሓደ ሕውስዋስ interplay ካብ ,genetic ,hormonal እና environmental .influences ንሶም favor -biologically-based ,theories አየናይ ነጥቢ ናብ genetic ,factors እቲ ብግዘ uterine ,ከባቢ ,ክልቲኡ ወይ እቲ inclusion ካብ genetic እና ማሕበራዊ .factors ኣብቲ እዩ አይኮንን substantive ማስረጃ አየናይ suggests parenting ወይ ብግዘ ቁልዕነት experiences ተፃወት ሓደ ግደ መዓዝ እቲ ነገር comes ናብ sexual .ኣንፈት ፅንዓት ልዕሊ ቡዙሓት decades ኣለዎ demonstrated እቲ sexual ኣንፈት ranges ማዕረ ኣንፈት ሓደ ,continuum ካብ ንበይኑ ስሕበት ናብ እቲ ተቃራኒ sex ናብ ንበይኑ ስሕበት ናብ እቲ ማዕረ .sex",እንታይ ሰለስተ ነገራት ግበር ሳይንቲስት ዘይኮነ ፍለጥ ጠንቂ sexual ?ኣንፈት,",genetic ,hormonal እና environmental influences",—,—,ቡዙሓት decades
"Electroluminescence as a phenomenon was discovered in 1907 by the British experimenter H. J. Round of Marconi Labs, using a crystal of silicon carbide and a cat's-whisker detector. Soviet inventor Oleg Losev reported creation of the first LED in 1927. His research was distributed in Soviet, German and British scientific journals, but no practical use was made of the discovery for several decades. Kurt Lehovec, Carl Accardo and Edward Jamgochian, explained these first light-emitting diodes in 1951 using an apparatus employing SiC crystals with a current source of battery or pulse generator and with a comparison to a variant, pure, crystal in 1953.",124,Who discovered Electroluminescence?,H. J. Round,first,Soviet,several decades,1,"Electroluminescence ከም ሓደ ኽስተት ኔሩ discovered አብ ውሽጢ 1907 ብ እቲ British experimenter .H .J ዓንኬል ካብ Marconi ,Labs using ሓደ crystal ካብ silicon carbide እና ሓደ '-cat's-whisker .detector Soviet inventor Oleg Losev reported creation ካብ እቲ መጀመርታ መረሐ አብ ውሽጢ .1927 ናቱ ፅንዓት ኔሩ distributed አብ ውሽጢ ,Soviet German እና British scientific ,journals ግን አይኮንን ብተግባር ጥቅሚ ኔሩ ዝተሰርሐ ካብ እቲ discovery ን ቡዙሓት .decades Kurt ,Lehovec Carl Accardo እና Edward ,Jamgochian explained እዚ መጀመርታ -light-emitting diodes አብ ውሽጢ 1951 using ሓደ apparatus employing SiC crystals ምስ ሓደ እዋናዊ ፍልፍል ካብ ባትሪ ወይ pulse generator እና ምስ ሓደ ምውድዳር ናብ ሓደ ,variant ,ፅሩይ crystal አብ ውሽጢ .1953",መን discovered ?Electroluminescence,.H .J ዓንኬል,መጀመርታ,Soviet,ቡዙሓት decades
"Although testing can determine the correctness of software under the assumption of some specific hypotheses (see hierarchy of testing difficulty below), testing cannot identify all the defects within software. Instead, it furnishes a criticism or comparison that compares the state and behavior of the product against oracles—principles or mechanisms by which someone might recognize a problem. These oracles may include (but are not limited to) specifications, contracts, comparable products, past versions of the same product, inferences about intended or expected purpose, user or customer expectations, relevant standards, applicable laws, or other criteria.",125,What describes principles that can be used to detect problems?,prophetess.n.01,sibyl.n.02,augur.n.01,oracles,4,"ዋላ እኳ testing ይኽእል ርኸብ እቲ correctness ካብ ሶፍትዌር ትሕቲ እቲ ግምት ካብ ንእሽተይ ዝተወሰነ hypotheses (ረአ መራሕቲ ሃይማኖት ካብ testing difficulty ),ትሕቲ testing cannot ኣለሊ ኩሎም እቲ defects አብ ውሽጢ .ሶፍትዌር ,ከክንዲ እቲ ነገር furnishes ሓደ ወቐሳ ወይ ምውድዳር እቲ compares እቲ ግዝኣት እና ፀባይ ካብ እቲ ፍርያት ተቃራኒ oracles—principles ወይ mechanisms ብ አየናይ ሓደ ሰብ ይኸዉን ምልላይ ሓደ .ፀገም እዚ oracles ተዝኸዉን ይሓውስ (ግን እዮም ዘይኮነ limited )ናብ ,specifications ,contracts comparable ,products ሕሉፍ versions ካብ እቲ ማዕረ ,ፍርያት inferences ብዝዕባ ዝተዳለወ ወይ ዝፅበ ,ዕላማ user ወይ ዓሚል ,expectations ጠቃሚ ,standards applicable ,laws ወይ ካልእ .መለክዒ",እንታይ describes principles እቲ ይኽእል ኩን ዘገልገለ ናብ ምምርማር ?problems,..prophetess.n.01,..sibyl.n.02,..augur.n.01,oracles
"At launch, the Xbox 360 was available in two configurations: the ""Xbox 360"" package (unofficially known as the 20 GB Pro or Premium), priced at US$399 or GB£279.99, and the ""Xbox 360 Core"", priced at US$299 and GB£209.99. The original shipment of the Xbox 360 version included a cut-down version of the Media Remote as a promotion. The Elite package was launched later at US$479. The ""Xbox 360 Core"" was replaced by the ""Xbox 360 Arcade"" in October 2007 and a 60 GB version of the Xbox 360 Pro was released on August 1, 2008. The Pro package was discontinued and marked down to US$249 on August 28, 2009 to be sold until stock ran out, while the Elite was also marked down in price to US$299.",126,How many configurations were available for the 360?,the Media Remote,two,"August 1, 2008","August 28, 2009",2,"ኣብ ,ኣወንጭፍ እቲ Xbox 360 ኔሩ ቅሩብ አብ ውሽጢ ክልተ :configurations እቲ ""Xbox ""360 ጥቕላል (unofficially ፍሉጥ ከም እቲ 20 GB Pro ወይ ),ክፍሊት priced ኣብ $US$399 ወይ .,GB£279.99 እና እቲ ""Xbox 360 "",ማእኸል priced ኣብ $US$299 እና ..GB£209.99 እቲ ኦርጂናል shipment ካብ እቲ Xbox 360 ሕታም included ሓደ -cut-down ሕታም ካብ እቲ Media መቆፃፀሪ ከም ሓደ .ምስግጋር እቲ Elite ጥቕላል ኔሩ launched ዳሕራይ ኣብ $.US$479 እቲ ""Xbox 360 ""ማእኸል ኔሩ replaced ብ እቲ ""Xbox 360 ""Arcade አብ ውሽጢ ጥቅምቲ 2007 እና ሓደ 60 GB ሕታም ካብ እቲ Xbox 360 Pro ኔሩ ተለቒቑ አብ ልዕሊ ነሓሰ ,1 .2008 እቲ Pro ጥቕላል ኔሩ discontinued እና marked ታሕቲ ናብ $US$249 አብ ልዕሊ ነሓሰ ,28 2009 ናብ ኩን ሽዩጥ ክሳብ ኽዙን ጎየየ ,ደገ እስካብ እቲ Elite ኔሩ እውን marked ታሕቲ አብ ውሽጢ ዋጋ ናብ $.US$299",ከመይ ቡዙሕ configurations ኔሮም ቅሩብ ን እቲ ?360,እቲ Media መቆፃፀሪ,ክልተ,"ነሓሰ ,1 2008","ነሓሰ ,28 2009"
"The contemporary Liberal Party generally advocates economic liberalism (see New Right). Historically, the party has supported a higher degree of economic protectionism and interventionism than it has in recent decades. However, from its foundation the party has identified itself as anti-socialist. Strong opposition to socialism and communism in Australia and abroad was one of its founding principles. The party's founder and longest-serving leader Robert Menzies envisaged that Australia's middle class would form its main constituency.",127,Which party generally advocates economic liberalism?,Robert Menzies,Australia,Liberal Party,recent decades,3,"እቲ ወቕታዊ Liberal ጓይላ ብሓፈሻ advocates ቁጠባዊ liberalism (ረአ ሓድሽ ).ትኽክል ,Historically እቲ ጓይላ ኣለዎ supported ሓደ higher መዐቀኒ ካብ ቁጠባዊ protectionism እና interventionism ካብ እቲ ነገር ኣለዎ አብ ውሽጢ ናይ ቀረባ .decades ,ዋላኳ ተኾነ ካብ ናቱ መሰረት እቲ ጓይላ ኣለዎ identified itself ከም -.anti-socialist ጠንካራ opposition ናብ socialism እና communism አብ ውሽጢ Australia እና ካብ ዓዲ ወፃእ ኔሩ ሓደ ካብ ናቱ founding .principles እቲ 'party's founder እና -longest-serving መራሒ Robert Menzies envisaged እቲ 'Australia's ማእኸል ክፍሊ ይኸውን ፎርም ናቱ ዋና .constituency",አየናይ ጓይላ ብሓፈሻ advocates ቁጠባዊ ?liberalism,Robert Menzies,Australia,Liberal ጓይላ,ናይ ቀረባ decades
"Baird Television Ltd. made Britain's first television broadcast, on 30 September 1929 from its studio in Long Acre, London, via the BBC's London transmitter, using the electromechanical system pioneered by John Logie Baird. This system used a vertically-scanned image of 30 lines – just enough resolution for a close-up of one person, and with a bandwidth low enough to use existing radio transmitters. Simultaneous transmission of sound and picture was achieved on 30 March 1930, by using the BBC's new twin transmitter at Brookmans Park. By late 1930, 30 minutes of morning programmes were broadcast Monday to Friday, and 30 minutes at midnight on Tuesdays and Fridays, after BBC radio went off the air. Baird broadcasts via the BBC continued until June 1932.",128,When did Baird broadcast its first broadcast?,30 minutes,30 September 1929,one,Long Acre,2,"Baird Television .Ltd ዝተሰርሐ 'Britain's መጀመርታ television ,ፈነወ አብ ልዕሊ 30 መስከረም 1929 ካብ ናቱ studio አብ ውሽጢ ነዊሕ ,Acre ,London ብመልክዕ እቲ 'BBC's London ,transmitter using እቲ electromechanical ስርዓት pioneered ብ John Logie .Baird እዚ ስርዓት ዘገልገለ ሓደ -vertically-scanned ስእሊ ካብ 30 lines – ጥራሕ እኹል መፍትሒ ምሃብ ን ሓደ -close-up ካብ ሓደ ,ሰብ እና ምስ ሓደ bandwidth ውሑድ እኹል ናብ ጥቅሚ ነባር radio .transmitters Simultaneous transmission ካብ ድምጺ እና ስእሊ ኔሩ achieved አብ ልዕሊ 30 መጋቢት ,1930 ብ using እቲ 'BBC's ሓድሽ twin transmitter ኣብ Brookmans .መናፈሻ ብ ረፋድ ,1930 30 ደቒቓታት ካብ ጉሓት programmes ኔሮም ፈነወ ሶኑይ ናብ ,ዓርቢ እና 30 ደቒቓታት ኣብ ፍርቂ ለይቲ አብ ልዕሊ Tuesdays እና ,Fridays ድሕሪ BBC radio ኬዱ ምጥፋእ እቲ .ኣየር Baird broadcasts ብመልክዕ እቲ BBC continued ክሳብ ሰነ .1932",መዓዝ ግቡር Baird ፈነወ ናቱ መጀመርታ ?ፈነወ,30 ደቒቓታት,30 መስከረም 1929,ሓደ,ነዊሕ Acre
"The term can be found used in an October 1845 Massachusetts Circuit Court ruling in the patent case Davoll et al. v. Brown., in which Justice Charles L. Woodbury wrote that ""only in this way can we protect intellectual property, the labors of the mind, productions and interests are as much a man's own...as the wheat he cultivates, or the flocks he rears."" The statement that ""discoveries are...property"" goes back earlier. Section 1 of the French law of 1791 stated, ""All new discoveries are the property of the author; to assure the inventor the property and temporary enjoyment of his discovery, there shall be delivered to him a patent for five, ten or fifteen years."" In Europe, French author A. Nion mentioned propriété intellectuelle in his Droits civils des auteurs, artistes et inventeurs, published in 1846.",129,"Where was the term ""patent"" used?",ten or fifteen years,five,Davoll,Massachusetts Circuit Court,4,"እቲ ቃል ይኽእል ኩን ተረኺቡ ዘገልገለ አብ ውሽጢ ሓደ ጥቅምቲ 1845 Massachusetts Circuit ቤት ፍርዲ ruling አብ ውሽጢ እቲ patent ጉዳይ Davoll et .al .v .,ቡኒ አብ ውሽጢ አየናይ ፍትሒ Charles .L Woodbury ጽሒፉ እቲ ""ጥራሕ አብ ውሽጢ እዚ መንገዲ ይኽእል ንሕና ሓሉ ምሁራዊ ,ንብረት እቲ labors ካብ እቲ ,ሓንጎል productions እና interests እዮም ከም ብዙሕ ሓደ 'man's ...own...as እቲ ስርናይ ንሱ ,cultivates ወይ እቲ flocks ንሱ .""rears እቲ ዓንቀፅ እቲ ""discoveries ...""are...property ይኸድ ዝባን .ኣቕድም ኣቢሉ ክፍሊ 1 ካብ እቲ French ሕጊ ካብ 1791 ,stated ""ኩሎም ሓድሽ discoveries እዮም እቲ ንብረት ካብ እቲ ;ጸሓፊ ናብ assure እቲ inventor እቲ ንብረት እና ግዚያዊ enjoyment ካብ ናቱ ,discovery ኣብቲ ይግባእ ኩን ኣብፀሐ ናብ ንሱ ሓደ patent ን ,ሓሙሽተ ዓሰርተ ወይ ዓሰርተ ሓሙሽተ .""ዓመታት አብ ውሽጢ ,Europe French ጸሓፊ .ሓደ Nion ተጸሪሑ propriété intellectuelle አብ ውሽጢ ናቱ Droits civils des ,auteurs artistes et ,inventeurs published አብ ውሽጢ .1846","አበይ ኔሩ እቲ ቃል """"patent ?ዘገልገለ",ዓሰርተ ወይ ዓሰርተ ሓሙሽተ ዓመታት,ሓሙሽተ,Davoll,Massachusetts Circuit ቤት ፍርዲ
"Prior to the designation of immunity from the etymological root immunis, which is Latin for ""exempt""; early physicians characterized organs that would later be proven as essential components of the immune system. The important lymphoid organs of the immune system are the thymus and bone marrow, and chief lymphatic tissues such as spleen, tonsils, lymph vessels, lymph nodes, adenoids, and liver. When health conditions worsen to emergency status, portions of immune system organs including the thymus, spleen, bone marrow, lymph nodes and other lymphatic tissues can be surgically excised for examination while patients are still alive.",130,What language does immunis come from?,low latin.n.01,romance.n.03,Latin,old latin.n.01,3,"ቅድሚያ ናብ እቲ ምስረታ ካብ immunity ካብ እቲ etymological ሱር ,immunis አየናይ እዩ Latin ን """";exempt ብግዘ physicians characterized organs እቲ ይኸውን ዳሕራይ ኩን proven ከም ኣገዳሲ components ካብ እቲ immune .ስርዓት እቲ ጠቃሚ lymphoid organs ካብ እቲ immune ስርዓት እዮም እቲ thymus እና ዓፅሚ ,marrow እና ሓለቓ lymphatic tissues ከምዚ ከም ,spleen ,tonsils lymph ,vessels lymph ,nodes ,adenoids እና .ኩሊት መዓዝ ጥዕና ኩነታት worsen ናብ ህጹጽ ,ኩነታት portions ካብ immune ስርዓት organs ይሓውስ እቲ ,thymus ,spleen ዓፅሚ ,marrow lymph nodes እና ካልእ lymphatic tissues ይኽእል ኩን surgically excised ን examination እስካብ patients እዮም እስካብ ሕዚ .ነባሪ",እንታይ ቋንቋ ምግባር immunis ንዓ ?ካብ,ውሑድ ..latin.n.01,..romance.n.03,Latin,ዓብይ ..latin.n.01
"Zinc is a chemical element with symbol Zn and atomic number 30. It is the first element of group 12 of the periodic table. In some respects zinc is chemically similar to magnesium: its ion is of similar size and its only common oxidation state is +2. Zinc is the 24th most abundant element in Earth's crust and has five stable isotopes. The most common zinc ore is sphalerite (zinc blende), a zinc sulfide mineral. The largest mineable amounts are found in Australia, Asia, and the United States. Zinc production includes froth flotation of the ore, roasting, and final extraction using electricity (electrowinning).",131,How many is the atomic number for zinc?,Asia,30,Earth,the United States,2,"Zinc እዩ ሓደ chemical ባእታ ምስ ምልክት Zn እና atomic ቑጽሪ .30 እቲ ነገር እዩ እቲ መጀመርታ ባእታ ካብ ጉጅለ 12 ካብ እቲ periodic .ጠረጴዛ አብ ውሽጢ ንእሽተይ respects zinc እዩ chemically ተመሳሳሊ ናብ :magnesium ናቱ ion እዩ ካብ ተመሳሳሊ ግዝፊ እና ናቱ ጥራሕ ልሙድ oxidation ግዝኣት እዩ +.2 Zinc እዩ እቲ 24th ብጥዕሚ ኣኺሉ ዝተረፈ ባእታ አብ ውሽጢ 'Earth's crust እና ኣለዎ ሓሙሽተ ዝተረጋገአ .isotopes እቲ ብጥዕሚ ልሙድ zinc ore እዩ sphalerite (zinc ),blende ሓደ zinc sulfide .mineral እቲ largest mineable amounts እዮም ተረኺቡ አብ ውሽጢ ,Australia ,Asia እና እቲ United .States Zinc ምህርቲ includes froth flotation ካብ እቲ ,ore ,roasting እና final extraction using electricity ().electrowinning",ከመይ ቡዙሕ እዩ እቲ atomic ቑጽሪ ን ?zinc,Asia,30,መሬት,እቲ United States
