passage,question_number,question,mc_answer1,mc_answer2,mc_answer3,mc_answer4,correct_answer_num,translated_passage,translated_question,translated_mc_answer1,translated_mc_answer2,translated_mc_answer3,translated_mc_answer4
"Georgian architecture is characterized by its proportion and balance; simple mathematical ratios were used to determine the height of a window in relation to its width or the shape of a room as a double cube. Regularity, as with ashlar (uniformly cut) stonework, was strongly approved, imbuing symmetry and adherence to classical rules: the lack of symmetry, where Georgian additions were added to earlier structures remaining visible, was deeply felt as a flaw, at least before Nash began to introduce it in a variety of styles. Regularity of housefronts along a street was a desirable feature of Georgian town planning. Until the start of the Gothic Revival in the early 19th century, Georgian designs usually lay within the Classical orders of architecture and employed a decorative vocabulary derived from ancient Rome or Greece.",264,Which type of architecture is characterized by its proportion and balance?,the early 19th century,Classical,Georgian,Nash,3,ጆርጅያዊ ስነ ህንጻ ​​ብመጠንን ሚዛኑን ዝልለ እዩ፤ ምስ ስፍሓቱ ወይ ቅርጺ ሓደ ክፍሊ ከም ድርብ ኩቦ ብዝተኣሳሰር ቁመት ናይ ሓደ መስኮት ንምፍላጥ ቀሊል ናይ ሒሳብ ሬሽዮታት ተጠቒሙ። ስሩዕነት ከምቲ ኣብ ኣሽላር (ብዘይስነ-መሰረት ዝተቖርጸ) ናይ እምኒ ስራሕ፡ ብትሪ ተቐባልነት ረኺቡ፡ ሲሜትሪን ምኽባርን ክላሲካዊ ሕግታት፡ ማለት ኣብ ልዕሊ’ቲ ኣቐዲሞም ዝረኣዩ ዝነበሩ ናይ ጆርጅያውያን ተወሳኺ መዋቕራት ዝውሰኹሉ ዝነበሩ ሲሜትሪ ዘይምህላው፡ እንተወሓደ ቅድሚ ናሽ ብዝተፈላለየ ቅዲ ከተላልዮ ምጅማሩ፡ ከም ጉድለት ከም ጉድለት ኣዝዩ ተሰሚዑ። ስሩዕነት ናይ ገዛ ቅድሚት ኣብ ሓደ ጎደና ተደላዪ መለለዪ ናይ ጆርጅያ ከተማ ውጥን እዩ ነይሩ። ክሳብ ምጅማር ናይቲ ኣብ መጀመርታ መበል 19 ክፍለ ዘመን ዝነበረ ናይ ጎቲክ ትንሳኤ፡ ጆርጅያዊ ዲዛይናት መብዛሕትኡ ግዜ ኣብ ውሽጢ ክላሲካዊ ትእዛዛት ስነ ህንጻ ​​ዝንቀሳቐሱ ኮይኖም ካብ ጥንታዊት ሮማ ወይ ግሪኽ ዝተረኽበ ስልማት መዝገበ-ቓላት ይሰርሑ ነበሩ።,ኣየናይ ዓይነት ስነ ህንጻ ​​እዩ ብመጠንን ሚዛኑን ዝልለ?,መጀመርታ መበል 19 ክፍለ ዘመን,ክላሲካል,ጆርጅያ,ናሽ
"Though still predominantly green, post-2004 series incorporate other colors to better distinguish different denominations. As a result of a 2008 decision in an accessibility lawsuit filed by the American Council of the Blind, the Bureau of Engraving and Printing is planning to implement a raised tactile feature in the next redesign of each note, except the $1 and the version of the $100 bill already in process. It also plans larger, higher-contrast numerals, more color differences, and distribution of currency readers to assist the visually impaired during the transition period.",265,In what year was a lawsuit filed for the American Council of the Blind?,the Bureau of Engraving and,Printing,2008,100,3,ዋላ እኳ ሕጂ’ውን ብዓብላሊ መልክዑ ቀጠልያ እንተኾነ፡ ድሕሪ 2004 ዝተገብረ ተኸታታሊ፡ ንዝተፈላለዩ ዲኖሚንሽን ብዝበለጸ ንምፍላይ ካልኦት ሕብርታት ዘጠቓልል እዩ። ከም ውጽኢት ናይቲ ኣብ 2008 ኣብ ሓደ ብኣመሪካዊ ቤት ምኽሪ ዕዉር ኣመሪካ ዝቐረበ ናይ ተበጻሕነት ክሲ ውሳነ፡ ቢሮ ቅራጽን ሕትመትን ኣብ ዝቕጽል ዳግመ ምህዞ ነፍሲ ወከፍ ኖታ፡ ብዘይካ እቲ ድሮ ኣብ መስርሕ ዝነበረ $100 እማመ፡ ኣብ ዝቕጽል ዳግመ ምህዞ ነፍሲ ወከፍ ኖታ፡ ዝለዓለ ናይ ምትንኻፍ ባህሪ ንምትግባር መደብ ኣለዎ። ብተወሳኺ ኣብቲ ናይ ምስግጋር ግዜ ንዝፍጠር ምጉዳል ብዓይኒ ንምሕጋዝ ዝዓበየን ዝለዓለ ንጽጽር ዘለዎን ቁጽርታትን ምክፍፋል ኣንበብቲ ባጤራን ይውጥን።,ኣብ ኣየናይ ዓመት እዩ ንኣሜሪካዊ ቤት ምኽሪ ዕዉር ክሲ ዝቐረበሉ?,ቢሮ ቅራጽን .,ሕትመት,2008 ዓ.ም.,100 .
"19 Recordings, a recording label owned by 19 Entertainment, currently hold the rights to phonographic material recorded by all the contestants. 19 originally partnered with Bertelsmann Music Group (BMG) to promote and distribute the recordings through its labels RCA Records, Arista Records, J Records, Jive Records. In 2005-2007, BMG partnered with Sony Music Entertainment to form a joint venture known as Sony BMG Music Entertainment. From 2008-2010, Sony Music handled the distribution following their acquisition of BMG. Sony Music was partnered with American Idol and distribute its music, and In 2010, Sony was replaced by as the music label for American Idol by UMG's Interscope-Geffen-A&M Records.",266,What is the name of the recording label that holds the rights to phonographic material?,Bertelsmann Music Group,UMG,Interscope-Geffen-A&M Records,19,4,"19 ቅዳሓት ብ19 መዘናግዒ ዝውነን ናይ ቅዳሕ ትካል ኣብዚ እዋን እዚ መሰል ናይቲ ኩሎም ተወዳደርቲ ዝተቐድሐ ድምጻዊ ንዋት ዝሓዘ እዩ። 19 ፈለማ ምስ Bertelsmann Music Group (BMG) ብምትሕብባር ነቲ ቅዳሓት ብመንገዲ ምልክት RCA Records, Arista Records, J Records, Jive Records ኣቢሉ ንምልላይን ንምዝርጋሕን ብምትሕብባር። ኣብ 2005-2007 ቢኤምጂ ምስ ሶኒ ሙዚቃ ኢንተርተይንመንት ብምትሕብባር ሶኒ ቢኤምጂ ሙዚቃ ኢንተርተይንመንት ተባሂሉ ዝፍለጥ ናይ ሓባር ትካል መስሪቱ። ካብ 2008-2010 ዓ.ም.ፈ ሶኒ ሙዚቃ ንቢኤምጂ ምጥራይ ድሕሪ ምክያዶም ነቲ ምክፍፋል ኣካይዱ። ሶኒ ሙዚቃ ምስ ኣሜሪካን ኣይዶል ብምትሕብባር ሙዚቃኣ ትዝርግሕ ነበረት፣ ኣብ 2010 ድማ ሶኒ ብUMG’s Interscope-Geffen-A&M Records ከም ናይ ኣሜሪካዊት ኣይዶል ናይ ሙዚቃ ትካል ተተኪኣ።",መሰል ድምጻዊ ንዋት ዝሓዘ ናይ ምቕራጽ ምልክት እንታይ ይበሃል?,በርተለዝማን ሙዚቃ ጉጅለ,UMG,ኢንተርስኮፕ-ገፈን-ኤ ኤንድ ኤም መዛግብቲ,19 .
"
 Pakistan: The Olympic torch reached Islamabad for the first time ever on April 16. President Pervez Musharraf and Prime Minister Yousaf Raza Gillani spoke at the opening ceremony of the relay. Security was high, for what one newspaper called the ""most sensitive leg"" of the torch's Olympic journey. The relay was initially supposed to carry the torch around Islamabad, but the entire relay was cancelled due to security concerns regarding ""militant threats or anti-China protests"", and replaced by an indoors ceremony with the torch carried around the track of Jinnah Stadium. In fear of violent protests and bomb attacks, the torch relay in Pakistan took place in a stadium behind closed doors. Although the relay was behind closed doors, thousands of policemen and soldiers guarded the flame. As a consequence, no incidents arose.",267,On what date did the Olympic torch reach Islamabad?,Yousaf Raza Gillani,April 16,thousands,Jinnah Stadium,2,"ፓኪስታን፡ ሽግ ኦሎምፒክ ንመጀመርታ ግዜ ኣብ ኢስላምባድ በጺሑ ብ16 ሚያዝያ 16. ፕረዚደንት ፐርቨዝ ሙሻራፍን ቀዳማይ ሚኒስተርን ዩሳፍ ራዛ ጊላኒ ኣብ መኽፈቲ ስነ-ስርዓት ናይቲ ሪለይ ተዛሪቡ። ጸጥታ ልዑል እዩ ነይሩ፣ በቲ ሓንቲ ጋዜጣ ""ዝያዳ ተሃዋሲት እግሪ"" እትበሃል ናይ ሽግ ኦሎምፒክ ጉዕዞ። እቲ ሪለይ ኣብ መጀመርታ ነቲ ሽግ ኣብ ዙርያ ኢስላምባድ ክስከሞ ዝግባእ ዝነበረ ኮይኑ፡ እቲ ምሉእ ሪለይ ግን ብሰንኪ ""ዘይተኣማመን ስግኣታት ወይ ጸረ-ቻይና ተቓውሞታት"" ብዛዕባ ጸጥታዊ ስክፍታታት ተሰሪዙ፡ በቲ ሽግ ኣብ ዙርያ መስመር ጂናስ ተሰኪሙ ድማ ብናይ ውሽጢ ገዛ ስነ-ስርዓት ተተኪኡ። ዓመጽቲ ተቓውሞታትን መጥቃዕቲ ቦምባታትን ብምፍራሕ፡ ኣብ ፓኪስታን ዝነበረ ናይ ሽግ ሪለይ ኣብ ድሕሪ ዕጹው ማዕጾ ኣብ ዝርከብ ስታድዩም እዩ ተኻይዱ። እቲ ሪለይ ብድሕሪ ዕጹው ማዕጾ እኳ እንተነበረ፡ ኣሽሓት ፖሊስን ወተሃደራትን ግን ነቲ ሃልሃልታ ይሕልዉ ነበሩ። ከም ሳዕቤኑ ድማ ዝኾነ ፍጻመ ኣይተላዕለን።",ኦሎምፒክ ሽግ ኣብ ምንታይ ዕለት ኢዱ ኢስላምባድ በጺሑ?,ዩሳፍ ራዛ ጊላኒ,ሚያዝያ 16,ኣሽሓት,ጂና ስታድዩም
"According to his autobiography, Avicenna had memorised the entire Quran by the age of 10. He learned Indian arithmetic from an Indian greengrocer,ءMahmoud Massahi and he began to learn more from a wandering scholar who gained a livelihood by curing the sick and teaching the young. He also studied Fiqh (Islamic jurisprudence) under the Sunni Hanafi scholar Ismail al-Zahid. Avicenna was taught some extent of philosophy books such as Introduction (Isagoge)'s Porphyry (philosopher), Euclid's Elements, Ptolemy's Almagest by an unpopular philosopher, Abu Abdullah Nateli, who claimed philosophizing.",268,At what age did Avicenna remember the entire Quran?,the age of 10,Ismail al-Zahid,Sunni Hanafi,Euclid's Elements,1,ብመሰረት ታሪኽ ህይወቱ፡ ኣቪቸና ንብምልእታ ቁርኣን ኣብ መበል 10 ዓመት ዕድሚኣ ትዝክራ ኔራ።ንሱ ካብ ሓደ ህንዳዊ ሓምላይ ህንዳዊ ስነ-ሕሳብ ተማሂሩ፡ ،MAHMOUD MASSAHIHIን ንሱ ድማ ካብቲ ንሕማም ብምፍዋስን ንመንእሰያት ብምምሃርን መነባብሮ ዝረኸበ ዕንክሊል ዝበለ ምሁር ዝያዳ ክመሃር ጀመረ። ብተወሳኺ ኣብ ትሕቲ ሱኒ ሃናፊ ምሁር እስማዒል ኣል-ዛሂድ ፊቕክ (እስላማዊ ፍርዲ) ኣጽኒዑ። ኣቪቸና ገለ ፍልስፍና መጻሕፍቲ ከም መእተዊ (ኢሳጎጅ) ፖርፊሪ (ፊሎሶፈር)፣ ኤለመንት ዩክሊድ፣ ኣልማጌስት ቶለሚ ብዘይተፈተወ ፈላስፋ፣ ኣቡ ዓብደላ ኔትሊ፣ ፍልስፍናዊ ዝገብር፣ ከም ናይ ፍልስፍና መጻሕፍቲ ተማሂሩ።,ኣቪቸና ኣብ ምንታይ ዕድመ እዩ ንመላእ ቁርኣን ዝዘከሮ?,ዕድመ 10 .,እስማዒል ኣል -ዛሄድ,ሱኒ ሃናፊ,ናይ ዩክሊድ ባእታታት
"On February 17, 2010, AF1 announced it would use the ""Arena Football League"" name. The league announced plans for the upcoming season and details of its contract with NFL Network to broadcast AFL games in 2010. AF1 teams were given the option of restoring historical names to their teams. In addition to the historical teams, the league added two new expansion franchises, the Dallas Vigilantes and the Jacksonville Sharks.",269,"When was it announced that the Arena Football League would take the name ""Arena Football League""?",the Dallas Vigilantes,NFL Network,"the ""Arena Football League","February 17, 2010",4,"ብ17 ለካቲት 2010 ዓ.ም.ፈ.1፡ AF1 ""Arena Football League"" ዝብል ስም ከም እትጥቀም ኣፍሊጣ። እቲ ሊግ ንዝመጽእ ዓመተ ስፖርትን ዝርዝር ሓበሬታን ምስ NFL Network ንዘለወን ውዕል ብምልላይ ኣብ 2010 ጸወታታት ኤኤፍኤል ንምፍናው መደብ ከምዘለዎ ኣፍሊጡ።ጋንታታት AF1 ንጋንታታቶም ታሪኻዊ ኣስማት ናይ ምምላስ ኣማራጺ ተዋሂብወን። ብዘይካ እተን ታሪኻውያን ጋንታታት፡ እቲ ሊግ ክልተ ሓደስቲ ናይ ምስፍሕፋሕ ፍራንቻይዛት ወሲኹ፡ ዳላስ ቪጂላንተስን ጃክሰንቪል ሻርክስን ወሲኻ።","ሊግ ኩዕሶ እግሪ ኣሬና ""ኣረና ፉትቦል ሊግ"" ዝብል ስም ከም ዝወስድ መዓስ ከምዝተኣወጀ?",ዳላስ ቪጂላንተስ .,NFL ኔትወርክ,"እቲ ""ኣረና ኩዕሶ እግሪ ሊግ",17 ለካቲት 2010 ዓ.ም.
"The EFSA panel also determined intakes for different populations. Recommended intake volumes in the elderly are the same as for adults as despite lower energy consumption, the water requirement of this group is increased due to a reduction in renal concentrating capacity. Pregnant and breastfeeding women require additional fluids to stay hydrated. The EFSA panel proposes that pregnant women should consume the same volume of water as non-pregnant women, plus an increase in proportion to the higher energy requirement, equal to 300 mL/day. To compensate for additional fluid output, breastfeeding women require an additional 700 mL/day above the recommended intake values for non-lactating women.",270,Who determines intakes for different populations?,EFSA,—,300 mL/day,—,1,ፓነል EFSA ንዝተፈላለዩ ህዝብታት እውን ከምዝውሰድ ወሲኑ። ኣብ ኣረጋውያን ዝምከሩ መጠን ምውሳድ ምስቶም ንዓበይቲ ዝኸውን ተመሳሳሊ እኳ እንተኾነ፡ ዋላ’ኳ ትሑት ሃልኪ ጸዓት እንተሃለወ፡ ብሰንኪ ምንካይ ዓቕሚ ምትኳር ኩሊት፡ ናይ ማይ ጠለብ ናይዚ ጉጅለ ይውስኽ። ነፍሰጾራትን ጡብ ዝጥብዋ ደቂ ኣንስትዮን ማይ ንኽህልወን ተወሳኺ ፈሳሲ የድልዮም። እቲ EFSA ፓነል ነፍሰጾራት ከም ዘይወለደኛታት ደቂ ኣንስትዮ ተመሳሳሊ መጠን ማይ ክወስዳ ከምዘለወን ይእምት፣ ተወሳኺ ድማ ምስቲ ዝለዓለ ጸዓት ዝጠልብ መጠን ምውሳኽ፣ ማዕረ 300 ሚሊ ሊትር/መዓልቲ። ንተወሳኺ ፈሳሲ ውጽኢት ንምኽሓስ፡ ጡብ ኣደ ምጥባው ደቂ ኣንስትዮ፡ ካብቲ ንዘይምልማድ ዝሰርሓ ደቂ ኣንስትዮ ዝምከር ናይ መእተዊ ክብርታት ልዕሊ ተወሳኺ 700 ሚሊ ሊትር/መዓልቲ የድልያ።,ንዝተፈላለዩ ህዝብታት ምውሳድ መን ይውስን?,EFSA,—,300 ሚሊ ሊትር/መዓልቲ,—
"During the Eocene (56 million years ago - 33.9 million years ago), the continents continued to drift toward their present positions. At the beginning of the period, Australia and Antarctica remained connected, and warm equatorial currents mixed with colder Antarctic waters, distributing the heat around the world and keeping global temperatures high. But when Australia split from the southern continent around 45 Ma, the warm equatorial currents were deflected away from Antarctica, and an isolated cold water channel developed between the two continents. The Antarctic region cooled down, and the ocean surrounding Antarctica began to freeze, sending cold water and ice floes north, reinforcing the cooling. The present pattern of ice ages began about 40 million years ago.[citation needed]",271,During what period did the continents continue to drift toward their present positions?,Eocene,Australia,two,45,1,ኣብ እዋን ኢዮሰን (ቅድሚ 56 ሚልዮን ዓመታት - ቅድሚ 33.9 ሚልዮን ዓመታት) እተን ኣህጉራት ናብቲ ሕጂ ዘለወን መርገጺታት ምዝንጋዕ ቀጺለን። ኣብ መጀመርታ ናይቲ እዋን ኣውስትራልያን ኣንታርክቲካን ተተሓሒዘን ጸኒሐን፡ ውዑይ ናይ ኢኳቶርያል ዋሕዚታት ድማ ምስ ዝሑል ኣንታርክቲክ ማያት ተሓዋዊሱ፡ ኣብ መላእ ዓለም ዘሎ ሙቐት እናዘርግሐን ዓለማዊ ሙቐት ልዑል ብምሓዝን ይዝርግሕ ነበረ። ኣውስትራልያ ካብ ደቡባዊ ኣህጉር ኣብ ከባቢ 45 ማ ምስ ተፈላለየት ግን፡ እቲ ውዑይ ኢኳቶርያል ካረንት ካብ ኣንታርክቲካ ርሒቑ፡ ኣብ መንጎ ክልቲአን ኣህጉራት ድማ ዝተነጸለ ዝሑል ማይ መስመር ማዕቢሉ። እቲ ኣንታርክቲክ ዞባ እናዘሓለ፡ እቲ ኣብ ከባቢ ኣንታርክቲካ ዝነበረ ውቅያኖስ ድማ ክዓጽዎ ጀመረ፡ ዝሑል ማይን በረድን ናብ ሰሜን ይልእኽ እሞ ነቲ ምዝሓል ኣደልደሎ። እዚ ሕጂ ዘሎ ቅዲ ዘመናት በረድ ቅድሚ 40 ሚልዮን ዓመታት እዩ ጀሚሩ።[መግለጺ የድልዮ],እተን ኣህጉራት ናብቲ ሕጂ ዘለወን መርገጺታት ናብ ምንሳፍ ቀጺለን ነይረን?,ኢዮሲነ,ኣውስትራልያ,ክልተ,45 .
"Life with PlayStation, released on September 18, 2008 to succeed Folding@home, was retired November 6, 2012. Life with PlayStation used virtual globe data to display news and information by city. Along with Folding@home functionality, the application provided access to three other information ""channels"", the first being the Live Channel offering news headlines and weather which were provided by Google News, The Weather Channel, the University of Wisconsin–Madison Space Science and Engineering Center, among other sources. The second channel was the World Heritage channel which offered historical information about historical sites. The third channel was the United Village channel. United Village was designed to share information about communities and cultures worldwide. An update allowed video and photo viewing in the application. The fourth channel was the USA exclusive PlayStation Network Game Trailers Channel for direct streaming of game trailers.",272,How many information channels did Life with PlayStation provide?,PlayStation Network Game Trailers Channel,The Weather Channel,"September 18, 2008",three,4,"ህይወት ምስ ፕለይስተሽን፡ ብ18 መስከረም 2008 ክትክኦ ዝተዘርግሐት ን Folding@Home ክትትክእ ዝተዘርግሐት፡ ብ6 ሕዳር 2012 ጡረታ ወጺኣ።ህይወት ምስ ፕለይስተሽን ቨርቹዋል ግሎብ ዳታ ብከተማ ንምርኢት ቨርቹዋል ግሎብ ዳታ ተጠቒማ። ምስ Folding@home functionality፡ እቲ መመልከቲ ንሰለስተ ካልኦት ሓበሬታታት ""channels"" ንምርካብ፡ እቲ ቀዳማይ፡ እቲ ብGoogle News፡ The Weather Channel, The University of Wisconsin–Madison Science and Engineering Center፡ ንገለ ካብ ካልኦት ምንጭታት፡ ናይ ዜና ኣርእስታት ዜናን ኩነታት ኣየርን ዝህብ ቀጥታዊ ቻነል እዩ ነይሩ። እቲ ካልኣይ መስመር ድማ ብዛዕባ ታሪኻዊ ቦታታት ታሪኻዊ ሓበሬታ ዝህብ መስመር ቅርሲ ዓለም እዩ ነይሩ። ሳልሳይ ቻነል ድማ ናይ ዩናይትድ ቪለጅ ቻነል እዩ ነይሩ። ዩናይትድ ቪለጅ ብዛዕባ ማሕበረሰባትን ባህልታትን ኣብ መላእ ዓለም ሓበሬታ ንምክፋል ዝተዳለወት እያ። ኣብቲ ኣፕሊኬሽን ቪድዮን ስእልን ምርኣይ ዝፍቀድ update። እቲ ራብዓይ ቻነል ንናይ ጸወታ ትረይለራት ቀጥታዊ ምዝርጋሕ ናይ USA Exclusive PlayStation Network Game Trailers Channel እዩ ነይሩ።",ህይወት ምስ ፕለይስተሽን ክንደይ ናይ ሓበሬታ ቻነላት ኣቕሪባ?,ፕለይስተሽን ኔትወርክ ጸወታ ትረይለርስ ቻነል,እቲ ናይ ኩነታት ኣየር ቻነል,"መስከረም 18, 2008 ዓ.ም.",ሰለስተ
"Hogeschool institutions in the Flemish Community of Belgium (such as the Erasmus Hogeschool Brussel) are currently undergoing a process of academization. They form associations with a university and integrate research into the curriculum, which will allow them to deliver academic master's degrees.",273,What school is currently undergoing academization in Belgium?,the Flemish Community of Belgium,—,the Erasmus Hogeschool Brussel,—,3,ኣብዚ እዋን እዚ ኣብ ማሕበረሰብ ፍላሚሽ ቤልጅየም (ከም ኢራስመስ ሆገስኩል ብራስሰል) ትካላት ሆገስኩል ኣብ መስርሕ ኣካዳሚ ምግባር ይርከባ ኣለዋ። ምስ ሓደ ዩኒቨርሲቲ ማሕበራት ብምፍጣር ኣብቲ ስርዓተ ትምህርቲ ምርምር የዋሃህዱ፣ እዚ ድማ ኣካዳሚያዊ ማስተርስ ዲግሪ ከቕርቡ ዘኽእሎም እዩ።,ኣብዚ እዋን እዚ ኣብ ቤልጅየም ኣካዳሚዜሽን ይግበር ኣሎ?,እቲ ፍላሚሽ ዝበሃል ማሕበረሰብ ቤልጅየም,—,እቲ ኢራስሙስ ሆገስኩል ብራስሰል,—
"While some, like Spencer, used analogy from natural selection as an argument against government intervention in the economy to benefit the poor, others, including Alfred Russel Wallace, argued that action was needed to correct social and economic inequities to level the playing field before natural selection could improve humanity further. Some political commentaries, including Walter Bagehot's Physics and Politics (1872), attempted to extend the idea of natural selection to competition between nations and between human races. Such ideas were incorporated into what was already an ongoing effort by some working in anthropology to provide scientific evidence for the superiority of Caucasians over non white races and justify European imperialism. Historians write that most such political and economic commentators had only a superficial understanding of Darwin's scientific theory, and were as strongly influenced by other concepts about social progress and evolution, such as the Lamarckian ideas of Spencer and Haeckel, as they were by Darwin's work. Darwin objected to his ideas being used to justify military aggression and unethical business practices as he believed morality was part of fitness in humans, and he opposed polygenism, the idea that human races were fundamentally distinct and did not share a recent common ancestry.",274,Who argued that action was needed to correct social and economic inequities before natural selection could improve humanity further?,European,Physics and Politics,Caucasians,Alfred Russel Wallace,4,ገሊኦም ከም ስፐንሰር ከም ስፐንሰር፡ ካብ ተፈጥሮኣዊ ምርጫ ከም ሞጎት ኣንጻር መንግስታዊ ምትእትታው ኣብ ቁጠባ ንድኻታት ንምጥቃም ምምስሳል ክጥቀሙ እንከለዉ፡ ገሊኦም ድማ ኣልፍሬድ ራስል ዋላስ ሓዊሱ፡ ተፈጥሮኣዊ ምርጫ ቅድሚ ተፈጥሮኣዊ ምርጫ ንሰብኣውነት ዝያዳ ከማሓይሽ ምኽኣሉ፡ ነቲ ናይ ጸወታ ዓውዲ ንምልማድ ዝግበር ስጉምቲ ንምእራም ስጉምቲ ከምዘድሊ ይምጉቱ ነይሮም። ገለ ፖለቲካዊ ሓተታታት፡ እንተላይ ዋልተር ባጌሆት ፊዚክስን ፖለቲካን (1872)፡ ነቲ ተፈጥሮኣዊ ምርጫ ዝብል ሓሳብ ናብ ውድድር ኣህዛብን ኣብ መንጎ ዓሌታት ደቂ ሰባትን ንምዝርጋሕ ፈቲኖም። ከምዚኦም ዝበሉ ሓሳባት ኣብቲ ድሮ ኣብ ስነ-ሰብ ዝሰርሑ ዝነበሩ ገሊኦም ኣብ ልዕሊ ዘይጸለምቲ ዓሌታት ንዝለዓለ ካውካሲያውያን ሳይንሳዊ መርትዖታት ንምሃብን ንሃጸይነት ኤውሮጳ ንምምኽናይን ብስነ-ሰብ ዝሰርሕዎ ዝነበረ ቀጻሊ ጻዕሪ ተሓዊሶም። መብዛሕትኦም ከምዚኦም ዝኣመሰሉ ፖለቲካውን ቁጠባውን ወሃብቲ ርእይቶ ብዛዕባ ሳይንሳዊ ክልሰ-ሓሳብ ዳርዊን ላዕለዋይ ርድኢት ጥራይ ከም ዝነበሮም ጸሓፍ ታሪኽ ይጽሕፉ፣ ከምቲ ብስራሕ ዳርዊን ዝነበሮም ላማርክያዊ ሓሳባት ስፐንሰርን ሃከከልን ዝኣመሰሉ ብዛዕባ ማሕበራዊ ምዕባለን ፍልቀትን ዝኣመሰሉ ካልኦት ኣምር ብዛዕባ ማሕበራዊ ምዕባለን ፍልቀትን እውን ከም ዝተጸልዉ ይጽሕፉ። ዳርዊን ሞራል ኣካል ብቕዓት ኣብ ደቂ ሰባት እዩ ኢሉ ስለ ዝኣምን፡ ንወተሃደራዊ ምጥቃዕን ዘይስነ-ምግባራዊ ንግዳዊ ልምድታትን ንምምኽናይ ዝጥቀመሉ ዝነበረ ሓሳባቱ ተቓዊሙ፡ ንሱ ድማ ንፖሊጂኒዝም ዝቃወም ዝነበረ፡ ዓሌታት ደቂ ሰባት ብመሰረቱ ፍሉያት ምዃኖምን ኣብ ቀረባ እዋን ናይ ሓባር መበቆል ኣይካፈልን እዩ ዝብል ሓሳብ ተቓዊሙ።,ተፈጥሮኣዊ ምርጫ ንሰብኣውነት ዝያዳ ከማሓይሽ ቅድሚ ምኽኣሉ ማሕበራውን ቁጠባውን ዘይምዕሩይነት ንምእራም ስጉምቲ ከምዘድሊ መን ኣሎ?,ኤውሮጳዊ,ፊዚክስን ፖለቲካን,ካውካሲያውያን,ኣልፍሬድ ራስል ዋላስ
