passage,question_number,question,mc_answer1,mc_answer2,mc_answer3,mc_answer4,correct_answer_num,translated_passage,translated_question,translated_mc_answer1,translated_mc_answer2,translated_mc_answer3,translated_mc_answer4
"On October 9, 2006 at 6:00 a.m., the network switched to a 24-hour schedule, becoming one of the last major English-language broadcasters to transition to such a schedule. Most CBC-owned stations previously signed off the air during the early morning hours (typically from 1:00 a.m. to 6:00 a.m.). Instead of the infomercials aired by most private stations, or a simulcast of CBC News Network in the style of BBC One's nightly simulcast of BBC News Channel, the CBC uses the time to air repeats, including local news, primetime series, movies and other programming from the CBC library. Its French counterpart, Ici Radio-Canada Télé, still signs off every night.",127,When did CBC switch to a 24-hour schedule?,French,"October 9, 2006",Ici Radio-Canada Télé,CBC,2,ብዕለት 9 ጥቅምቲ 2006 ሰዓት 6፡00 a.m.፡ እቲ መርበብ ናብ 24 ሰዓታት ዝወሰደ መደብ ብምቕያር፡ ናብ ከምዚ ዝኣመሰለ መደብ ንምስግጋር ካብተን ናይ መወዳእታ ዓበይቲ ብቋንቋ እንግሊዝ ዝሰርሓ ፈነወታት ሓደ ካብቶም ናይ መወዳእታ ዓበይቲ ናይ ቋንቋ እንግሊዝ ፈነወታት ኮይኑ። መብዛሕትአን ብሲቢሲ ዝውነና ጣብያታት ቅድሚ ሕጂ ኣብ እዋን ንግሆ ካብ ኣየር ፈሪመን (ብተለምዶ ካብ ሰዓት 1:00 a.m ክሳብ 6:00 a.m.)። ኣብ ክንዲ እቶም ብመብዛሕትኦም ናይ ብሕቲ መደበራት ኣብ ኣየር ዝወጹ ኢንፎሜርሻል፡ ወይ ድማ ኣብ ቅዲ ናይ ቢቢሲ ዋን ናይትሊ ሲምዩልካስት ናይ ቢቢሲ ኒውስ ቻነል፡ ሲቢሲ ስሙልካስት፡ ሲቢሲ ነቲ ናይ ውሽጢ ዓዲ ዜናታት፡ ፕራይምታይም ተኸታታሊ፡ ፊልምታትን ካልእ መደባትን ካብ ቤተ መጻሕፍቲ ሲቢሲ ዝኣመሰሉ ናይ ኣየር ምድግጋም ይጥቀመሉ። ፈረንሳዊ መዘናኣ ICI Radio-Canada Télé ክሳብ ሕጂ ምሸት ይፈርም ኣሎ።,ሲቢሲ መዓስ እዩ ናብ 24 ሰዓታት ዝወሰደ መደብ ቀይሩ?,ፈረንሳዊ,9 ጥቅምቲ 2006 ዓ.ም.,ICI ሬድዮ-ካናዳ ቲቪ,ሲቢሲ
"While attending Ealing Art College, Tim Staffell became friends with Farrokh Bulsara, a fellow student who had assumed the English name of Freddie. Bulsara felt that he and the band had the same tastes and soon became a keen fan of Smile. In late 1970, after Staffell left to join the band Humpy Bong, the remaining Smile members, encouraged by Bulsara, changed their name to ""Queen"" and continued working together. When asked about the name, Bulsara explained, ""I thought up the name Queen. It's just a name, but it's very regal obviously, and it sounds splendid. It's a strong name, very universal and immediate. It had a lot of visual potential and was open to all sorts of interpretations. I was certainly aware of gay connotations, but that was just one facet of it.""",128,Who was a friend of Farrokh Bulsara?,Humpy Bong,Smile,Tim Staffell,late 1970,3,"ቲም ስታፈል ኣብ ኤሊንግ ኣርት ኮለጅ ኣብ ዝመሃርሉ ዝነበረ እዋን፡ ምስ ፋሮክ ቡልሳራ ዝተባህለ ናይ እንግሊዝኛ ስም ፍረዲ ዝወሰደ ብጻዩ ተማሃራይ ዕርክነት ፈጠረ። ቡልሳራ ንሱን እታ ባንድን ተመሳሳሊ ጣዕሚ ከም ዝነበሮም ተሰሚዕዋ ነዊሕ ከይጸንሐ ንቑሕ ደጋፊ ፍሽኽታ ኰነ። ኣብ መወዳእታ 1970 ስታፈል ናብታ ብቡልሳራ ዝተተባብዐት ዝተረፉ ኣባላት ፍሽኽታ ናብታ ባንድ ሁምፒ ቦንግ ክጽንበር ምስ ከደ ምስ ከደ፡ ስሞም ናብ ""ንግስቲ"" ቀይሮም ብሓባር ምስራሕ ቀጸሉ። ቡልሳራ ብዛዕባ እቲ ስም ምስ ተሓተተ ""ንንግስቲ ስም ሓሲበዮ። ስም ጥራይ እዩ ነይሩ፡ ግን ኣዝዩ ረጋል ምዃኑ ርዱእ እዩ፡ ብግልጺ ድማ ጽቡቕ ይመስል፡ ጽኑዕ ስም እዩ፡ ኣዝዩ ኣድማሳውን ቅጽበታዊን እዩ። ብዙሕ ናይ ምርኣይ ዓቕሚ ነይርዎ። ንኹሉ ዓይነት ትርጉማት ክፉት እዩ ነይሩ። ግን ብርግጽ ናይ ግብረሰዶማውያን ትርጉም ይፈልጦ ነይረ"" ክብል ገሊጹ።",ዓርኪ ፋሮክ ቡልሳራ መን እዩ ነይሩ?,ሑምፒ ቦንግ,ሰሓቅ,ቲም ስታፈል,ኣብ መወዳእታ 1970 ዓ.ም.
"There are typically 40 million bacterial cells in a gram of soil and a million bacterial cells in a millilitre of fresh water. There are approximately 5×1030 bacteria on Earth, forming a biomass which exceeds that of all plants and animals. Bacteria are vital in recycling nutrients, with many of the stages in nutrient cycles dependent on these organisms, such as the fixation of nitrogen from the atmosphere and putrefaction. In the biological communities surrounding hydrothermal vents and cold seeps, bacteria provide the nutrients needed to sustain life by converting dissolved compounds, such as hydrogen sulphide and methane, to energy. On 17 March 2013, researchers reported data that suggested bacterial life forms thrive in the Mariana Trench, which with a depth of up to 11 kilometres is the deepest part of the Earth's oceans. Other researchers reported related studies that microbes thrive inside rocks up to 580 metres below the sea floor under 2.6 kilometres of ocean off the coast of the northwestern United States. According to one of the researchers, ""You can find microbes everywhere — they're extremely adaptable to conditions, and survive wherever they are.""",129,How many bacterial cells exist in a gram of soil?,the Mariana Trench,up to 11 kilometres,17 March 2013,40 million,4,"ብተለምዶ 40 ሚልዮን ዋህዮታት ባክተርያ ኣብ ግራም ሓመድን ሓደ ሚልዮን ዋህዮታት ባክተርያን ኣብ ሚሊሊተር ፍሩይ ማይ ኣሎ። ኣብ ምድሪ ኣስታት 5×1030 ባክተርያታት ኣለዉ፣ እዚ ድማ ካብ ኩሎም ተኽልታትን እንስሳታትን ዝዛይድ ባዮማስ ይፈጥሩ። ባክተርያ ኣብ ዳግመ-ምጥቃም መኣዛታት ኣዝዩ ኣገዳሲ እዩ፣ ብዙሓት ካብቶም ደረጃታት ኣብ ዑደት መኣዛታት ኣብዞም ህይወታውያን ዝምርኮሱ፣ ከም ምትዕርራይ ናይትሮጅን ካብ ከባቢ ኣየርን ምዝንባዕን ዝኣመሰሉ። ኣብቲ ንሃይድሮተርማል መውጽኢ ማይን ዝሑል ሰፕስን ዝኸበበ ስነ-ህይወታዊ ማሕበረሰባት፡ ባክተርያ ከም ሃይድሮጅን ሳልፋይድን ሜታንን ዝኣመሰሉ ዝፈሰሱ ውህደታት ናብ ጸዓት ብምቕያር ህይወት ንምቕጻል ዘድሊ መኣዛታት ይህቡ። ብ17 መጋቢት 2013፡ ተመራመርቲ ኣብቲ ክሳብ 11 ኪሎሜተር ዝበጽሕ ዕምቆት ዘለዎ ማርያና ትሬንች፡ ህይወት ባክተርያ ከም ዝስስን ከም ዝሕብር ዝሕብር መረዳእታ ጸብጺቦም። ካልኦት ተመራመርቲ፡ ማይክሮብስ ኣብ ውሽጢ 2.6 ኪሎ ሜተር ካብ ገማግም ባሕሪ ሰሜናዊ ምዕራብ ሕቡራት መንግስታት ኣመሪካ ኣብ ትሕቲ 2.6 ኪሎ ሜተር ካብ ውቅያኖስ ክሳብ 580 ሜትሮ ትሕቲ 580 ሜትሮ ትሕቲ 580 ሜትሮ ከም ዝስስኑ ተዛመድቲ መጽናዕትታት ጸብጺቦም። ብመሰረት ሓደ ካብቶም ተመራመርቲ፡ ""ማይክሮብ ኣብ ኩሉ ቦታ ክትረክብ ትኽእል ኢኻ - ምስ ኩነታት ኣዝዮም ተላመድቲ እዮም፡ ኣብ ዝሃለዉሉ ቦታ ድማ ብህይወት ይነብሩ።""",ኣብ ሓደ ግራም ሓመድ ክንደይ ዋህዮታት ባክተርያ ኣለዉ?,እቲ ማርያና ትሬንች .,ክሳብ 11 ኪሎ ሜተር,17 መጋቢት 2013 ዓ.ም.,40 ሚልዮን
"Punjab (Urdu, Punjabi: پنجاب, panj-āb, ""five waters"":  listen (help·info)), also spelled Panjab, is the most populous of the four provinces of Pakistan. It has an area of 205,344 square kilometres (79,284 square miles) and a population of 91.379.615 in 2011, approximately 56% of the country's total population. Its provincial capital and largest city is Lahore. Punjab is bordered by the Indian states of Jammu and Kashmir to the northeast and Punjab and Rajasthan to the east. In Pakistan it is bordered by Sindh to the south, Balochistān and Khyber Pakhtunkhwa to the west, and Islamabad and Azad Kashmir to the north.",131,What is Punjab's overall population percentage?,Islamabad,approximately 56%,Panjab,Azad Kashmir,2,"ፑንጃብ (ኡርዱ፡ ፑንጃቢ፡ پنجاب፡ ፓንጅ-ኣብ፡ ""ሓሙሽተ ማያት""፡ ምስማዕ (ሓገዝ·ኢንፎ))፡ ካብ ኣርባዕተ ኣውራጃታት ፓኪስታን እቲ ዝበዝሐ ህዝቢ ዝመልአ እዩ። 205,344 ትርብዒት ኪሎሜተር (79,284 ትርብዒት ማይልስ) ስፍሓት ዘለዎ ኮይኑ ኣብ 2011 ድማ 91.379.615 ህዝቢ ዘለዎ ኮይኑ ኣስታት 56% ካብ ጠቕላላ ህዝቢ እታ ሃገር እዩ። ኣውራጃዊ ርእሰ ከተማን ዝዓበየት ከተማኣን ላሆር እያ። ፑንጃብ ብህንዳውያን ግዝኣታት ጃሙን ካሽሚርን ብሰሜናዊ ምብራቕን ፑንጃብን ራጃስታንን ብምብራቕ ዝዳወብ እዩ። ኣብ ፓኪስታን ብደቡብ ሲንድ፡ ባሎካስታንን ኻይበር ፓክቱንክዋን ብምዕራብ፡ ብሰሜን ድማ እስላምባድን ኣዛድ ካሽሚርን ዝዳወብ እዩ።",ፑንጃብ ሓፈሻዊ ሚእታዊት ህዝቢ እንታይ እዩ?,ኢስላምባድ,ኣስታት 56%,ፓንጃብ,ኣዛድ ካሽሚር
"The iPod is a line of portable media players and multi-purpose pocket computers designed and marketed by Apple Inc. The first line was released on October 23, 2001, about 8½ months after iTunes (Macintosh version) was released. The most recent iPod redesigns were announced on July 15, 2015. There are three current versions of the iPod: the ultra-compact iPod Shuffle, the compact iPod Nano and the touchscreen iPod Touch.",132,How long has the life of the iPod been on sale?,iPod,iTunes,about 8½ months,iPod Nano,3,"እቲ iPod መስመር ተንቀሳቐስቲ ናይ ሚድያ ተጻወትቲ ኮይኑ ብዙሕ ዕላማ ዘለዎ ናይ ጁባ ኮምፒዩተራት ብኣፕል ኢንክ ዝተነድፈን ኣብ ዕዳጋ ዝቐረበን እዩ።እቲ ቀዳማይ መስመር ብዕለት 23 ጥቅምቲ 2001 ዝተዘርግሐ ኮይኑ፡ iTunes (Macintosh version) ካብ ዝወጽእ ኣስታት 81⁄2 ኣዋርሕ ኣስታት 81⁄2 ኣዋርሕ ተዘርጊሑ። ኣብ ቀረባ እዋን ዝተገብረ ዳግመ ምህዞ iPod 15 ሓምለ 2015 ተገሊጹ።ሰለስተ ናይ ሕጂ ስሪት ናይቲ iPod ኣሎ፡ እቲ ultra-compact iPod Shuffle, The Compact iPod Nanoን The TouchScreen iPod Touchን ኣሎ።",ህይወት ናይቲ ኣይፖድ ክሳብ መዓስ እዩ ኣብ ዕዳጋ ኣትዩ?,ኣይፖድ,iTunes,ኣስታት 81⁄2 ወርሒ,ኣይፖድ ናኖ
"There are many styles of mandolin, but four are common, the Neapolitan or round-backed mandolin, the carved-top mandolin and the flat-backed mandolin. The round-back has a deep bottom, constructed of strips of wood, glued together into a bowl. The carved-top or arch-top mandolin has a much shallower, arched back, and an arched top—both carved out of wood. The flat-backed mandolin uses thin sheets of wood for the body, braced on the inside for strength in a similar manner to a guitar. Each style of instrument has its own sound quality and is associated with particular forms of music. Neapolitan mandolins feature prominently in European classical music and traditional music. Carved-top instruments are common in American folk music and bluegrass music. Flat-backed instruments are commonly used in Irish, British and Brazilian folk music. Some modern Brazilian instruments feature an extra fifth course tuned a fifth lower than the standard fourth course.",133,How many styles of mandolin are common?,Neapolitan,Brazilian,British,four,4,ብዙሓት ቅዲታት ማንዶሊን ኣለዉ፡ ኣርባዕተ ግን ልሙዳት እዮም፡ ናፖሊታን ወይ ክብ ዝበለ ክብ ዝበለ ማንዶሊን፡ እቲ ዝተቐርጸ ላዕለዋይ ማንዶሊንን እቲ ፍላት ዝድገፍ ማንዶሊንን እዮም። እቲ ክቢ-ምብላዕ ዓሚቝ ታሕተዋይ ክፋል ኣለዎ፣ ብቐንጣብ ዕንጨይቲ ዝተሰርሐ፣ ኣብ ሳእኒ ተለጢፉ። እቲ ዝተቐርጸ-ላዕሊ ወይ ቅስትታት-ላዕሊ ማንዶሊን ኣዝዩ ዓሚቝን ቅስትንን ቅስትን ዘለዎ ላዕለዋይ ክፋልን ኣለዎ-ክልቲኦም ካብ ዕንጨይቲ ዝተቐርጹ። እቲ ብፍላት ዝድገፍ ማንዶሊን ንኣካላት ዝኸውን ቀጢን ንጣብ ዕንጨይቲ ይጥቀም፣ ብውሽጢ ብውሽጢ ተንቀሳቒሱ ንሓይሊ ብተመሳሳሊ መንገዲ ምስ ጊታር። ነፍሲ ወከፍ ቅዲ መሳርሒ ናይ ገዛእ ርእሱ ጽሬት ድምጺ ዘለዎ ኮይኑ ምስ ፍሉያት መልክዓት ሙዚቃ ዝተኣሳሰር እዩ። ኒያፖሊታን ማንዶሊን ኣብ ኤውሮጳዊ ክላሲካል ሙዚቃን ባህላዊ ሙዚቃን ብግልጺ ይቐርቡ። ዝተቐርጸ ላዕለዋይ መሳርሒ ኣብ ኣመሪካዊ ህዝባዊ ሙዚቃን ብሉግራስ ሙዚቃን ልሙድ እዩ። ፍላት ዝድገፍ መሳርሒ ኣብ ኣየርላንዳውያን፣ ብሪጣንያውያንን ብራዚልን ህዝባዊ ሙዚቃ ልሙድ እዩ። ገለ ዘመናዊ ብራዚላዊ መሳርሒታት ካብቲ መደበኛ ራብዓይ ኮርስ ሓሙሻይ ደረጃ ንታሕቲ ዝተቓነየ ተወሳኺ ሓሙሻይ ኮርስ ኣለዎም።,ክንደይ ቅዲታት ማንዶሊን ልሙድ እዩ?,ናፖሊታን,ብራዚላዊ,እንግሊዛዊ,ኣርባዕተ
"Computer security, also known as cybersecurity or IT security, is the protection of information systems from theft or damage to the hardware, the software, and to the information on them, as well as from disruption or misdirection of the services they provide. It includes controlling physical access to the hardware, as well as protecting against harm that may come via network access, data and code injection, and due to malpractice by operators, whether intentional, accidental, or due to them being tricked into deviating from secure procedures.",134,What is the acronym for computer security?,cybersecurity,—,—,—,1,ብሳይበር ሴኩሪቲ ወይ IT ድሕንነት ዝፍለጥ ናይ ኮምፒተር ድሕነት፡ ካብ ስርቂ ወይ ኣብ ልዕሊ እቲ ሃርድዌር ዝወርድ ጉድኣት፡ ከምኡ’ውን ኣብ ልዕሊኦም ዘሎ ሓበሬታ፡ ከምኡ’ውን ካብቲ ዝህብዎ ኣገልግሎት፡ ካብ ምዝንባዕ ወይ ብጌጋ ናይቲ ዝህብዎ ኣገልግሎት፡ ምክልኻል ስርዓታት ሓበሬታ እዩ። ንኣካላዊ ምብጻሕ ናይቲ ሃርድዌር ምቁጽጻር፡ ከምኡ’ውን ብመንገዲ መርበብ ሓበሬታ፡ ዳታን ኮድን መርፍእ ክመጽእ ዝኽእል ጉድኣት፡ ከምኡ’ውን ብሰንኪ ስሕተት ብኦፕሬተራት፡ ኮነ ኢልካ፡ ብኣጋጣሚ፡ ወይ ድማ ብሰንኪ ውሑስ ኣገባብ ንምውጻእ ከም ዝታለሉ፡ ካብ ስሕተት ብኦፕሬተራት ምክልኻል የጠቓልል።,ንኮምፒተር ሴኩሪቲ ዝኸውን ኣሕጽሮተ ቃል እንታይ እዩ?,ሳይበር ሴኩሪቲ,—,—,—
"Following the Távora affair, the new Count of Oeiras knew no opposition. Made ""Marquis of Pombal"" in 1770, he effectively ruled Portugal until Joseph I's death in 1779. However, historians also argue that Pombal’s ""enlightenment,"" while far-reaching, was primarily a mechanism for enhancing autocracy at the expense of individual liberty and especially an apparatus for crushing opposition, suppressing criticism, and furthering colonial economic exploitation as well as intensifying book censorship and consolidating personal control and profit.",135,What affair caused the new Count of Oeiras to not oppose?,1779,Joseph,1770,Távora,4,"ድሕሪ ጉዳይ ታቮራ፡ እቲ ሓድሽ ቁጽሪ ኦኤራስ ዝኾነ ተቓውሞ ኣይፈልጥን ነይሩ። ኣብ 1770 ""Marquis of Pombal"" ዝተሰርሐት ኮይና፡ ንፖርቱጋል ብውጽኢታዊ መገዲ ክሳብ ዮሴፍ i ብ1779 ዝሞተት ብውጽኢታዊ መገዲ ገዝኣ።እንተኾነ፡ ጸሓፍቲ ታሪኽ፡ ንፖምቦል ዝሰርሖ ""ምብራህ""፡ ኣዝዩ ርሑቕ እናሃለወ፡ ብቐንዱ ንኣውቶክራሲ ንምትዕርራይ፡ ንውሽጣዊ ምቕጥቃጥ፡ ንምቅራቕ ዝጽዕር፡ ንምፍታው ዝውዕል መሳርሒ፡ ንምትዕጽጻፍ፡ ንምቅራቕ ዝውዕል መሳርሒ፡ ንምትዕጽጻፍ፡ ንኣውቶክራሲ ንምትዕርራይ፡ ንምትዕራቕ፡ ንኣውቶክራሲ ንምትዕርራይ፡ ንምትዕራቕ፡ ንምልዋጥ፡ ንኣውቶክራሲ ከም ዘዕቢ፡ ንምልዋጥ ዝጥቀመሉ ኣገባብ እዩ ነይሩ፡ እዚ ኸኣ፡ ንፖምባል ዝኣመነሉ ኣገባብ ከም ዝከታተሎ’ውን ይማጐቱ። መጽሓፍ ሳንሱርን ምድልዳል ውልቃዊ ምቁጽጻርን መኽሰብን ።",እንታይ ጉዳይ እዩ ነቲ ሓድሽ ቁጽሪ ኦኤራስ ከይቃወም ዝደረኾ?,1779,ዮሴፍ,1770 .,ታቮራ
"Founded to preach the Gospel and to combat heresy, the teaching activity of the order and its scholastic organization placed the Preachers in the forefront of the intellectual life of the Middle Ages. The order is famed for its intellectual tradition, having produced many leading theologians and philosophers. The Dominican Order is headed by the Master of the Order, who is currently Bruno Cadoré. Members of the order generally carry the letters O.P., standing for Ordinis Praedicatorum, meaning of the Order of Preachers, after their names.",136,Who heads the Dominican Order?,Gospel,Dominican,O.P.,the Master of the Order,4,"ወንጌል ንምስባኽን ንመናፍቕነት ንምምካትን ዝተመስረተ ናይ ስርዓት ምምሃር ንጥፈታትን ስኮላስቲክ ትካላቱን ነቶም ሰበኽቲ ኣብ ቅድሚት ናይቲ ኣብ ማእከላይ ዘመን ዝነበረ ምሁራዊ ህይወት ኣቐመጦም። እቲ ስርዓት ብኣእምሮኣዊ ትውፊቱ ዝፍለጥ ኮይኑ፡ ብዙሓት መሪሕ ስነ-መለኮታውያንን ፈላስፋታትን ኣፍርዩ እዩ። እቲ ዶሚኒካን ትእዛዝ ብማስተር ናይቲ ትእዛዝ ዝምራሕ ኮይኑ፡ ንሱ ኣብዚ እዋን ብሩኖ ካዶረ እዩ። ኣባላት ናይቲ ትእዛዝ ብሓፈሻ ነቲ ደብዳቤታት o.p., ደው ዝብል ን ordinis praedicatorum, ትርጉም ናይ ስርዓት ሰበኽቲ, ድሕሪ ኣስማቶም ይሕዙ.",ንዶሚኒካን ትእዛዝ መን ይመርሕ?,ወንጌል,ዶሚኒካን,O.P.,እቲ ጐይታ ናይቲ ትእዛዝ .
"The 2008 Sichuan earthquake or the Great Sichuan earthquake, measured at 8.0 Ms and 7.9 Mw, and occurred at 02:28:01 PM China Standard Time at epicenter (06:28:01 UTC) on May 12 in Sichuan province, killed 69,197 people and left 18,222 missing.",138,How many people are missing from the 2008 quake?,"18,222",Great Sichuan,Sichuan,2008,1,እቲ ኣብ 2008 ዝነበረ ምንቅጥቃጥ ምድሪ ሲቹዋን ወይ ዓቢ ምንቅጥቃጥ ምድሪ ሲቹዋን፡ ኣብ 8.0 ሚ.ሰ.,ካብቲ ናይ 2008 ምንቅጥቃጥ ምድሪ ክንደይ ሰባት ይጎድሉ ኣለዉ?,"18,222",ዓቢ ሲቹዋን,ሲቹዋን,2008 ዓ.ም.
"Compression is useful because it helps reduce resource usage, such as data storage space or transmission capacity. Because compressed data must be decompressed to use, this extra processing imposes computational or other costs through decompression; this situation is far from being a free lunch. Data compression is subject to a space–time complexity trade-off. For instance, a compression scheme for video may require expensive hardware for the video to be decompressed fast enough to be viewed as it is being decompressed, and the option to decompress the video in full before watching it may be inconvenient or require additional storage. The design of data compression schemes involves trade-offs among various factors, including the degree of compression, the amount of distortion introduced (when using lossy data compression), and the computational resources required to compress and decompress the data.",139,What is useful to reduce resource usage?,Compression,mpeg.n.01,crush.n.04,squeeze.n.01,1,ምጽቃጥ ጠቓሚ እዩ ምኽንያቱ ኣጠቓቕማ ሃፍቲ ንምንካይ ስለ ዝሕግዝ፣ ከም ናይ ዳታ መኽዘን ቦታ ወይ ናይ ምትሕልላፍ ዓቕሚ። ዝተጸቕጠ መረዳእታ ንኽጥቀም ክጽቀጥ ስለዘለዎ፡ እዚ ተወሳኺ መስርሕ ብመንገዲ ዲኮምፕረሽን ስሌታዊ ወይ ካልእ ወጻኢታት የስዕብ፤ እዚ ኩነታት እዚ ነጻ ምሳሕ ካብ ምዃን ዝረሓቐ እዩ። ዳታ ምጽቃጥ ንህዋ–ግዜ ዝተሓላለኸ ምትሕውዋስ ይግዛእ። ንኣብነት ንቪድዮ ዝኸውን ናይ ምጽቃጥ ስኬም፡ እቲ ቪድዮ እናተመላለሰ እንከሎ፡ እቲ ቪድዮ ከም ዝቕንጠጥ ምእንቲ ክርአ ዝኽእል ቅልጡፍ ምሕንጣጥ ክሓትት ይኽእል፡ ቅድሚ ምርኣይ ዘይምቹእ ክኸውን ወይ ተወሳኺ መኽዘን ከድልዮ ይኽእል ወይ ድማ ነቲ ቪድዮ ምሉእ ብምሉእ ዲኮምፕረስ ምግባር ዝብል ኣማራጺ። ዲዛይን ናይ ዳታ ምጽቃጥ ስኬማት ኣብ መንጎ ዝተፈላለዩ ረቛሒታት ምትሕውዋስ ዘጠቓልል እዩ፣ እዚ ድማ ደረጃ ምጽቃጥ፣ መጠን ምዝባዕ (ከሳሲ ዳታ ምጽቃጥ ኣብ እንጥቀመሉ እዋን)፣ ከምኡ እውን ነቲ ዳታ ንምፅቃጥን ንምቁፅፃርን ዘድሊ ናይ ስሌታዊ ፀጋታት ሓዊሱ።,ኣጠቓቕማ ሃፍቲ ንምንካይ እንታይ ይጠቅም?,ምጽቃጥ .,MPEG.N.01,crush.n.04,ስኩዊዝ.N.01
"The history of science is the study of the development of science and scientific knowledge, including both the natural sciences and social sciences. (The history of the arts and humanities is termed as the history of scholarship.) Science is a body of empirical, theoretical, and practical knowledge about the natural world, produced by scientists who emphasize the observation, explanation, and prediction of real world phenomena. Historiography of science, in contrast, often draws on the historical methods of both intellectual history and social history.",140,The history of science studies the development of what?,scientific knowledge,—,—,—,1,ታሪኽ ሳይንስ ንመጽናዕቲ ምዕባለ ሳይንስን ሳይንሳዊ ፍልጠትን ማለት ንኽልቲኡ ተፈጥሮኣዊ ሳይንስን ማሕበራዊ ስነ-ፍልጠትን ሓዊሱ እዩ። (ታሪኽ ስነ-ጥበብን ሰብኣዊ ስነ-ፍልጠትን ከም ታሪኽ ምሁርነት ተባሂሉ ይጽዋዕ።) ሳይንስ ብዛዕባ ተፈጥሮኣዊ ዓለም ዝምልከት ተሞክሮኣዊ፡ ክልሰ-ሓሳባውን ግብራዊ ፍልጠትን፡ ንትዕዝብቲ፡ መብርሂን ምግማትን ናይ ሓቀኛ ዓለም ተርእዮታት ዘጉልሑ ተመራመርቲ ስነ-ፍልጠት ዝፍረዩ ሰባት እዩ። ብኣንጻሩ ታሪኽ ስነ-ፍልጠት፡ መብዛሕትኡ ግዜ ካብ ታሪኻዊ ኣገባባት ክልቲኡ ምሁራዊ ታሪኽን ማሕበራዊ ታሪኽን ዝስሕብ እዩ።,ታሪኽ ሳይንስ ንልምዓት እንታይ እዩ ዘጽንዕ?,ሳይንሳዊ ፍልጠት,—,—,—
